ffff880197508300 1452634608 S Co:7:009:0 s 21 09 0306 0001 0002 2 = 0609
ffff880197508300 1452635756 C Co:7:009:0 0 2 >
ffff8801975080c0 1453131147 S Co:7:009:0 s 21 09 0306 0001 0002 2 = 0601
ffff8801975080c0 1453131749 C Co:7:009:0 0 2 >
ffff8800b1e30a80 1453627584 S Co:7:009:0 s 21 09 0306 0001 0002 2 = 0609
ffff8800b1e30a80 1453628725 C Co:7:009:0 0 2 >
ffff880150337240 1454124397 S Co:7:009:0 s 21 09 0306 0001 0002 2 = 0601
ffff880150337240 1454125665 C Co:7:009:0 0 2 >
ffff8800acbf83c0 1454641132 S Co:7:009:0 s 21 09 0306 0001 0002 2 = 0609
ffff8800acbf83c0 1454641651 C Co:7:009:0 0 2 >
ffff880150337c00 1455136992 S Co:7:009:0 s 21 09 0306 0001 0002 2 = 0601
ffff880150337c00 1455137635 C Co:7:009:0 0 2 >
ffff8800acbf8900 1455632118 S Co:7:009:0 s 21 09 0306 0001 0002 2 = 0609
ffff8800acbf8900 1455632621 C Co:7:009:0 0 2 >
ffff8800b1e303c0 1456127813 S Co:7:009:0 s 21 09 0306 0001 0002 2 = 0601
ffff8800b1e303c0 1456128599 C Co:7:009:0 0 2 >
