ffff8800822bb0c0 1231183599 S Ci:7:009:0 s 80 06 0300 0409 0102 258 <
ffff8800822bb0c0 1231184967 C Ci:7:009:0 0 4 = 04030904
ffff8800822bb3c0 1231187937 S Ci:7:009:0 s 80 06 0304 0409 0102 258 <
ffff8800822bb3c0 1231189965 C Ci:7:009:0 0 26 = 1a035500 37003300 2e003000 30005f00 42003000 30003100 3900
ffff8800822bb180 1231193969 S Ci:7:009:0 s 80 06 0300 0409 0102 258 <
ffff8800822bb180 1231194914 C Ci:7:009:0 0 4 = 04030904
ffff8800822bbd80 1231197915 S Ci:7:009:0 s 80 06 0304 0409 0102 258 <
ffff8800822bbd80 1231199965 C Ci:7:009:0 0 26 = 1a035500 37003300 2e003000 30005f00 42003000 30003100 3900
ffff8800822bbcc0 1231202845 S Ci:7:009:0 s 80 06 0300 0409 0102 258 <
ffff8800822bbcc0 1231203966 C Ci:7:009:0 0 4 = 04030904
ffff8800822bb240 1231206932 S Ci:7:009:0 s 80 06 0304 0409 0102 258 <
ffff8800822bb240 1231208964 C Ci:7:009:0 0 26 = 1a035500 37003300 2e003000 30005f00 42003000 30003100 3900
ffff8800822bb240 1231211900 S Co:7:009:0 s 21 09 0308 0001 0007 7 = 08000000 000000
ffff8800822bb240 1231212924 C Co:7:009:0 0 7 >
ffff8800822bbcc0 1231215925 S Co:7:009:0 s 21 09 0306 0001 0002 2 = 0601
ffff8800822bbcc0 1231216966 C Co:7:009:0 0 2 >
ffff8800822bbd80 1231668203 S Co:7:009:0 s 21 09 0200 0000 0001 1 = 01
ffff8800822bbd80 1231668896 C Co:7:009:0 0 1 >
