ffff9b8b941e4cc0 3636922513 S Co:7:002:0 s 21 09 0200 0000 0001 1 = 01
ffff9b8b941e4cc0 3636923125 C Co:7:002:0 0 1 >
ffff9b8a81cc66c0 3638104132 S Ci:7:002:0 s 80 06 0303 0409 0102 258 <
ffff9b8a81cc66c0 3638104851 C Ci:7:002:0 0 26 = 1a033100 38003700 32003300 35003600 36003300 31003300 3000
ffff9b8de3ecc6c0 3638107473 S Ci:7:002:0 s 80 06 0304 0409 0102 258 <
ffff9b8de3ecc6c0 3638107840 C Ci:7:002:0 0 28 = 1c035500 31003000 34002e00 30003000 5f004200 30003000 30003600
ffff9b8de3ecc600 3638111849 S Ci:7:002:0 s 80 06 0303 0409 0102 258 <
ffff9b8de3ecc600 3638112842 C Ci:7:002:0 0 26 = 1a033100 38003700 32003300 35003600 36003300 31003300 3000
ffff9b8de3ecc3c0 3638116243 S Ci:7:002:0 s 80 06 0304 0409 0102 258 <
ffff9b8de3ecc3c0 3638116840 C Ci:7:002:0 0 28 = 1c035500 31003000 34002e00 30003000 5f004200 30003000 30003600
ffff9b8bf9f37180 3638123735 S Ci:7:002:0 s 80 06 0303 0409 0102 258 <
ffff9b8bf9f37180 3638124838 C Ci:7:002:0 0 26 = 1a033100 38003700 32003300 35003600 36003300 31003300 3000
ffff9b8e499e4480 3638128107 S Ci:7:002:0 s 80 06 0304 0409 0102 258 <
ffff9b8e499e4480 3638128845 C Ci:7:002:0 0 28 = 1c035500 31003000 34002e00 30003000 5f004200 30003000 30003600
ffff9b8bf9f37b40 3638136786 S Ci:7:002:0 s 80 06 0303 0409 0102 258 <
ffff9b8bf9f37b40 3638137846 C Ci:7:002:0 0 26 = 1a033100 38003700 32003300 35003600 36003300 31003300 3000
ffff9b8ad5cd1300 3638145674 S Ci:7:002:0 s 80 06 0304 0409 0102 258 <
ffff9b8ad5cd1300 3638145834 C Ci:7:002:0 0 28 = 1c035500 31003000 34002e00 30003000 5f004200 30003000 30003600
ffff9b8e5d606540 3638150366 S Ci:7:002:0 s 80 06 0303 0409 0102 258 <
ffff9b8e5d606540 3638150840 C Ci:7:002:0 0 26 = 1a033100 38003700 32003300 35003600 36003300 31003300 3000
ffff9b8bf2f68600 3638153460 S Ci:7:002:0 s 80 06 0304 0409 0102 258 <
ffff9b8bf2f68600 3638153831 C Ci:7:002:0 0 28 = 1c035500 31003000 34002e00 30003000 5f004200 30003000 30003600
ffff9b8bf2f68900 3638206431 S Ci:7:002:0 s 80 06 0302 0409 00fe 254 <
ffff9b8bf2f68900 3638206822 C Ci:7:002:0 0 42 = 2a034700 61006d00 69006e00 67002000 4b006500 79006200 6f006100 72006400
ffff9b8bf2f68cc0 3638210834 S Ci:7:002:0 s 80 06 0302 0409 00fe 254 <
ffff9b8bf2f68cc0 3638211813 C Ci:7:002:0 0 42 = 2a034700 61006d00 69006e00 67002000 4b006500 79006200 6f006100 72006400
ffff9b8bf2e5b0c0 3638234380 S Co:7:002:0 s 21 09 0211 0001 0014 20 = 11ff001e 00000000 00000000 00000000 00000000
ffff9b8bf2e5b0c0 3638234816 C Co:7:002:0 0 20 >
ffff9b8de4535d80 3638237823 C Ii:7:002:2 0:1 20 = 11ff001e 04020000 00000000 00000000 00000000
ffff9b8b0d552240 3638238461 S Ii:7:002:2 -115:1 64 <
ffff9b8de4473900 3638243080 S Co:7:002:0 s 21 09 0211 0001 0014 20 = 11ff001e 00003900 00000000 00000000 00000000
ffff9b8de4473900 3638243806 C Co:7:002:0 0 20 >
ffff9b8b0d552240 3638246806 C Ii:7:002:2 0:1 20 = 11ff001e 04023900 00000000 00000000 00000000
ffff9b8de44739c0 3638247889 S Ii:7:002:2 -115:1 64 <
ffff9b8de4473900 3638248948 S Co:7:002:0 s 21 09 0211 0001 0014 20 = 11ff000e 00030000 00000000 00000000 00000000
ffff9b8de4473900 3638249803 C Co:7:002:0 0 20 >
ffff9b8de44739c0 3638252808 C Ii:7:002:2 0:1 20 = 11ff000e 02000100 00000000 00000000 00000000
ffff9b8b4bf54d80 3638252931 S Ii:7:002:2 -115:1 64 <
ffff9b8de4473240 3638258034 S Co:7:002:0 s 21 09 0211 0001 0014 20 = 11ff020e 00000000 00000000 00000000 00000000
ffff9b8de4473240 3638258808 C Co:7:002:0 0 20 >
ffff9b8b4bf54d80 3638261801 C Ii:7:002:2 0:1 20 = 11ff020e 02333547 180008c3 33000000 00000000
ffff9b8bf2e5bcc0 3638263026 S Ii:7:002:2 -115:1 64 <
ffff9b8bf2e5bf00 3638265165 S Co:7:002:0 s 21 09 0211 0001 0014 20 = 11ff021e 00000000 00000000 00000000 00000000
ffff9b8bf2e5bf00 3638265806 C Co:7:002:0 0 20 >
ffff9b8bf2e5bcc0 3638268805 C Ii:7:002:2 0:1 20 = 11ff021e 00553120 04000006 01c33300 00000000
ffff9b8bf2e5bcc0 3638269492 S Ii:7:002:2 -115:1 64 <
ffff9b8bf2e5b180 3638271664 S Co:7:002:0 s 21 09 0211 0001 0014 20 = 11ff000e 00050000 00000000 00000000 00000000
ffff9b8bf2e5b180 3638272798 C Co:7:002:0 0 20 >
ffff9b8bf2e5bcc0 3638274796 C Ii:7:002:2 0:1 20 = 11ff000e 04000000 00000000 00000000 00000000
ffff9b8bf2e5b540 3638275979 S Ii:7:002:2 -115:1 64 <
ffff9b8bf2e5bf00 3638279189 S Co:7:002:0 s 21 09 0211 0001 0014 20 = 11ff042e 00000000 00000000 00000000 00000000
ffff9b8bf2e5bf00 3638279796 C Co:7:002:0 0 20 >
ffff9b8bf2e5b540 3638282796 C Ii:7:002:2 0:1 20 = 11ff042e 00000000 00000000 00000000 00000000
ffff9b8a76e75a80 3638282923 S Ii:7:002:2 -115:1 64 <
ffff9b8bf2e5b0c0 3638284252 S Co:7:002:0 s 21 09 0211 0001 0014 20 = 11ff000e 10010000 00000000 00000000 00000000
ffff9b8bf2e5b0c0 3638284831 C Co:7:002:0 0 20 >
ffff9b8a76e75a80 3638287794 C Ii:7:002:2 0:1 20 = 11ff000e 00000000 00000000 00000000 00000000
ffff9b8a76e75a80 3638287932 S Ii:7:002:2 -115:1 64 <
ffff9b8de4473a80 3638288962 S Co:7:002:0 s 21 09 0211 0001 0014 20 = 11ff000e 1f200000 00000000 00000000 00000000
ffff9b8de4473a80 3638289796 C Co:7:002:0 0 20 >
ffff9b8a76e75a80 3638292793 C Ii:7:002:2 0:1 20 = 11ff000e 00000000 00000000 00000000 00000000
ffff9b8a76e75a80 3638292906 S Ii:7:002:2 -115:1 64 <
ffff9b8de4473a80 3638295041 S Co:7:002:0 s 21 09 0211 0001 0014 20 = 11ff000e 10000000 00000000 00000000 00000000
ffff9b8de4473a80 3638295798 C Co:7:002:0 0 20 >
ffff9b8a76e75a80 3638298793 C Ii:7:002:2 0:1 20 = 11ff000e 00000000 00000000 00000000 00000000
ffff9b8b7f07a780 3638298906 S Ii:7:002:2 -115:1 64 <
ffff9b8cd6d9b600 3638322151 S Co:7:002:0 s 21 09 0211 0001 0014 20 = 11ff020e 00000000 00000000 00000000 00000000
ffff9b8cd6d9b600 3638322792 C Co:7:002:0 0 20 >
ffff9b8b7f07a780 3638325789 C Ii:7:002:2 0:1 20 = 11ff020e 02333547 180008c3 33000000 00000000
ffff9b8cd6d9b0c0 3638326225 S Ii:7:002:2 -115:1 64 <
ffff9b8b0d562840 3638332875 S Co:7:002:0 s 21 09 0211 0001 0014 20 = 11ff040e 00000000 00000000 00000000 00000000
ffff9b8b0d562840 3638333788 C Co:7:002:0 0 20 >
ffff9b8cd6d9b0c0 3638336786 C Ii:7:002:2 0:1 20 = 11ff040e 1d000000 00000000 00000000 00000000
ffff9b8cd6d9b0c0 3638337183 S Ii:7:002:2 -115:1 64 <
ffff9b8e3cb690c0 3638341534 S Co:7:002:0 s 21 09 0211 0001 0014 20 = 11ff041e 00000000 00000000 00000000 00000000
ffff9b8e3cb690c0 3638341793 C Co:7:002:0 0 20 >
ffff9b8cd6d9b0c0 3638344783 C Ii:7:002:2 0:1 20 = 11ff041e 4c6f6769 74656368 2047616d 696e6720
ffff9b8e3cb69780 3638345920 S Ii:7:002:2 -115:1 64 <
ffff9b8e3cb69000 3638348114 S Co:7:002:0 s 21 09 0211 0001 0014 20 = 11ff041e 10000000 00000000 00000000 00000000
ffff9b8e3cb69000 3638348783 C Co:7:002:0 0 20 >
ffff9b8e3cb69780 3638351780 C Ii:7:002:2 0:1 20 = 11ff041e 4b657962 6f617264 20473631 30000000
ffff9b8cd6d9b0c0 3638352208 S Ii:7:002:2 -115:1 64 <
ffff9b8e3cb69480 3638355255 S Co:7:002:0 s 21 09 0211 0001 0014 20 = 11ff021e 00000000 00000000 00000000 00000000
ffff9b8e3cb69480 3638355781 C Co:7:002:0 0 20 >
ffff9b8cd6d9b0c0 3638358784 C Ii:7:002:2 0:1 20 = 11ff021e 00553120 04000006 01c33300 00000000
ffff9b8ad629dd80 3638359207 S Ii:7:002:2 -115:1 64 <
ffff9b8ad629d480 3638365825 S Co:7:002:0 s 21 09 0211 0001 0014 20 = 11ff000e 13000000 00000000 00000000 00000000
ffff9b8ad629d480 3638366775 C Co:7:002:0 0 20 >
ffff9b8ad629dd80 3638368776 C Ii:7:002:2 0:1 20 = 11ff000e 00000000 00000000 00000000 00000000
ffff9b8e5d606840 3638369934 S Ii:7:002:2 -115:1 64 <
ffff9b8e5d606480 3638370992 S Co:7:002:0 s 21 09 0211 0001 0014 20 = 11ff000e 40a20000 00000000 00000000 00000000
ffff9b8e5d606480 3638371776 C Co:7:002:0 0 20 >
ffff9b8e5d606840 3638374772 C Ii:7:002:2 0:1 20 = 11ff000e 00000000 00000000 00000000 00000000
ffff9b8bd7be0540 3638376764 S Ii:7:002:2 -115:1 64 <
ffff9b8d6c0d4e40 3638378903 S Co:7:002:0 s 21 09 0211 0001 0014 20 = 11ff000e 80600000 00000000 00000000 00000000
ffff9b8d6c0d4e40 3638379772 C Co:7:002:0 0 20 >
ffff9b8bd7be0540 3638382770 C Ii:7:002:2 0:1 20 = 11ff000e 08000000 00000000 00000000 00000000
ffff9b8cd6d9bd80 3638383189 S Ii:7:002:2 -115:1 64 <
ffff9b8ad629d480 3638389579 S Co:7:002:0 s 21 09 0211 0001 0014 20 = 11ff081e 00000000 00000000 00000000 00000000
ffff9b8ad629d480 3638389770 C Co:7:002:0 0 20 >
ffff9b8cd6d9bd80 3638392770 C Ii:7:002:2 0:1 20 = 11ff081e 01000000 00000000 00000000 00000000
ffff9b8ad629d540 3638393987 S Ii:7:002:2 -115:1 64 <
ffff9b8d1f938d80 3638395059 S Co:7:002:0 s 21 09 0211 0001 0014 20 = 11ff082e 01000000 00000000 00000000 00000000
ffff9b8d1f938d80 3638395768 C Co:7:002:0 0 20 >
ffff9b8ad629d540 3638398766 C Ii:7:002:2 0:1 20 = 11ff082e 00000000 00000000 00000000 00000000
ffff9b8d6c0d4e40 3638398911 S Ii:7:002:2 -115:1 64 <
ffff9b8cdf5b6b40 3638399939 S Co:7:002:0 s 21 09 0211 0001 0014 20 = 11ff000e 80100000 00000000 00000000 00000000
ffff9b8cdf5b6b40 3638400766 C Co:7:002:0 0 20 >
ffff9b8d6c0d4e40 3638403765 C Ii:7:002:2 0:1 20 = 11ff000e 00000000 00000000 00000000 00000000
ffff9b8d6c0d4e40 3638403959 S Ii:7:002:2 -115:1 64 <
ffff9b8cdf5b6180 3638404967 S Co:7:002:0 s 21 09 0211 0001 0014 20 = 11ff000e 80200000 00000000 00000000 00000000
ffff9b8cdf5b6180 3638405765 C Co:7:002:0 0 20 >
ffff9b8d6c0d4e40 3638407771 C Ii:7:002:2 0:1 20 = 11ff000e 00000000 00000000 00000000 00000000
ffff9b8d6c0d4e40 3638407983 S Ii:7:002:2 -115:1 64 <
ffff9b8afc8b2e40 3638409065 S Co:7:002:0 s 21 09 0211 0001 0014 20 = 11ff000e 80300000 00000000 00000000 00000000
ffff9b8afc8b2e40 3638409765 C Co:7:002:0 0 20 >
ffff9b8d6c0d4e40 3638412763 C Ii:7:002:2 0:1 20 = 11ff000e 00000000 00000000 00000000 00000000
ffff9b8afc8b2e40 3638412960 S Ii:7:002:2 -115:1 64 <
ffff9b8ad629d540 3638416556 S Co:7:002:0 s 21 09 0211 0001 0014 20 = 11ff000e 1bc00000 00000000 00000000 00000000
ffff9b8ad629d540 3638416769 C Co:7:002:0 0 20 >
ffff9b8afc8b2e40 3638419762 C Ii:7:002:2 0:1 20 = 11ff000e 0f000000 00000000 00000000 00000000
ffff9b8ad629d480 3638420860 S Ii:7:002:2 -115:1 64 <
ffff9b8ad629d000 3638425131 S Co:7:002:0 s 21 09 0211 0001 0014 20 = 11ff0f2e 00000000 00000000 00000000 00000000
ffff9b8ad629d000 3638425771 C Co:7:002:0 0 20 >
ffff9b8ad629d480 3638428796 C Ii:7:002:2 0:1 20 = 11ff0f2e 00000000 00000000 00000000 00000000
ffff9b8b9758db40 3638429475 S Ii:7:002:2 -115:1 64 <
ffff9b8b9758d300 3638430549 S Co:7:002:0 s 21 09 0211 0001 0014 20 = 11ff0f1e 02000700 3a000000 00000000 00000000
ffff9b8b9758d300 3638430767 C Co:7:002:0 0 20 >
ffff9b8b9758db40 3638433759 C Ii:7:002:2 0:1 20 = 11ff0f1e 02000700 3a000000 00000000 00000000
ffff9b8b9758dc00 3638434923 S Ii:7:002:2 -115:1 64 <
ffff9b8b9758d840 3638436032 S Co:7:002:0 s 21 09 0211 0001 0014 20 = 11ff0f1e 02000700 3b000000 00000000 00000000
ffff9b8b9758d840 3638436759 C Co:7:002:0 0 20 >
ffff9b8b9758dc00 3638439758 C Ii:7:002:2 0:1 20 = 11ff0f1e 02000700 3b000000 00000000 00000000
ffff9b8de4473600 3638440158 S Ii:7:002:2 -115:1 64 <
ffff9b8e4dbaf600 3638441598 S Co:7:002:0 s 21 09 0211 0001 0014 20 = 11ff0f1e 02000700 3c000000 00000000 00000000
ffff9b8e4dbaf600 3638442758 C Co:7:002:0 0 20 >
ffff9b8de4473600 3638444762 C Ii:7:002:2 0:1 20 = 11ff0f1e 02000700 3c000000 00000000 00000000
ffff9b8e4dbaf840 3638449432 S Ii:7:002:2 -115:1 64 <
ffff9b8e4dbafcc0 3638449498 S Co:7:002:0 s 21 09 0211 0001 0014 20 = 11ff0f1e 02000700 3d000000 00000000 00000000
ffff9b8e4dbafcc0 3638449765 C Co:7:002:0 0 20 >
ffff9b8e4dbaf840 3638452761 C Ii:7:002:2 0:1 20 = 11ff0f1e 02000700 3d000000 00000000 00000000
ffff9b8e5b4f1300 3638452884 S Ii:7:002:2 -115:1 64 <
ffff9b8e4dbaff00 3638455339 S Co:7:002:0 s 21 09 0211 0001 0014 20 = 11ff0f1e 02000700 3e000000 00000000 00000000
ffff9b8e4dbaff00 3638455761 C Co:7:002:0 0 20 >
ffff9b8e5b4f1300 3638458760 C Ii:7:002:2 0:1 20 = 11ff0f1e 02000700 3e000000 00000000 00000000
ffff9b8e5b4f1300 3638458883 S Ii:7:002:2 -115:1 64 <
ffff9b8e4dbaff00 3638461336 S Co:7:002:0 s 21 09 0211 0001 0014 20 = 11ff0f1e 02000700 3f000000 00000000 00000000
ffff9b8e4dbaff00 3638461762 C Co:7:002:0 0 20 >
ffff9b8e5b4f1300 3638464760 C Ii:7:002:2 0:1 20 = 11ff0f1e 02000700 3f000000 00000000 00000000
ffff9b8afc8b1180 3638464879 S Ii:7:002:2 -115:1 64 <
ffff9b8bf7ffa780 3638466249 S Co:7:002:0 s 21 09 0211 0001 0014 20 = 11ff0f1e 02000700 40000000 00000000 00000000
ffff9b8bf7ffa780 3638466752 C Co:7:002:0 0 20 >
ffff9b8afc8b1180 3638469751 C Ii:7:002:2 0:1 20 = 11ff0f1e 02000700 40000000 00000000 00000000
ffff9b8e542ad540 3638471178 S Ii:7:002:2 -115:1 64 <
ffff9b8b4a853b40 3638472270 S Co:7:002:0 s 21 09 0211 0001 0014 20 = 11ff0f1e 02000700 41000000 00000000 00000000
ffff9b8b4a853b40 3638472752 C Co:7:002:0 0 20 >
ffff9b8e542ad540 3638475757 C Ii:7:002:2 0:1 20 = 11ff0f1e 02000700 41000000 00000000 00000000
ffff9b8bf7ffab40 3638476163 S Ii:7:002:2 -115:1 64 <
ffff9b8d1f938f00 3638477288 S Co:7:002:0 s 21 09 0211 0001 0014 20 = 11ff0f1e 02000700 42000000 00000000 00000000
ffff9b8d1f938f00 3638477749 C Co:7:002:0 0 20 >
ffff9b8bf7ffab40 3638480748 C Ii:7:002:2 0:1 20 = 11ff0f1e 02000700 42000000 00000000 00000000
ffff9b8d1f938c00 3638481836 S Ii:7:002:2 -115:1 64 <
ffff9b8d1f938f00 3638484817 S Co:7:002:0 s 21 09 0211 0001 0014 20 = 11ff0f1e 02000700 43000000 00000000 00000000
ffff9b8d1f938f00 3638485756 C Co:7:002:0 0 20 >
ffff9b8d1f938c00 3638487783 C Ii:7:002:2 0:1 20 = 11ff0f1e 02000700 43000000 00000000 00000000
ffff9b8b4c31da80 3638488201 S Ii:7:002:2 -115:1 64 <
ffff9b8e4dbaf840 3638490439 S Co:7:002:0 s 21 09 0211 0001 0014 20 = 11ff0f1e 02000700 44000000 00000000 00000000
ffff9b8e4dbaf840 3638490746 C Co:7:002:0 0 20 >
ffff9b8b4c31da80 3638493753 C Ii:7:002:2 0:1 20 = 11ff0f1e 02000700 44000000 00000000 00000000
ffff9b8e4dbafcc0 3638494853 S Ii:7:002:2 -115:1 64 <
ffff9b8e4dbaf600 3638497367 S Co:7:002:0 s 21 09 0211 0001 0014 20 = 11ff0f1e 02000700 45000000 00000000 00000000
ffff9b8e4dbaf600 3638497753 C Co:7:002:0 0 20 >
ffff9b8e4dbafcc0 3638500743 C Ii:7:002:2 0:1 20 = 11ff0f1e 02000700 45000000 00000000 00000000
ffff9b8bca37e180 3638501862 S Ii:7:002:2 -115:1 64 <
ffff9b8a746bd780 3638526888 S Co:7:002:0 s 21 09 0211 0001 0014 20 = 11ff000e 80700000 00000000 00000000 00000000
ffff9b8a746bd780 3638527745 C Co:7:002:0 0 20 >
ffff9b8bca37e180 3638530737 C Ii:7:002:2 0:1 20 = 11ff000e 0d000300 00000000 00000000 00000000
ffff9b8b0d9eb900 3638531168 S Ii:7:002:2 -115:1 64 <
ffff9b8bf7ffab40 3638532592 S Co:7:002:0 s 21 09 0211 0001 0014 20 = 11ff0d0e 00000000 00000000 00000000 00000000
ffff9b8bf7ffab40 3638533743 C Co:7:002:0 0 20 >
ffff9b8b0d9eb900 3638535735 C Ii:7:002:2 0:1 20 = 11ff0d0e 02000100 08000000 00000000 00000000
ffff9b8bf7ffae40 3638536987 S Ii:7:002:2 -115:1 64 <
ffff9b8bf7ffa300 3638538097 S Co:7:002:0 s 21 09 0211 0001 0014 20 = 11ff0d1e 00000000 00000000 00000000 00000000
ffff9b8bf7ffa300 3638538742 C Co:7:002:0 0 20 >
ffff9b8bf7ffae40 3638541740 C Ii:7:002:2 0:1 20 = 11ff0d1e 00000106 00000000 00000000 00000000
ffff9b8bf7ffac00 3638542492 S Ii:7:002:2 -115:1 64 <
ffff9b8c002bf480 3638544459 S Co:7:002:0 s 21 09 0211 0001 0014 20 = 11ff0d2e 00000000 00000000 00000000 00000000
ffff9b8c002bf480 3638544735 C Co:7:002:0 0 20 >
ffff9b8bf7ffac00 3638547739 C Ii:7:002:2 0:1 20 = 11ff0d2e 00000000 00000000 00000000 00000000
ffff9b8b0d9eb900 3638548966 S Ii:7:002:2 -115:1 64 <
ffff9b8b0d9eb240 3638550262 S Co:7:002:0 s 21 09 0211 0001 0014 20 = 11ff0d2e 00010000 00000000 00000000 00000000
ffff9b8b0d9eb240 3638550738 C Co:7:002:0 0 20 >
ffff9b8b0d9eb900 3638553736 C Ii:7:002:2 0:1 20 = 11ff0d2e 00010001 00050000 00000000 00000000
ffff9b8b0d9ebc00 3638554483 S Ii:7:002:2 -115:1 64 <
ffff9b8b0d9eb000 3638555599 S Co:7:002:0 s 21 09 0211 0001 0014 20 = 11ff0d2e 00020000 00000000 00000000 00000000
ffff9b8b0d9eb000 3638556738 C Co:7:002:0 0 20 >
ffff9b8b0d9ebc00 3638558728 C Ii:7:002:2 0:1 20 = 11ff0d2e 0002000a c00103e0 00000000 00000000
ffff9b8b0d9eb900 3638559835 S Ii:7:002:2 -115:1 64 <
ffff9b8b0d9eb240 3638560941 S Co:7:002:0 s 21 09 0211 0001 0014 20 = 11ff0d2e 00030000 00000000 00000000 00000000
ffff9b8b0d9eb240 3638561729 C Co:7:002:0 0 20 >
ffff9b8b0d9eb900 3638564763 C Ii:7:002:2 0:1 20 = 11ff0d2e 00030004 dce1001e 00000000 00000000
ffff9b8bf7ffa780 3638565183 S Ii:7:002:2 -115:1 64 <
ffff9b8b0d9eb900 3638566397 S Co:7:002:0 s 21 09 0211 0001 0014 20 = 11ff0d2e 00040000 00000000 00000000 00000000
ffff9b8b0d9eb900 3638566733 C Co:7:002:0 0 20 >
ffff9b8bf7ffa780 3638569726 C Ii:7:002:2 0:1 20 = 11ff0d2e 00040005 00000000 00000000 00000000
ffff9b8b0d9eb240 3638571020 S Ii:7:002:2 -115:1 64 <
ffff9b8e59c02e40 3638572266 S Co:7:002:0 s 21 09 0211 0001 0014 20 = 11ff0d2e 00050000 00000000 00000000 00000000
ffff9b8e59c02e40 3638572726 C Co:7:002:0 0 20 >
ffff9b8b0d9eb240 3638575730 C Ii:7:002:2 0:1 20 = 11ff0d2e 0005000b 00000000 00000000 00000000
ffff9b8e59c02e40 3638577004 S Ii:7:002:2 -115:1 64 <
ffff9b8e3f59f900 3638578070 S Co:7:002:0 s 21 09 0211 0001 0014 20 = 11ff0d1e 01000000 00000000 00000000 00000000
ffff9b8e3f59f900 3638578729 C Co:7:002:0 0 20 >
ffff9b8e59c02e40 3638581722 C Ii:7:002:2 0:1 20 = 11ff0d1e 01000203 00000000 00000000 00000000
ffff9b8bffc0ee40 3638582444 S Ii:7:002:2 -115:1 64 <
ffff9b8e4dbaf600 3638584498 S Co:7:002:0 s 21 09 0211 0001 0014 20 = 11ff0d2e 01000000 00000000 00000000 00000000
ffff9b8e4dbaf600 3638584726 C Co:7:002:0 0 20 >
ffff9b8bffc0ee40 3638587722 C Ii:7:002:2 0:1 20 = 11ff0d2e 01000000 00000000 00000000 00000000
ffff9b8bf7ffa780 3638589120 S Ii:7:002:2 -115:1 64 <
ffff9b8bf7ffa540 3638591316 S Co:7:002:0 s 21 09 0211 0001 0014 20 = 11ff0d2e 01010000 00000000 00000000 00000000
ffff9b8bf7ffa540 3638591727 C Co:7:002:0 0 20 >
ffff9b8bf7ffa780 3638594726 C Ii:7:002:2 0:1 20 = 11ff0d2e 01010001 00050000 00000000 00000000
ffff9b8bf7ffa180 3638595680 S Ii:7:002:2 -115:1 64 <
ffff9b8bf7ffacc0 3638597870 S Co:7:002:0 s 21 09 0211 0001 0014 20 = 11ff0d2e 01020000 00000000 00000000 00000000
ffff9b8bf7ffacc0 3638598722 C Co:7:002:0 0 20 >
ffff9b8bf7ffa180 3638601726 C Ii:7:002:2 0:1 20 = 11ff0d2e 0102000a c00103e0 00000000 00000000
ffff9b8c002bf480 3638602120 S Ii:7:002:2 -115:1 64 <
ffff9b8bf7ffa240 3638603846 S Co:7:002:0 s 21 09 0211 0001 0014 20 = 11ff000e 80700000 00000000 00000000 00000000
ffff9b8bf7ffa240 3638604720 C Co:7:002:0 0 20 >
ffff9b8c002bf480 3638607725 C Ii:7:002:2 0:1 20 = 11ff000e 0d000300 00000000 00000000 00000000
ffff9b8bf7ffa240 3638608618 S Ii:7:002:2 -115:1 64 <
ffff9b8bf7ffa180 3638610028 S Co:7:002:0 s 21 09 0211 0001 0014 20 = 11ff000e 80800000 00000000 00000000 00000000
ffff9b8bf7ffa180 3638610725 C Co:7:002:0 0 20 >
ffff9b8bf7ffa240 3638613723 C Ii:7:002:2 0:1 20 = 11ff000e 0c000000 00000000 00000000 00000000
ffff9b8bf7ffacc0 3638614187 S Ii:7:002:2 -115:1 64 <
ffff9b8bf7ffa780 3638617501 S Co:7:002:0 s 21 09 0211 0001 0014 20 = 11ff000e 45220000 00000000 00000000 00000000
ffff9b8bf7ffa780 3638617718 C Co:7:002:0 0 20 >
ffff9b8bf7ffacc0 3638620723 C Ii:7:002:2 0:1 20 = 11ff000e 03000000 00000000 00000000 00000000
ffff9b8bf7ffa540 3638621838 S Ii:7:002:2 -115:1 64 <
ffff9b8e2fc2e480 3638628054 S Co:7:002:0 s 21 09 0211 0001 0014 20 = 11ff033e 00000000 00000000 00000000 00000000
ffff9b8e2fc2e480 3638628721 C Co:7:002:0 0 20 >
ffff9b8bf7ffa540 3638631719 C Ii:7:002:2 0:1 20 = 11ff033e 00000000 00000000 00000000 00000000
ffff9b8e2fc2e480 3638632363 S Ii:7:002:2 -115:1 64 <
ffff9b8bde1fca80 3638633583 S Co:7:002:0 s 21 09 0211 0001 0014 20 = 11ff033e 00000000 00000000 00000000 00000000
ffff9b8bde1fca80 3638634712 C Co:7:002:0 0 20 >
ffff9b8e2fc2e480 3638636711 C Ii:7:002:2 0:1 20 = 11ff033e 00000000 00000000 00000000 00000000
ffff9b8bde1fcf00 3638637784 S Ii:7:002:2 -115:1 64 <
ffff9b8bde1fce40 3638638784 S Co:7:002:0 s 21 09 0211 0001 0014 20 = 11ff031e 00000000 00000000 00000000 00000000
ffff9b8bde1fce40 3638639710 C Co:7:002:0 0 20 >
ffff9b8bde1fcf00 3638641709 C Ii:7:002:2 0:1 20 = 11ff031e 00000000 00000000 00000000 00000000
ffff9b8b03a8a6c0 3638642134 S Ii:7:002:2 -115:1 64 <
ffff9b8c61a3f9c0 3638644498 S Co:7:002:0 s 21 09 0211 0001 0014 20 = 11ff0c0e 00000000 00000000 00000000 00000000
ffff9b8c61a3f9c0 3638644710 C Co:7:002:0 0 20 >
ffff9b8b03a8a6c0 3638647714 C Ii:7:002:2 0:1 20 = 11ff0c0e 00530000 02000100 00000000 00000000
ffff9b8c61a3f300 3638648898 S Ii:7:002:2 -115:1 64 <
ffff9b8c78880900 3638651131 S Co:7:002:0 s 21 09 0211 0001 0014 20 = 11ff0d0e 00000000 00000000 00000000 00000000
ffff9b8c78880900 3638651713 C Co:7:002:0 0 20 >
ffff9b8c61a3f300 3638654711 C Ii:7:002:2 0:1 20 = 11ff0d0e 02000100 08000000 00000000 00000000
ffff9b8b03a8a6c0 3638655132 S Ii:7:002:2 -115:1 64 <
ffff9b8bf7ffa180 3638684632 S Co:7:002:0 s 21 09 0211 0001 0014 20 = 11ff0d0e 00000000 00000000 00000000 00000000
ffff9b8bf7ffa180 3638685710 C Co:7:002:0 0 20 >
ffff9b8b03a8a6c0 3638687709 C Ii:7:002:2 0:1 20 = 11ff0d0e 02000100 08000000 00000000 00000000
ffff9b8bf7ffa180 3638689763 S Ii:7:002:2 -115:1 64 <
ffff9b8bf7ffa540 3638689894 S Co:7:002:0 s 21 09 0211 0001 0014 20 = 11ff0d1e 00000000 00000000 00000000 00000000
ffff9b8bf7ffa540 3638690699 C Co:7:002:0 0 20 >
ffff9b8bf7ffa180 3638693702 C Ii:7:002:2 0:1 20 = 11ff0d1e 00000106 00000000 00000000 00000000
ffff9b8bf7ffa180 3638694664 S Ii:7:002:2 -115:1 64 <
ffff9b8bf7ffa540 3638695773 S Co:7:002:0 s 21 09 0211 0001 0014 20 = 11ff0d2e 00000000 00000000 00000000 00000000
ffff9b8bf7ffa540 3638696702 C Co:7:002:0 0 20 >
ffff9b8bf7ffa180 3638699695 C Ii:7:002:2 0:1 20 = 11ff0d2e 00000000 00000000 00000000 00000000
ffff9b8b0d9ebc00 3638699812 S Ii:7:002:2 -115:1 64 <
ffff9b8a580370c0 3638701273 S Co:7:002:0 s 21 09 0211 0001 0014 20 = 11ff0d2e 00010000 00000000 00000000 00000000
ffff9b8a580370c0 3638701700 C Co:7:002:0 0 20 >
ffff9b8b0d9ebc00 3638704730 C Ii:7:002:2 0:1 20 = 11ff0d2e 00010001 00050000 00000000 00000000
ffff9b8b0d9ebc00 3638704847 S Ii:7:002:2 -115:1 64 <
ffff9b8a58037600 3638706200 S Co:7:002:0 s 21 09 0211 0001 0014 20 = 11ff0d2e 00020000 00000000 00000000 00000000
ffff9b8a58037600 3638706701 C Co:7:002:0 0 20 >
ffff9b8b0d9ebc00 3638709692 C Ii:7:002:2 0:1 20 = 11ff0d2e 0002000a c00103e0 00000000 00000000
ffff9b8b0d9ebc00 3638709840 S Ii:7:002:2 -115:1 64 <
ffff9b8a580376c0 3638711186 S Co:7:002:0 s 21 09 0211 0001 0014 20 = 11ff0d2e 00030000 00000000 00000000 00000000
ffff9b8a580376c0 3638711698 C Co:7:002:0 0 20 >
ffff9b8b0d9ebc00 3638714692 C Ii:7:002:2 0:1 20 = 11ff0d2e 00030004 dce1001e 00000000 00000000
ffff9b8b0d9ebc00 3638714890 S Ii:7:002:2 -115:1 64 <
ffff9b8a58037180 3638716174 S Co:7:002:0 s 21 09 0211 0001 0014 20 = 11ff0d2e 00040000 00000000 00000000 00000000
ffff9b8a58037180 3638716697 C Co:7:002:0 0 20 >
ffff9b8b0d9ebc00 3638719698 C Ii:7:002:2 0:1 20 = 11ff0d2e 00040005 00000000 00000000 00000000
ffff9b8b0d9ebc00 3638719898 S Ii:7:002:2 -115:1 64 <
ffff9b8a58037e40 3638721179 S Co:7:002:0 s 21 09 0211 0001 0014 20 = 11ff0d2e 00050000 00000000 00000000 00000000
ffff9b8a58037e40 3638721725 C Co:7:002:0 0 20 >
ffff9b8b0d9ebc00 3638724692 C Ii:7:002:2 0:1 20 = 11ff0d2e 0005000b 00000000 00000000 00000000
ffff9b8b0d9ebc00 3638724883 S Ii:7:002:2 -115:1 64 <
ffff9b8b0d9eb000 3638726005 S Co:7:002:0 s 21 09 0211 0001 0014 20 = 11ff0d1e 01000000 00000000 00000000 00000000
ffff9b8b0d9eb000 3638726688 C Co:7:002:0 0 20 >
ffff9b8b0d9ebc00 3638729688 C Ii:7:002:2 0:1 20 = 11ff0d1e 01000203 00000000 00000000 00000000
ffff9b8b0d9ebc00 3638729884 S Ii:7:002:2 -115:1 64 <
ffff9b8a58037e40 3638732142 S Co:7:002:0 s 21 09 0211 0001 0014 20 = 11ff0d2e 01000000 00000000 00000000 00000000
ffff9b8a58037e40 3638732688 C Co:7:002:0 0 20 >
ffff9b8b0d9ebc00 3638735685 C Ii:7:002:2 0:1 20 = 11ff0d2e 01000000 00000000 00000000 00000000
ffff9b8b0d9ebc00 3638735894 S Ii:7:002:2 -115:1 64 <
ffff9b8a58037180 3638739488 S Co:7:002:0 s 21 09 0211 0001 0014 20 = 11ff0d2e 01010000 00000000 00000000 00000000
ffff9b8a58037180 3638739686 C Co:7:002:0 0 20 >
ffff9b8b0d9ebc00 3638742690 C Ii:7:002:2 0:1 20 = 11ff0d2e 01010001 00050000 00000000 00000000
ffff9b8d8ac07540 3638743424 S Ii:7:002:2 -115:1 64 <
ffff9b8d8ac07b40 3638745560 S Co:7:002:0 s 21 09 0211 0001 0014 20 = 11ff0d2e 01020000 00000000 00000000 00000000
ffff9b8d8ac07b40 3638746682 C Co:7:002:0 0 20 >
ffff9b8d8ac07540 3638748682 C Ii:7:002:2 0:1 20 = 11ff0d2e 0102000a c00103e0 00000000 00000000
ffff9b8d8ac07b40 3638749855 S Ii:7:002:2 -115:1 64 <
ffff9b8d8ac07c00 3638764576 S Co:7:002:0 s 21 09 0211 0001 0014 20 = 11ff0c0e 00000000 00000000 00000000 00000000
ffff9b8d8ac07c00 3638765680 C Co:7:002:0 0 20 >
ffff9b8d8ac07b40 3638767678 C Ii:7:002:2 0:1 20 = 11ff0c0e 00530000 02000100 00000000 00000000
ffff9b8d8ac07900 3638768999 S Ii:7:002:2 -115:1 64 <
ffff9b8d8ac07b40 3638779502 S Co:7:002:0 s 21 09 0211 0001 0014 20 = 11ff0c0e 00000000 00000000 00000000 00000000
ffff9b8d8ac07b40 3638779676 C Co:7:002:0 0 20 >
ffff9b8d8ac07900 3638782675 C Ii:7:002:2 0:1 20 = 11ff0c0e 00530000 02000100 00000000 00000000
ffff9b8d8ac07c00 3638783867 S Ii:7:002:2 -115:1 64 <
ffff9b8d8ac07540 3638786020 S Co:7:002:0 s 21 09 0211 0001 0014 20 = 11ff0c1e 00010000 00000000 00000000 00000000
ffff9b8d8ac07540 3638786682 C Co:7:002:0 0 20 >
ffff9b8d8ac07c00 3638789672 C Ii:7:002:2 0:1 20 = 11ff0c1e 0069ffff 00000000 00000000 00000000
ffff9b8d8ac07c00 3638789841 S Ii:7:002:2 -115:1 64 <
ffff9b8d8ac07540 3638791967 S Co:7:002:0 s 21 09 0211 0001 0014 20 = 11ff0c2e 00010000 00000000 00000000 00000000
ffff9b8d8ac07540 3638792679 C Co:7:002:0 0 20 >
ffff9b8d8ac07c00 3638795671 C Ii:7:002:2 0:1 64 = 12ff0c2e 00010000 044b4b4b 05ececec 068f8f8f 078f8f8f 088f8f8f 09bababa
ffff9b8d8ac07c00 3638795789 S Ii:7:002:2 -115:1 64 <
ffff9b8d8ac07540 3638797941 S Co:7:002:0 s 21 09 0211 0001 0014 20 = 11ff0c2e 0001000e 00000000 00000000 00000000
ffff9b8d8ac07540 3638798671 C Co:7:002:0 0 20 >
ffff9b8d8ac07c00 3638801677 C Ii:7:002:2 0:1 64 = 12ff0c2e 0001000e 12626262 13444444 144b4b4b 15bababa 166a6a6a 17ececec
ffff9b8d8ac07900 3638803415 S Ii:7:002:2 -115:1 64 <
ffff9b8b4b8f46c0 3638804758 S Co:7:002:0 s 21 09 0211 0001 0014 20 = 11ff0c2e 0001001c 00000000 00000000 00000000
ffff9b8b4b8f46c0 3638805671 C Co:7:002:0 0 20 >
ffff9b8d8ac07900 3638807670 C Ii:7:002:2 0:1 64 = 12ff0c2e 0001001c 20878787 21b1b1b1 22e1e1e1 23eaeaea 24b8b8b8 258d8d8d
ffff9b8b4b8f46c0 3638808083 S Ii:7:002:2 -115:1 64 <
ffff9b8c78880600 3638809973 S Co:7:002:0 s 21 09 0211 0001 0014 20 = 11ff0c2e 0001002a 00000000 00000000 00000000
ffff9b8c78880600 3638810669 C Co:7:002:0 0 20 >
ffff9b8b4b8f46c0 3638813668 C Ii:7:002:2 0:1 64 = 12ff0c2e 0001002a 2e1d1d1d 2f313131 301d1d1d 31000000 321d1d1d 334a4a4a
ffff9b8cdcf77900 3638813873 S Ii:7:002:2 -115:1 64 <
ffff9b8c788806c0 3638815963 S Co:7:002:0 s 21 09 0211 0001 0014 20 = 11ff0c2e 00010038 00000000 00000000 00000000
ffff9b8c788806c0 3638816675 C Co:7:002:0 0 20 >
ffff9b8cdcf77900 3638819666 C Ii:7:002:2 0:1 64 = 12ff0c2e 00010038 3cb1b1b1 3de1e1e1 3eb8b8b8 3f8d8d8d 40696969 414a4a4a
ffff9b8c78880b40 3638820274 S Ii:7:002:2 -115:1 64 <
ffff9b8c78880240 3638821513 S Co:7:002:0 s 21 09 0211 0001 0014 20 = 11ff0c2e 00010046 00000000 00000000 00000000
ffff9b8c78880240 3638821668 C Co:7:002:0 0 20 >
ffff9b8c78880b40 3638824665 C Ii:7:002:2 0:1 64 = 12ff0c2e 00010046 4a010101 4b000000 4c070707 4d010101 4e000000 4f000000
ffff9b8c78880480 3638825693 S Ii:7:002:2 -115:1 64 <
ffff9b8c78880780 3638826829 S Co:7:002:0 s 21 09 0211 0001 0014 20 = 11ff0c2e 00010054 00000000 00000000 00000000
ffff9b8c78880780 3638827702 C Co:7:002:0 0 20 >
ffff9b8c78880480 3638830677 C Ii:7:002:2 0:1 64 = 12ff0c2e 00010054 580e0e0e 59000000 5a010101 5b050505 5c000000 5d010101
ffff9b8d8ac07b40 3638831126 S Ii:7:002:2 -115:1 64 <
ffff9b8c788800c0 3638832297 S Co:7:002:0 s 21 09 0211 0001 0014 20 = 11ff0c2e 00010062 00000000 00000000 00000000
ffff9b8c788800c0 3638832675 C Co:7:002:0 0 20 >
ffff9b8d8ac07b40 3638835666 C Ii:7:002:2 0:1 64 = 12ff0c2e 00010062 87000000 886e6e6e 89000000 8a000000 8b000000 e02a2a2a
ffff9b8e3cb69f00 3638836821 S Ii:7:002:2 -115:1 64 <
ffff9b8d8ac07c00 3638839414 S Co:7:002:0 s 21 09 0211 0001 0014 20 = 11ff0c1e 00020000 00000000 00000000 00000000
ffff9b8d8ac07c00 3638839664 C Co:7:002:0 0 20 >
ffff9b8e3cb69f00 3638842671 C Ii:7:002:2 0:1 20 = 11ff0c1e 0005ff00 00000000 00000000 00000000
ffff9b8b4b8f46c0 3638843266 S Ii:7:002:2 -115:1 64 <
ffff9b8bfad8f9c0 3638845426 S Co:7:002:0 s 21 09 0211 0001 0014 20 = 11ff0c2e 00020000 00000000 00000000 00000000
ffff9b8bfad8f9c0 3638845660 C Co:7:002:0 0 20 >
ffff9b8b4b8f46c0 3638848659 C Ii:7:002:2 0:1 64 = 12ff0c2e 00020000 cd000000 b6040404 b50c0c0c b7000000 e2000000 00000000
ffff9b8bfad8fcc0 3638849798 S Ii:7:002:2 -115:1 64 <
ffff9b8bfad8f540 3638852160 S Co:7:002:0 s 21 09 0211 0001 0014 20 = 11ff0c1e 00100000 00000000 00000000 00000000
ffff9b8bfad8f540 3638852659 C Co:7:002:0 0 20 >
ffff9b8bfad8fcc0 3638855657 C Ii:7:002:2 0:1 20 = 11ff0c1e 0001ff00 00000000 00000000 00000000
ffff9b8c78880240 3638856405 S Ii:7:002:2 -115:1 64 <
ffff9b8c78880600 3638857409 S Co:7:002:0 s 21 09 0211 0001 0014 20 = 11ff0c2e 00100000 00000000 00000000 00000000
ffff9b8c78880600 3638857665 C Co:7:002:0 0 20 >
ffff9b8c78880240 3638860657 C Ii:7:002:2 0:1 64 = 12ff0c2e 00100000 01000000 00000000 00000000 00000000 00000000 00000000
ffff9b8c78880540 3638861680 S Ii:7:002:2 -115:1 64 <
ffff9b8c78880180 3638862744 S Co:7:002:0 s 21 09 0211 0001 0014 20 = 11ff0c1e 00400000 00000000 00000000 00000000
ffff9b8c78880180 3638863693 C Co:7:002:0 0 20 >
ffff9b8c78880540 3638866655 C Ii:7:002:2 0:1 20 = 11ff0c1e 0005ff00 00000000 00000000 00000000
ffff9b8c68afc540 3638866810 S Ii:7:002:2 -115:1 64 <
ffff9b8c78880900 3638867871 S Co:7:002:0 s 21 09 0211 0001 0014 20 = 11ff0c2e 00400000 00000000 00000000 00000000
ffff9b8c78880900 3638868655 C Co:7:002:0 0 20 >
ffff9b8c68afc540 3638871654 C Ii:7:002:2 0:1 64 = 12ff0c2e 00400000 01ffffff 02000000 03000000 04000000 05ffffff 00000000
ffff9b8bfad8ff00 3638872067 S Ii:7:002:2 -115:1 64 <
ffff9b8c78880900 3638876422 S Co:7:002:0 s 21 09 0211 0001 0014 20 = 11ff0c0e 00000000 00000000 00000000 00000000
ffff9b8c78880900 3638876662 C Co:7:002:0 0 20 >
ffff9b8bfad8ff00 3638879662 C Ii:7:002:2 0:1 20 = 11ff0c0e 00530000 02000100 00000000 00000000
ffff9b8c78880540 3638883398 S Ii:7:002:2 -115:1 64 <
ffff9b8c78880180 3638885558 S Co:7:002:0 s 21 09 0211 0001 0014 20 = 11ff0c4e 0040ffff ff000000 00000000 00000000
ffff9b8c78880180 3638886666 C Co:7:002:0 0 20 >
ffff9b8c78880540 3638888653 C Ii:7:002:2 0:1 20 = 11ff0c4e 0040ffff ff000000 00000000 00000000
ffff9b8aaeaac240 3638890259 S Ii:7:002:2 -115:1 64 <
ffff9b8aaeaacf00 3638891231 S Co:7:002:0 s 21 09 0211 0001 0014 20 = 11ff0c5e 00000000 00000000 00000000 00000000
ffff9b8aaeaacf00 3638891656 C Co:7:002:0 0 20 >
ffff9b8aaeaac240 3638894655 C Ii:7:002:2 0:1 20 = 11ff0c5e 00000000 00000000 00000000 00000000
ffff9b8bfad8ff00 3638894871 S Ii:7:002:2 -115:1 64 <
ffff9b8dec1f9d80 3638895918 S Co:7:002:0 s 21 09 0211 0001 0014 20 = 11ff0c4e 0002ffff ff000000 00000000 00000000
ffff9b8dec1f9d80 3638896648 C Co:7:002:0 0 20 >
ffff9b8bfad8ff00 3638899662 C Ii:7:002:2 0:1 20 = 11ff0c4e 0002ffff ff000000 00000000 00000000
ffff9b8c78880600 3638899800 S Ii:7:002:2 -115:1 64 <
ffff9b8bfad8f300 3638900846 S Co:7:002:0 s 21 09 0211 0001 0014 20 = 11ff0c5e 00000000 00000000 00000000 00000000
ffff9b8bfad8f300 3638901654 C Co:7:002:0 0 20 >
ffff9b8c78880600 3638904645 C Ii:7:002:2 0:1 20 = 11ff0c5e 00000000 00000000 00000000 00000000
ffff9b8bf7ffa780 3638905457 S Ii:7:002:2 -115:1 64 <
ffff9b8aaeaace40 3638928435 S Co:7:002:0 s 21 09 0211 0001 0014 20 = 11ff0d3e 00030000 00000000 d0016407 00000000
ffff9b8aaeaace40 3638928650 C Co:7:002:0 0 20 >
ffff9b8bf7ffa780 3638931646 C Ii:7:002:2 0:1 20 = 11ff0d3e 00000000 00000000 00000000 00000000
ffff9b8aaeaace40 3638932746 S Ii:7:002:2 -115:1 64 <
ffff9b8aaeaacc00 3638935137 S Co:7:002:0 s 21 09 0211 0001 0014 20 = 11ff0d8e 01010000 00000000 00000000 00000000
ffff9b8aaeaacc00 3638935641 C Co:7:002:0 0 20 >
ffff9b8aaeaace40 3638938642 C Ii:7:002:2 0:1 20 = 11ff0d8e 00000000 00000000 00000000 00000000
ffff9b8aaeaac3c0 3638939811 S Ii:7:002:2 -115:1 64 <
