ffff95eb2ec629c0 2091655943 C Ii:1:015:2 0:1 20 = 11ff0b00 04000000 00000000 00000000 00000000
ffff95eb2ec62cc0 2091656201 S Ii:1:015:2 -115:1 64 <
ffff95eb2ec62cc0 2091656945 C Ii:1:015:2 0:1 20 = 11ff0f10 01000000 00000000 00000000 00000000
ffff95eb2ec62600 2091657128 S Co:1:015:0 s 21 09 0211 0001 0014 20 = 11ff0b1a 04000000 00000000 00000000 00000000
ffff95eb2ec62cc0 2091657161 S Ii:1:015:2 -115:1 64 <
ffff95eb2ec62600 2091657386 C Co:1:015:0 0 20 >
ffff95eb2ec62cc0 2091659937 C Ii:1:015:2 0:1 20 = 11ff0b1a 04000000 00000000 00000000 00000000
ffff95eb2ec629c0 2091660158 S Ii:1:015:2 -115:1 64 <
ffff95eb2ec62cc0 2091665475 S Co:1:015:0 s 21 09 0211 0001 0014 20 = 11ff0f5a 01030500 00000000 00000000 00000000
ffff95eb2ec62cc0 2091665671 C Co:1:015:0 0 20 >
ffff95eb2ec629c0 2091667930 C Ii:1:015:2 0:1 20 = 11ff0f5a 01030500 00000000 00000000 00000000
ffff95eb2ec62600 2091668142 S Ii:1:015:2 -115:1 64 <
ffff95eb2ec62600 2091784904 C Ii:1:015:2 0:1 20 = 11ff0b00 00000000 00000000 00000000 00000000
ffff95eb2ec62600 2091785066 S Ii:1:015:2 -115:1 64 <
ffff95eb2ec629c0 2091785381 S Co:1:015:0 s 21 09 0211 0001 0014 20 = 11ff0b1a 04000000 00000000 00000000 00000000
ffff95eb2ec629c0 2091785575 C Co:1:015:0 0 20 >
ffff95eb2ec62600 2091787900 C Ii:1:015:2 0:1 20 = 11ff0b1a 04000000 00000000 00000000 00000000
ffff95eb2ec62cc0 2091787983 S Ii:1:015:2 -115:1 64 <
ffff95eb2ec62cc0 2092807843 C Ii:1:015:2 0:1 20 = 11ff0f10 00000000 00000000 00000000 00000000
ffff95eb2ec62cc0 2092808096 S Ii:1:015:2 -115:1 64 <
ffff95eb2ec62600 2092809038 S Co:1:015:0 s 21 09 0211 0001 0014 20 = 11ff0f5a 01030300 00000000 00000000 00000000
ffff95eb2ec62600 2092809191 C Co:1:015:0 0 20 >
ffff95eb2ec62cc0 2092811788 C Ii:1:015:2 0:1 20 = 11ff0f5a 01030300 00000000 00000000 00000000
ffff95eb2ec629c0 2092812076 S Ii:1:015:2 -115:1 64 <
