ffff95eb4cda4a80 1715320788 S Ci:1:001:0 s a3 00 0000 0005 0004 4 <
ffff95eb4cda4a80 1715320804 C Ci:1:001:0 0 4 = 07050000
ffff95eb4cda4a80 1715320808 S Co:1:001:0 s 23 01 0002 0005 0000 0
ffff95eb4cda4a80 1715368085 C Co:1:001:0 0 0
ffff95ed5313d180 1715368104 C Ii:1:001:1 0:2048 3 = 200000
ffff95ed5313d180 1715368113 S Ii:1:001:1 -115:2048 4 <
ffff95ed5b222000 1715416071 S Ci:1:001:0 s a3 00 0000 0005 0004 4 <
ffff95ed5b222000 1715416103 C Ci:1:001:0 0 4 = 03050400
ffff95ed5b222000 1715436081 S Co:1:001:0 s 23 01 0012 0005 0000 0
ffff95ed5b222000 1715436108 C Co:1:001:0 0 0
ffff95ed5b222000 1715436112 S Ci:1:005:0 s 80 00 0000 0000 0002 2 <
ffff95ed5b222000 1715436275 C Ci:1:005:0 0 2 = 0000
ffff95ed56b61a80 1715436316 S Ii:1:005:3 -115:32 16 <
ffff95ec318b7a80 1715436318 S Ci:1:001:0 s a3 00 0000 0005 0004 4 <
ffff95ec318b7a80 1715436328 C Ci:1:001:0 0 4 = 03050000
ffff95ed56b61a80 1715436538 C Ii:1:005:3 -2:32 0
ffff95ed56b61a80 1715436638 S Ii:1:005:3 -115:32 16 <
ffff95ed56b61a80 1715436841 C Ii:1:005:3 -2:32 0
ffff95ed5b222000 1717724062 S Co:1:001:0 s 23 03 0002 0005 0000 0
ffff95ed5b222000 1717744044 C Co:1:001:0 0 0
ffff95ed5b222000 1720296533 S Ci:1:001:0 s a3 00 0000 0005 0004 4 <
ffff95ed5b222000 1720296547 C Ci:1:001:0 0 4 = 07050000
ffff95ed5b222000 1720296551 S Co:1:001:0 s 23 01 0002 0005 0000 0
ffff95ed5b222000 1720344083 C Co:1:001:0 0 0
ffff95ed5313d180 1720344144 C Ii:1:001:1 0:2048 3 = 200000
ffff95ed5313d180 1720344148 S Ii:1:001:1 -115:2048 4 <
ffff95ed5b222000 1720392054 S Ci:1:001:0 s a3 00 0000 0005 0004 4 <
ffff95ed5b222000 1720392067 C Ci:1:001:0 0 4 = 03050400
ffff95ed5b222000 1720412070 S Co:1:001:0 s 23 01 0012 0005 0000 0
ffff95ed5b222000 1720412099 C Co:1:001:0 0 0
ffff95ed5b222000 1720412103 S Ci:1:005:0 s 80 00 0000 0000 0002 2 <
ffff95ed5b222000 1720412259 C Ci:1:005:0 0 2 = 0000
ffff95ed56b61a80 1720412354 S Ii:1:005:3 -115:32 16 <
ffff95ec318b7a80 1720412380 S Ci:1:001:0 s a3 00 0000 0005 0004 4 <
ffff95ec318b7a80 1720412411 C Ci:1:001:0 0 4 = 03050000
ffff95ed56b61a80 1720412633 C Ii:1:005:3 -2:32 0
ffff95eb3d981f00 1722844072 S Co:1:001:0 s 23 03 0002 0005 0000 0
ffff95eb3d981f00 1722864116 C Co:1:001:0 0 0
ffff95eb4cda4a80 1730754501 S Ci:1:015:0 s 80 06 0302 0409 00fe 254 <
ffff95eb4cda4a80 1730754707 C Ci:1:015:0 0 72 = 48034700 38003100 35002000 52004700 42002000 4d004500 43004800 41004e00
ffff95eb4cda4f00 1730756248 S Ci:1:015:0 s 80 06 0302 0409 00fe 254 <
ffff95eb4cda4f00 1730756527 C Ci:1:015:0 0 72 = 48034700 38003100 35002000 52004700 42002000 4d004500 43004800 41004e00
ffff95eb3347a480 1730774886 S Ci:1:015:0 s 80 06 0303 0409 0081 129 <
ffff95eb3347a480 1730775023 C Ci:1:015:0 0 26 = 1a033000 44003700 39003300 38003600 42003300 38003300 3600
ffff95eb3347a480 1730778529 S Ci:1:015:0 s 80 06 0301 0409 0081 129 <
ffff95eb3347a480 1730778628 C Ci:1:015:0 0 18 = 12034c00 6f006700 69007400 65006300 6800
ffff95ea98e1a480 1730779049 S Ci:1:015:0 s 80 06 0302 0409 0081 129 <
ffff95ea98e1a480 1730779281 C Ci:1:015:0 0 72 = 48034700 38003100 35002000 52004700 42002000 4d004500 43004800 41004e00
ffff95eb3347a600 1730780082 S Ci:1:015:0 s 80 06 0303 0409 0081 129 <
ffff95eb3347a600 1730780213 C Ci:1:015:0 0 26 = 1a033000 44003700 39003300 38003600 42003300 38003300 3600
ffff95eb3347a900 1730780544 S Ci:1:015:0 s 80 06 0301 0409 0081 129 <
ffff95eb3347a900 1730780720 C Ci:1:015:0 0 18 = 12034c00 6f006700 69007400 65006300 6800
ffff95eb3347af00 1730781151 S Ci:1:015:0 s 80 06 0302 0409 0081 129 <
ffff95eb3347af00 1730781509 C Ci:1:015:0 0 72 = 48034700 38003100 35002000 52004700 42002000 4d004500 43004800 41004e00
ffff95eb3347a240 1730781873 S Ci:1:015:0 s 80 06 0303 0409 0081 129 <
ffff95eb3347a240 1730782052 C Ci:1:015:0 0 26 = 1a033000 44003700 39003300 38003600 42003300 38003300 3600
ffff95eb3347a540 1730782263 S Ci:1:015:0 s 80 06 0301 0409 0081 129 <
ffff95eb3347a540 1730782475 C Ci:1:015:0 0 18 = 12034c00 6f006700 69007400 65006300 6800
ffff95eb3347a9c0 1730782722 S Ci:1:015:0 s 80 06 0302 0409 0081 129 <
ffff95eb3347a9c0 1730782940 C Ci:1:015:0 0 72 = 48034700 38003100 35002000 52004700 42002000 4d004500 43004800 41004e00
ffff95eb3347ae40 1730841735 S Co:1:015:0 s 21 09 0211 0001 0014 20 = 11ff001a 00000000 00000000 00000000 00000000
ffff95eb3347ae40 1730841898 C Co:1:015:0 0 20 >
ffff95eb4cda4d80 1730844446 C Ii:1:015:2 0:1 20 = 11ff001a 04020000 00000000 00000000 00000000
ffff95eb3347a480 1730844601 S Ii:1:015:2 -115:1 64 <
ffff95eb3347a0c0 1730858233 S Co:1:015:0 s 21 09 0211 0001 0014 20 = 11ff001a 00003900 00000000 00000000 00000000
ffff95eb3347a0c0 1730858404 C Co:1:015:0 0 20 >
ffff95eb3347a480 1730860442 C Ii:1:015:2 0:1 20 = 11ff001a 04023900 00000000 00000000 00000000
ffff95eb3347a480 1730860642 S Ii:1:015:2 -115:1 64 <
ffff95eb3347a0c0 1730867342 S Co:1:015:0 s 21 09 0211 0001 0014 20 = 11ff000a 00030000 00000000 00000000 00000000
ffff95eb3347a0c0 1730867515 C Co:1:015:0 0 20 >
ffff95eb3347a480 1730869459 C Ii:1:015:2 0:1 20 = 11ff000a 02000200 00000000 00000000 00000000
ffff95eb3347ae40 1730869655 S Ii:1:015:2 -115:1 64 <
ffff95eb3347a9c0 1730882877 S Co:1:015:0 s 21 09 0211 0001 0014 20 = 11ff020a 00000000 00000000 00000000 00000000
ffff95eb3347a9c0 1730883018 C Co:1:015:0 0 20 >
ffff95eb3347ae40 1730885438 C Ii:1:015:2 0:1 20 = 11ff020a 05313847 0d0008c3 3f000000 00000000
ffff95eb3347a600 1730885792 S Ii:1:015:2 -115:1 64 <
ffff95eb3347a540 1730886154 S Co:1:015:0 s 21 09 0211 0001 0014 20 = 11ff021a 00000000 00000000 00000000 00000000
ffff95eb3347a540 1730886384 C Co:1:015:0 0 20 >
ffff95eb3347a600 1730888446 C Ii:1:015:2 0:1 20 = 11ff021a 01424f54 84000003 00aaea00 00000000
ffff95eb3347a900 1730888606 S Ii:1:015:2 -115:1 64 <
ffff95eb3347a240 1730888975 S Co:1:015:0 s 21 09 0211 0001 0014 20 = 11ff021a 01000000 00000000 00000000 00000000
ffff95eb3347a240 1730889149 C Co:1:015:0 0 20 >
ffff95eb3347a900 1730891411 C Ii:1:015:2 0:1 20 = 11ff021a 00553120 31000016 01c33f00 00000000
ffff95eb3347af00 1730891834 S Ii:1:015:2 -115:1 64 <
ffff95ea98e1a780 1730893336 S Co:1:015:0 s 21 09 0211 0001 0014 20 = 11ff000a 1f200000 00000000 00000000 00000000
ffff95ea98e1a780 1730893529 C Co:1:015:0 0 20 >
ffff95eb3347af00 1730895411 C Ii:1:015:2 0:1 20 = 11ff000a 00000000 00000000 00000000 00000000
ffff95ea98e1a300 1730895518 S Ii:1:015:2 -115:1 64 <
ffff95ea98e1a0c0 1737893309 S Co:1:015:0 s 21 09 0211 0001 0014 20 = 11ff000a 00200000 00000000 00000000 00000000
ffff95ea98e1a0c0 1737893485 C Co:1:015:0 0 20 >
ffff95ea98e1a300 1737896058 C Ii:1:015:2 0:1 20 = 11ff000a 04000000 00000000 00000000 00000000
ffff95ea98e1acc0 1737896216 S Ii:1:015:2 -115:1 64 <
ffff95ea98e1ad80 1738028486 S Co:1:015:0 s 21 09 0211 0001 0014 20 = 11ff041a 00000000 00000000 00000000 00000000
ffff95ea98e1ad80 1738028690 C Co:1:015:0 0 20 >
ffff95ea98e1acc0 1738031020 C Ii:1:015:2 0:1 20 = 11ff041a 00000000 00000000 00000000 00000000
ffff95ea98e1ae40 1738031204 S Ii:1:015:2 -115:1 64 <
ffff95ea98e1a000 1738035802 S Co:1:015:0 s 21 09 0211 0001 0014 20 = 11ff000a 45400000 00000000 00000000 00000000
ffff95ea98e1a000 1738035938 C Co:1:015:0 0 20 >
ffff95ea98e1ae40 1738038034 C Ii:1:015:2 0:1 20 = 11ff000a 09000000 00000000 00000000 00000000
ffff95ea98e1a3c0 1738038114 S Ii:1:015:2 -115:1 64 <
ffff95ea98e1a240 1738105638 S Co:1:015:0 s 21 09 0211 0001 0014 20 = 11ff090a 00000000 00000000 00000000 00000000
ffff95ea98e1a240 1738105900 C Co:1:015:0 0 20 >
ffff95ea98e1a3c0 1738108015 C Ii:1:015:2 0:1 20 = 11ff090a 01000000 00000000 00000000 00000000
ffff95ea98e1a540 1738108199 S Ii:1:015:2 -115:1 64 <
ffff95ea98e1ab40 1738114106 S Co:1:015:0 s 21 09 0211 0001 0014 20 = 11ff000a 10000000 00000000 00000000 00000000
ffff95ea98e1ab40 1738114246 C Co:1:015:0 0 20 >
ffff95ea98e1a540 1738117014 C Ii:1:015:2 0:1 20 = 11ff000a 00000000 00000000 00000000 00000000
ffff95ea98e1a900 1738117195 S Ii:1:015:2 -115:1 64 <
ffff95ea98e1a540 1738117644 S Co:1:015:0 s 21 09 0211 0001 0014 20 = 11ff000a 10010000 00000000 00000000 00000000
ffff95ea98e1a540 1738117806 C Co:1:015:0 0 20 >
ffff95ea98e1a900 1738120034 C Ii:1:015:2 0:1 20 = 11ff000a 00000000 00000000 00000000 00000000
ffff95ea98e1ab40 1738120207 S Ii:1:015:2 -115:1 64 <
ffff95ea98e1a3c0 1738121079 S Co:1:015:0 s 21 09 0211 0001 0014 20 = 11ff000a 81000000 00000000 00000000 00000000
ffff95ea98e1a3c0 1738121220 C Co:1:015:0 0 20 >
ffff95ea98e1ab40 1738124038 C Ii:1:015:2 0:1 20 = 11ff000a 11000000 00000000 00000000 00000000
ffff95ea98e1a240 1738124234 S Ii:1:015:2 -115:1 64 <
ffff95ea98e1ae40 1738213468 S Co:1:015:0 s 21 09 0211 0001 0014 20 = 11ff000a 13000000 00000000 00000000 00000000
ffff95ea98e1ae40 1738213622 C Co:1:015:0 0 20 >
ffff95ea98e1a240 1738216034 C Ii:1:015:2 0:1 20 = 11ff000a 00000000 00000000 00000000 00000000
ffff95ea98e1a000 1738216177 S Ii:1:015:2 -115:1 64 <
ffff95ea98e1acc0 1738216427 S Co:1:015:0 s 21 09 0211 0001 0014 20 = 11ff000a 80400000 00000000 00000000 00000000
ffff95ea98e1acc0 1738216613 C Co:1:015:0 0 20 >
ffff95ea98e1a000 1738219033 C Ii:1:015:2 0:1 20 = 11ff000a 0d000000 00000000 00000000 00000000
ffff95ea98e1ad80 1738219164 S Ii:1:015:2 -115:1 64 <
ffff95ea98e1a300 1738268736 S Co:1:015:0 s 21 09 0211 0001 0014 20 = 11ff0d0a 00000000 00000000 00000000 00000000
ffff95ea98e1a300 1738268847 C Co:1:015:0 0 20 >
ffff95ea98e1ad80 1738271016 C Ii:1:015:2 0:1 20 = 11ff0d0a 00640503 00000000 00000000 00000000
ffff95ea98e1a0c0 1738271155 S Ii:1:015:2 -115:1 64 <
ffff95ea98e1a780 1738277043 S Co:1:015:0 s 21 09 0211 0001 0014 20 = 11ff000a 80710000 00000000 00000000 00000000
ffff95ea98e1a780 1738277183 C Co:1:015:0 0 20 >
ffff95ea98e1a0c0 1738279977 C Ii:1:015:2 0:1 20 = 11ff000a 0f000000 00000000 00000000 00000000
ffff95ea98e1a480 1738280128 S Ii:1:015:2 -115:1 64 <
ffff95ea98e1ac00 1738349348 S Co:1:015:0 s 21 09 0211 0001 0014 20 = 11ff0f0a ffff0000 00000000 00000000 00000000
ffff95ea98e1ac00 1738349551 C Co:1:015:0 0 20 >
ffff95ea98e1a480 1738352028 C Ii:1:015:2 0:1 20 = 11ff0f0a ff000200 02000400 00000000 00000000
ffff95ea98e1a840 1738352176 S Ii:1:015:2 -115:1 64 <
ffff95ea98e1a180 1738352399 S Co:1:015:0 s 21 09 0211 0001 0014 20 = 11ff0f0a 00ff0000 00000000 00000000 00000000
ffff95ea98e1a180 1738352650 C Co:1:015:0 0 20 >
ffff95ea98e1a840 1738355021 C Ii:1:015:2 0:1 20 = 11ff0f0a 00000002 04010000 00000000 00000000
ffff95ea98e1a9c0 1738355183 S Ii:1:015:2 -115:1 64 <
ffff95ea98e1a600 1738355447 S Co:1:015:0 s 21 09 0211 0001 0014 20 = 11ff0f0a 00000000 00000000 00000000 00000000
ffff95ea98e1a600 1738355631 C Co:1:015:0 0 20 >
ffff95ea98e1a9c0 1738358024 C Ii:1:015:2 0:1 20 = 11ff0f0a 00000000 00000000 00000000 00000000
ffff95ea98e1af00 1738358169 S Ii:1:015:2 -115:1 64 <
ffff95ea98e1aa80 1738358304 S Co:1:015:0 s 21 09 0211 0001 0014 20 = 11ff0f0a 00010000 00000000 00000000 00000000
ffff95ea98e1aa80 1738358499 C Co:1:015:0 0 20 >
ffff95ea98e1af00 1738361004 C Ii:1:015:2 0:1 20 = 11ff0f0a 00010001 00000000 00000000 00000000
ffff95ea98e1af00 1738361168 S Ii:1:015:2 -115:1 64 <
ffff95ea98e1aa80 1738361327 S Co:1:015:0 s 21 09 0211 0001 0014 20 = 11ff0f0a 00020000 00000000 00000000 00000000
ffff95ea98e1aa80 1738361484 C Co:1:015:0 0 20 >
ffff95ea98e1af00 1738363970 C Ii:1:015:2 0:1 20 = 11ff0f0a 00020003 c00503e0 00000000 00000000
ffff95ea98e1a9c0 1738364147 S Ii:1:015:2 -115:1 64 <
ffff95ea98e1a600 1738364329 S Co:1:015:0 s 21 09 0211 0001 0014 20 = 11ff0f0a 00030000 00000000 00000000 00000000
ffff95ea98e1a600 1738364536 C Co:1:015:0 0 20 >
ffff95ea98e1a9c0 1738366971 C Ii:1:015:2 0:1 20 = 11ff0f0a 0003000a c0011e0b 00000000 00000000
ffff95ea98e1a840 1738367085 S Ii:1:015:2 -115:1 64 <
ffff95ea98e1a180 1738367390 S Co:1:015:0 s 21 09 0211 0001 0014 20 = 11ff0f0a 01ff0000 00000000 00000000 00000000
ffff95ea98e1a180 1738367554 C Co:1:015:0 0 20 >
ffff95ea98e1a840 1738370005 C Ii:1:015:2 0:1 20 = 11ff0f0a 01000001 07010000 00000000 00000000
ffff95ea98e1a480 1738370156 S Ii:1:015:2 -115:1 64 <
ffff95ea98e1ac00 1738370295 S Co:1:015:0 s 21 09 0211 0001 0014 20 = 11ff0f0a 01000000 00000000 00000000 00000000
ffff95ea98e1ac00 1738370460 C Co:1:015:0 0 20 >
ffff95ea98e1a480 1738372971 C Ii:1:015:2 0:1 20 = 11ff0f0a 01000000 00000000 00000000 00000000
ffff95ea98e1a0c0 1738373102 S Ii:1:015:2 -115:1 64 <
ffff95ea98e1a780 1738373304 S Co:1:015:0 s 21 09 0211 0001 0014 20 = 11ff0f0a 01010000 00000000 00000000 00000000
ffff95ea98e1a780 1738373500 C Co:1:015:0 0 20 >
ffff95ea98e1a0c0 1738376023 C Ii:1:015:2 0:1 20 = 11ff0f0a 01010001 00000000 00000000 00000000
ffff95ea98e1ad80 1738376140 S Ii:1:015:2 -115:1 64 <
ffff95ea98e1a300 1738376371 S Co:1:015:0 s 21 09 0211 0001 0014 20 = 11ff0f0a 01020000 00000000 00000000 00000000
ffff95ea98e1a300 1738376526 C Co:1:015:0 0 20 >
ffff95ea98e1ad80 1738379007 C Ii:1:015:2 0:1 20 = 11ff0f0a 0102000a c0011e0b 00000000 00000000
ffff95ea98e1a000 1738379041 S Ii:1:015:2 -115:1 64 <
ffff95ea98e1acc0 1738379200 S Co:1:015:0 s 21 09 0211 0001 0014 20 = 11ff0f0a 01030000 00000000 00000000 00000000
ffff95ea98e1acc0 1738379410 C Co:1:015:0 0 20 >
ffff95ea98e1a000 1738382017 C Ii:1:015:2 0:1 20 = 11ff0f0a 01030003 c00503e0 00000000 00000000
ffff95ea98e1a240 1738382142 S Ii:1:015:2 -115:1 64 <
ffff95ea98e1ae40 1738382237 S Co:1:015:0 s 21 09 0211 0001 0014 20 = 11ff0f0a 01040000 00000000 00000000 00000000
ffff95ea98e1ae40 1738382423 C Co:1:015:0 0 20 >
ffff95ea98e1a240 1738385021 C Ii:1:015:2 0:1 20 = 11ff0f0a 01040004 dce1001e 00000000 00000000
ffff95ea98e1ab40 1738385118 S Ii:1:015:2 -115:1 64 <
ffff95ea98e1a3c0 1738512144 S Co:1:015:0 s 21 09 0211 0001 0014 20 = 11ff0f0a 01050000 00000000 00000000 00000000
ffff95ea98e1a3c0 1738512364 C Co:1:015:0 0 20 >
ffff95ea98e1ab40 1738514996 C Ii:1:015:2 0:1 20 = 11ff0f0a 0105000b 00000032 00000000 00000000
ffff95ea98e1a900 1738515193 S Ii:1:015:2 -115:1 64 <
ffff95ea98e1a540 1738515447 S Co:1:015:0 s 21 09 0211 0001 0014 20 = 11ff0f0a 01060000 00000000 00000000 00000000
ffff95ea98e1a540 1738515596 C Co:1:015:0 0 20 >
ffff95ea98e1a900 1738518011 C Ii:1:015:2 0:1 20 = 11ff0f0a 0106000c 001f0234 00000000 00000000
ffff95ea98e1a900 1738518163 S Ii:1:015:2 -115:1 64 <
ffff95ea98e1a540 1738518805 S Co:1:015:0 s 21 09 0211 0001 0014 20 = 11ff000a 80710000 00000000 00000000 00000000
ffff95ea98e1a540 1738519049 C Co:1:015:0 0 20 >
ffff95ea98e1a900 1738521014 C Ii:1:015:2 0:1 20 = 11ff000a 0f000000 00000000 00000000 00000000
ffff95ea98e1ab40 1738521177 S Ii:1:015:2 -115:1 64 <
ffff95ea98e1a3c0 1738522047 S Co:1:015:0 s 21 09 0211 0001 0014 20 = 11ff000a 80700000 00000000 00000000 00000000
ffff95ea98e1a3c0 1738522190 C Co:1:015:0 0 20 >
ffff95ea98e1ab40 1738524989 C Ii:1:015:2 0:1 20 = 11ff000a 00000000 00000000 00000000 00000000
ffff95ea98e1a240 1738525158 S Ii:1:015:2 -115:1 64 <
ffff95ea98e1ae40 1738527953 S Co:1:015:0 s 21 09 0211 0001 0014 20 = 11ff0f0a ffff0000 00000000 00000000 00000000
ffff95ea98e1ae40 1738528093 C Co:1:015:0 0 20 >
ffff95ea98e1a240 1738529997 C Ii:1:015:2 0:1 20 = 11ff0f0a ff000200 02000400 00000000 00000000
ffff95ea98e1a000 1738530148 S Ii:1:015:2 -115:1 64 <
ffff95ea98e1acc0 1738530361 S Co:1:015:0 s 21 09 0211 0001 0014 20 = 11ff0f0a 00ff0000 00000000 00000000 00000000
ffff95ea98e1acc0 1738530518 C Co:1:015:0 0 20 >
ffff95ea98e1a000 1738532995 C Ii:1:015:2 0:1 20 = 11ff0f0a 00000002 04010000 00000000 00000000
ffff95ea98e1ad80 1738533107 S Ii:1:015:2 -115:1 64 <
ffff95ea98e1a300 1738533683 S Co:1:015:0 s 21 09 0211 0001 0014 20 = 11ff0f0a 00000000 00000000 00000000 00000000
ffff95ea98e1a300 1738533895 C Co:1:015:0 0 20 >
ffff95ea98e1ad80 1738535989 C Ii:1:015:2 0:1 20 = 11ff0f0a 00000000 00000000 00000000 00000000
ffff95ea98e1a0c0 1738536122 S Ii:1:015:2 -115:1 64 <
ffff95ea98e1a780 1738536283 S Co:1:015:0 s 21 09 0211 0001 0014 20 = 11ff0f0a 00010000 00000000 00000000 00000000
ffff95ea98e1a780 1738536423 C Co:1:015:0 0 20 >
ffff95ea98e1a0c0 1738538990 C Ii:1:015:2 0:1 20 = 11ff0f0a 00010001 00000000 00000000 00000000
ffff95ea98e1a480 1738539147 S Ii:1:015:2 -115:1 64 <
ffff95ea98e1ac00 1738567994 S Co:1:015:0 s 21 09 0211 0001 0014 20 = 11ff0f0a 00020000 00000000 00000000 00000000
ffff95ea98e1ac00 1738568199 C Co:1:015:0 0 20 >
ffff95ea98e1a480 1738570996 C Ii:1:015:2 0:1 20 = 11ff0f0a 00020003 c00503e0 00000000 00000000
ffff95ea98e1a840 1738571122 S Ii:1:015:2 -115:1 64 <
ffff95ea98e1a180 1738573323 S Co:1:015:0 s 21 09 0211 0001 0014 20 = 11ff0f0a 00030000 00000000 00000000 00000000
ffff95ea98e1a180 1738573490 C Co:1:015:0 0 20 >
ffff95ea98e1a840 1738575994 C Ii:1:015:2 0:1 20 = 11ff0f0a 0003000a c0011e0b 00000000 00000000
ffff95ea98e1a9c0 1738576144 S Ii:1:015:2 -115:1 64 <
ffff95ea98e1a600 1738578645 S Co:1:015:0 s 21 09 0211 0001 0014 20 = 11ff0f0a 01ff0000 00000000 00000000 00000000
ffff95ea98e1a600 1738578859 C Co:1:015:0 0 20 >
ffff95ea98e1a9c0 1738580991 C Ii:1:015:2 0:1 20 = 11ff0f0a 01000001 07010000 00000000 00000000
ffff95ea98e1af00 1738581154 S Ii:1:015:2 -115:1 64 <
ffff95ea98e1aa80 1738615653 S Co:1:015:0 s 21 09 0211 0001 0014 20 = 11ff0f0a 01000000 00000000 00000000 00000000
ffff95ea98e1aa80 1738615805 C Co:1:015:0 0 20 >
ffff95ea98e1af00 1738618018 C Ii:1:015:2 0:1 20 = 11ff0f0a 01000000 00000000 00000000 00000000
ffff95eb4cda4600 1738618154 S Ii:1:015:2 -115:1 64 <
ffff95eb4cda4000 1738631981 S Co:1:015:0 s 21 09 0211 0001 0014 20 = 11ff0f0a 01010000 00000000 00000000 00000000
ffff95eb4cda4000 1738632160 C Co:1:015:0 0 20 >
ffff95eb4cda4600 1738634991 C Ii:1:015:2 0:1 20 = 11ff0f0a 01010001 00000000 00000000 00000000
ffff95ea98e1af00 1738635181 S Ii:1:015:2 -115:1 64 <
ffff95ea98e1aa80 1738636293 S Ci:1:015:0 s 80 06 0302 0409 00fe 254 <
ffff95ea98e1aa80 1738636479 C Ci:1:015:0 0 72 = 48034700 38003100 35002000 52004700 42002000 4d004500 43004800 41004e00
ffff95ea98e1a9c0 1738636765 S Co:1:015:0 s 21 09 0211 0001 0014 20 = 11ff0f0a 01020000 00000000 00000000 00000000
ffff95ea98e1a9c0 1738636992 C Co:1:015:0 0 20 >
ffff95eb334abf00 1738638016 S Ci:1:015:0 s 80 06 0302 0409 00fe 254 <
ffff95eb334abf00 1738638242 C Ci:1:015:0 0 72 = 48034700 38003100 35002000 52004700 42002000 4d004500 43004800 41004e00
ffff95ea98e1af00 1738638989 C Ii:1:015:2 0:1 20 = 11ff0f0a 0102000a c0011e0b 00000000 00000000
ffff95eb334abd80 1738639125 S Ii:1:015:2 -115:1 64 <
ffff95eb334aba80 1738639584 S Co:1:015:0 s 21 09 0211 0001 0014 20 = 11ff0f0a 01030000 00000000 00000000 00000000
ffff95eb334aba80 1738639772 C Co:1:015:0 0 20 >
ffff95eb334abd80 1738641989 C Ii:1:015:2 0:1 20 = 11ff0f0a 01030003 c00503e0 00000000 00000000
ffff95eb334ab180 1738642135 S Ii:1:015:2 -115:1 64 <
ffff95eb334ab840 1738642322 S Co:1:015:0 s 21 09 0211 0001 0014 20 = 11ff0f0a 01040000 00000000 00000000 00000000
ffff95eb334ab840 1738642474 C Co:1:015:0 0 20 >
ffff95eb334ab180 1738644988 C Ii:1:015:2 0:1 20 = 11ff0f0a 01040004 dce1001e 00000000 00000000
ffff95eb334ab0c0 1738645131 S Ii:1:015:2 -115:1 64 <
ffff95eb334ab480 1738645277 S Co:1:015:0 s 21 09 0211 0001 0014 20 = 11ff0f0a 01050000 00000000 00000000 00000000
ffff95eb334ab480 1738645458 C Co:1:015:0 0 20 >
ffff95eb334ab0c0 1738647987 C Ii:1:015:2 0:1 20 = 11ff0f0a 0105000b 00000032 00000000 00000000
ffff95eb334ab000 1738648133 S Ii:1:015:2 -115:1 64 <
ffff95eb334ab240 1738648346 S Co:1:015:0 s 21 09 0211 0001 0014 20 = 11ff0f0a 01060000 00000000 00000000 00000000
ffff95eb334ab240 1738648491 C Co:1:015:0 0 20 >
ffff95eb334ab000 1738650983 C Ii:1:015:2 0:1 20 = 11ff0f0a 0106000c 001f0234 00000000 00000000
ffff95eb334ab3c0 1738651169 S Ii:1:015:2 -115:1 64 <
ffff95eb334abc00 1738651476 S Co:1:015:0 s 21 09 0211 0001 0014 20 = 11ff0f7a 00000000 00000000 00000000 00000000
ffff95eb334abc00 1738651620 C Co:1:015:0 0 20 >
ffff95eb334ab3c0 1738653988 C Ii:1:015:2 0:1 20 = 11ff0f7a 00000000 00000000 00000000 00000000
ffff95eb334ab300 1738654136 S Ii:1:015:2 -115:1 64 <
ffff95eb334ab9c0 1738655079 S Co:1:015:0 s 21 09 0211 0001 0014 20 = 11ff000a 80810000 00000000 00000000 00000000
ffff95eb334ab9c0 1738655230 C Co:1:015:0 0 20 >
ffff95eb334ab300 1738657988 C Ii:1:015:2 0:1 20 = 11ff000a 10000200 00000000 00000000 00000000
ffff95eb334ab300 1738658133 S Ii:1:015:2 -115:1 64 <
ffff95eb334ab9c0 1738658849 S Co:1:015:0 s 21 09 0211 0001 0014 20 = 11ff000a 80800000 00000000 00000000 00000000
ffff95eb334ab9c0 1738658999 C Co:1:015:0 0 20 >
ffff95eb334ab300 1738660987 C Ii:1:015:2 0:1 20 = 11ff000a 00000000 00000000 00000000 00000000
ffff95eb334ab3c0 1738661133 S Ii:1:015:2 -115:1 64 <
ffff95eb334abc00 1738661870 S Co:1:015:0 s 21 09 0211 0001 0014 20 = 11ff100a 00000000 00000000 00000000 00000000
ffff95eb334abc00 1738662003 C Co:1:015:0 0 20 >
ffff95eb334ab3c0 1738663988 C Ii:1:015:2 0:1 20 = 11ff100a 0000ffff ffffffff ffffffff ffffffff
ffff95eb334ab000 1738664083 S Ii:1:015:2 -115:1 64 <
ffff95eb334ab240 1738664837 S Co:1:015:0 s 21 09 0211 0001 0014 20 = 11ff100a 00010000 00000000 00000000 00000000
ffff95eb334ab240 1738665034 C Co:1:015:0 0 20 >
ffff95eb334ab000 1738666988 C Ii:1:015:2 0:1 20 = 11ff100a 00010000 0000007a 0000f001 00000400
ffff95eb334ab0c0 1738667132 S Ii:1:015:2 -115:1 64 <
ffff95eb334ab480 1738667291 S Co:1:015:0 s 21 09 0211 0001 0014 20 = 11ff100a 00020000 00000000 00000000 00000000
ffff95eb334ab480 1738667517 C Co:1:015:0 0 20 >
ffff95eb334ab0c0 1738669986 C Ii:1:015:2 0:1 20 = 11ff100a 00020000 00000000 00000000 00000000
ffff95eb334ab180 1738670131 S Ii:1:015:2 -115:1 64 <
ffff95eb334ab840 1738670443 S Co:1:015:0 s 21 09 0211 0001 0014 20 = 11ff000a 18150000 00000000 00000000 00000000
ffff95eb334ab840 1738670648 C Co:1:015:0 0 20 >
ffff95eb334ab180 1738672983 C Ii:1:015:2 0:1 20 = 11ff000a 00000000 00000000 00000000 00000000
ffff95eb334abd80 1738673190 S Ii:1:015:2 -115:1 64 <
ffff95eb334aba80 1738673491 S Co:1:015:0 s 21 09 0211 0001 0014 20 = 11ff000a 80100000 00000000 00000000 00000000
ffff95eb334aba80 1738673685 C Co:1:015:0 0 20 >
ffff95eb334abd80 1738675988 C Ii:1:015:2 0:1 20 = 11ff000a 0a000000 00000000 00000000 00000000
ffff95eb3d981780 1738676104 S Ii:1:015:2 -115:1 64 <
ffff95eb3d981b40 1738781288 S Co:1:015:0 s 21 09 0211 0001 0014 20 = 11ff0a0a 00000000 00000000 00000000 00000000
ffff95eb3d981b40 1738781481 C Co:1:015:0 0 20 >
ffff95eb3d981780 1738783981 C Ii:1:015:2 0:1 20 = 11ff0a0a 05000000 00000000 00000000 00000000
ffff95eb3d9819c0 1738784085 S Ii:1:015:2 -115:1 64 <
ffff95eb3d981f00 1738784828 S Co:1:015:0 s 21 09 0211 0001 0014 20 = 11ff000a 81100000 00000000 00000000 00000000
ffff95eb3d981f00 1738785064 C Co:1:015:0 0 20 >
ffff95eb3d9819c0 1738786979 C Ii:1:015:2 0:1 20 = 11ff000a 00000000 00000000 00000000 00000000
ffff95eb3d981180 1738787121 S Ii:1:015:2 -115:1 64 <
ffff95eb3d981c00 1738787843 S Co:1:015:0 s 21 09 0211 0001 0014 20 = 11ff000a 80200000 00000000 00000000 00000000
ffff95eb3d981c00 1738788037 C Co:1:015:0 0 20 >
ffff95eb3d981180 1738789979 C Ii:1:015:2 0:1 20 = 11ff000a 0b000000 00000000 00000000 00000000
ffff95eb3d9810c0 1738790122 S Ii:1:015:2 -115:1 64 <
ffff95eb3d981300 1738790833 S Co:1:015:0 s 21 09 0211 0001 0014 20 = 11ff000a 80300000 00000000 00000000 00000000
ffff95eb3d981300 1738791032 C Co:1:015:0 0 20 >
ffff95eb3d9810c0 1738792979 C Ii:1:015:2 0:1 20 = 11ff000a 0c000000 00000000 00000000 00000000
ffff95eb3d981540 1738793141 S Ii:1:015:2 -115:1 64 <
ffff95eb3d981900 1738795133 S Co:1:015:0 s 21 09 0211 0001 0014 20 = 11ff000a 45220000 00000000 00000000 00000000
ffff95eb3d981900 1738795337 C Co:1:015:0 0 20 >
ffff95eb3d981540 1738797979 C Ii:1:015:2 0:1 20 = 11ff000a 08000000 00000000 00000000 00000000
ffff95eb3d9813c0 1738798123 S Ii:1:015:2 -115:1 64 <
ffff95eb3d981600 1738875061 S Co:1:015:0 s 21 09 0211 0001 0014 20 = 11ff000a 80600000 00000000 00000000 00000000
ffff95eb3d981600 1738875264 C Co:1:015:0 0 20 >
ffff95eb3d9813c0 1738877968 C Ii:1:015:2 0:1 20 = 11ff000a 0e000000 00000000 00000000 00000000
ffff95eb3d981cc0 1738878128 S Ii:1:015:2 -115:1 64 <
ffff95eb3d981d80 1738884347 S Co:1:015:0 s 21 09 0211 0001 0014 20 = 11ff000a 40a20000 00000000 00000000 00000000
ffff95eb3d981d80 1738884556 C Co:1:015:0 0 20 >
ffff95eb3d981480 1738884895 S Co:1:015:0 s 21 09 0211 0001 0014 20 = 11ff001e 00000000 00000000 00000000 00000000
ffff95eb3d981480 1738885115 C Co:1:015:0 0 20 >
ffff95eb3d981cc0 1738886969 C Ii:1:015:2 0:1 20 = 11ff001e 04020000 00000000 00000000 00000000
ffff95eb3d981240 1738887108 S Ii:1:015:2 -115:1 64 <
ffff95eb3d981cc0 1738894723 S Co:1:015:0 s 21 09 0211 0001 0014 20 = 11ff001e 00003900 00000000 00000000 00000000
ffff95eb3d981cc0 1738894918 C Co:1:015:0 0 20 >
ffff95eb3d981240 1738896969 C Ii:1:015:2 0:1 20 = 11ff001e 04023900 00000000 00000000 00000000
ffff95eb3d981480 1738897140 S Ii:1:015:2 -115:1 64 <
ffff95eb3d981d80 1738900547 S Co:1:015:0 s 21 09 0211 0001 0014 20 = 11ff000e 00030000 00000000 00000000 00000000
ffff95eb3d981d80 1738900652 C Co:1:015:0 0 20 >
ffff95eb3d981480 1738902968 C Ii:1:015:2 0:1 20 = 11ff000e 02000200 00000000 00000000 00000000
ffff95eb3d9813c0 1738903115 S Ii:1:015:2 -115:1 64 <
ffff95eb3d981600 1738907542 S Co:1:015:0 s 21 09 0211 0001 0014 20 = 11ff020e 00000000 00000000 00000000 00000000
ffff95eb3d981600 1738907742 C Co:1:015:0 0 20 >
ffff95eb3d9813c0 1738909967 C Ii:1:015:2 0:1 20 = 11ff020e 05313847 0d0008c3 3f000000 00000000
ffff95eb3d981540 1738910136 S Ii:1:015:2 -115:1 64 <
ffff95eb3d981900 1738912465 S Co:1:015:0 s 21 09 0211 0001 0014 20 = 11ff021e 00000000 00000000 00000000 00000000
ffff95eb3d981900 1738912624 C Co:1:015:0 0 20 >
ffff95eb3d981540 1738914966 C Ii:1:015:2 0:1 20 = 11ff021e 01424f54 84000003 00aaea00 00000000
ffff95eb3d9810c0 1738915125 S Ii:1:015:2 -115:1 64 <
ffff95eb3d981300 1738924602 S Co:1:015:0 s 21 09 0211 0001 0014 20 = 11ff021e 01000000 00000000 00000000 00000000
ffff95eb3d981300 1738924767 C Co:1:015:0 0 20 >
ffff95eb3d9810c0 1738926971 C Ii:1:015:2 0:1 20 = 11ff021e 00553120 31000016 01c33f00 00000000
ffff95eb3d981180 1738927108 S Ii:1:015:2 -115:1 64 <
ffff95eb3d981c00 1738929902 S Co:1:015:0 s 21 09 0211 0001 0014 20 = 11ff000e 00050000 00000000 00000000 00000000
ffff95eb3d981c00 1738930099 C Co:1:015:0 0 20 >
ffff95eb3d981180 1738931973 C Ii:1:015:2 0:1 20 = 11ff000e 03000000 00000000 00000000 00000000
ffff95eb3d9819c0 1738932070 S Ii:1:015:2 -115:1 64 <
ffff95eb3d981f00 1738934377 S Co:1:015:0 s 21 09 0211 0001 0014 20 = 11ff030e 00000000 00000000 00000000 00000000
ffff95eb3d981f00 1738934550 C Co:1:015:0 0 20 >
ffff95eb3d9819c0 1738936975 C Ii:1:015:2 0:1 20 = 11ff030e 23000000 00000000 00000000 00000000
ffff95eb3d981780 1738937119 S Ii:1:015:2 -115:1 64 <
ffff95eb3d981b40 1738946103 S Co:1:015:0 s 21 09 0211 0001 0014 20 = 11ff031e 00000000 00000000 00000000 00000000
ffff95eb3d981b40 1738946291 C Co:1:015:0 0 20 >
ffff95eb3d981780 1738948986 C Ii:1:015:2 0:1 20 = 11ff031e 47383135 20524742 204d4543 48414e49
ffff95eb3d981780 1738949122 S Ii:1:015:2 -115:1 64 <
ffff95eb3d981b40 1739028683 S Co:1:015:0 s 21 09 0211 0001 0014 20 = 11ff031e 10000000 00000000 00000000 00000000
ffff95eb3d981b40 1739028890 C Co:1:015:0 0 20 >
ffff95eb3d981780 1739030981 C Ii:1:015:2 0:1 20 = 11ff031e 43414c20 47414d49 4e47204b 4559424f
ffff95eb3d9819c0 1739031116 S Ii:1:015:2 -115:1 64 <
ffff95eb3d981f00 1739031463 S Co:1:015:0 s 21 09 0211 0001 0014 20 = 11ff031e 20000000 00000000 00000000 00000000
ffff95eb3d981f00 1739031654 C Co:1:015:0 0 20 >
ffff95eb3d9819c0 1739033971 C Ii:1:015:2 0:1 20 = 11ff031e 41524400 00000000 00000000 00000000
ffff95eb3d981180 1739034140 S Ii:1:015:2 -115:1 64 <
ffff95eb3d981c00 1739034889 S Co:1:015:0 s 21 09 0211 0001 0014 20 = 11ff032e 00000000 00000000 00000000 00000000
ffff95eb3d981c00 1739035088 C Co:1:015:0 0 20 >
ffff95eb3d981180 1739036959 C Ii:1:015:2 0:1 20 = 11ff032e 00000000 00000000 00000000 00000000
ffff95eb3d9810c0 1739037120 S Ii:1:015:2 -115:1 64 <
ffff95eb3d981300 1739046620 S Co:1:015:0 s 21 09 0211 0001 0014 20 = 11ff000e 10000000 00000000 00000000 00000000
ffff95eb3d981300 1739046810 C Co:1:015:0 0 20 >
ffff95eb3d9810c0 1739048973 C Ii:1:015:2 0:1 20 = 11ff000e 00000000 00000000 00000000 00000000
ffff95eb3d981540 1739049120 S Ii:1:015:2 -115:1 64 <
ffff95eb3d981900 1739050705 S Co:1:015:0 s 21 09 0211 0001 0014 20 = 11ff021e 02000000 00000000 00000000 00000000
ffff95eb3d981900 1739050904 C Co:1:015:0 0 20 >
ffff95eb3d981540 1739052988 C Ii:1:015:2 0:1 20 = 11ff021e 00000000 00000000 00000000 00000000
ffff95eb3d9813c0 1739053129 S Ii:1:015:2 -115:1 64 <
ffff95eb3d981600 1739054450 S Co:1:015:0 s 21 09 0211 0001 0014 20 = 11ff021e 03000000 00000000 00000000 00000000
ffff95eb3d981600 1739054647 C Co:1:015:0 0 20 >
ffff95eb3d9813c0 1739056961 C Ii:1:015:2 0:1 20 = 11ff021e 08455854 00000000 02c33f00 00000000
ffff95eb3d981480 1739057098 S Ii:1:015:2 -115:1 64 <
ffff95eb3d981d80 1739077850 S Co:1:015:0 s 21 09 0211 0001 0014 20 = 11ff021e 04000000 00000000 00000000 00000000
ffff95eb3d981d80 1739078119 C Co:1:015:0 0 20 >
ffff95eb3d981480 1739079963 C Ii:1:015:2 0:1 20 = 11ff021e 08455854 00000000 03c33f00 00000000
ffff95eb3d981240 1739080197 S Ii:1:015:2 -115:1 64 <
ffff95eb3d981cc0 1742546868 S Ci:1:015:0 s 80 06 0302 0409 00fe 254 <
ffff95eb3d981cc0 1742547098 C Ci:1:015:0 0 72 = 48034700 38003100 35002000 52004700 42002000 4d004500 43004800 41004e00
ffff95eb3d981cc0 1742548235 S Ci:1:015:0 s 80 06 0302 0409 00fe 254 <
ffff95eb3d981cc0 1742548472 C Ci:1:015:0 0 72 = 48034700 38003100 35002000 52004700 42002000 4d004500 43004800 41004e00
ffff95eb3d981480 1742549388 S Ci:1:015:0 s 80 06 0302 0409 00fe 254 <
ffff95eb3d981480 1742549613 C Ci:1:015:0 0 72 = 48034700 38003100 35002000 52004700 42002000 4d004500 43004800 41004e00
ffff95eb3d981d80 1742550107 S Ci:1:015:0 s 80 06 0302 0409 00fe 254 <
ffff95eb3d981d80 1742550342 C Ci:1:015:0 0 72 = 48034700 38003100 35002000 52004700 42002000 4d004500 43004800 41004e00
ffff95eb3d9813c0 1742550878 S Co:1:015:0 s 21 09 0211 0001 0014 20 = 11ff001a 00006e00 00000000 00000000 00000000
ffff95eb3d9813c0 1742551085 C Co:1:015:0 0 20 >
ffff95eb3d981240 1742553750 C Ii:1:015:2 0:1 20 = 11ff001a 04026e00 00000000 00000000 00000000
ffff95eb3d981600 1742553909 S Ii:1:015:2 -115:1 64 <
ffff95eb3d981540 1742569774 S Co:1:015:0 s 21 09 0211 0001 0014 20 = 11ff020a 00000000 00000000 00000000 00000000
ffff95eb3d981540 1742569998 C Co:1:015:0 0 20 >
ffff95eb3d981600 1742572770 C Ii:1:015:2 0:1 20 = 11ff020a 05313847 0d0008c3 3f000000 00000000
ffff95eb3d981900 1742572879 S Ii:1:015:2 -115:1 64 <
ffff95ed5b222000 1742583438 S Co:1:015:0 s 21 09 0211 0001 0014 20 = 11ff021a 01000000 00000000 00000000 00000000
ffff95ed5b222000 1742583661 C Co:1:015:0 0 20 >
ffff95eb3d981900 1742585752 C Ii:1:015:2 0:1 20 = 11ff021a 00553120 31000016 01c33f00 00000000
ffff95ed5b222900 1742585905 S Ii:1:015:2 -115:1 64 <
ffff95ed5b2226c0 1742589710 S Co:1:015:0 s 21 09 0211 0001 0014 20 = 11ff000a 40a20000 00000000 00000000 00000000
ffff95ed5b2226c0 1742589891 C Co:1:015:0 0 20 >
ffff95ed5b222900 1742591755 C Ii:1:015:2 0:1 20 = 11ff000a 00000000 00000000 00000000 00000000
ffff95ed5b222cc0 1742591916 S Ii:1:015:2 -115:1 64 <
ffff95ed5b222540 1742604262 S Co:1:015:0 s 21 09 0211 0001 0014 20 = 11ff000a 24000000 00000000 00000000 00000000
ffff95ed5b222540 1742604417 C Co:1:015:0 0 20 >
ffff95ed5b222cc0 1742606721 C Ii:1:015:2 0:1 20 = 11ff000a 00000000 00000000 00000000 00000000
ffff95eb3347a900 1742606869 S Ii:1:015:2 -115:1 64 <
ffff95eb3347a240 1742607564 S Co:1:015:0 s 21 09 0211 0001 0014 20 = 11ff000a 22400000 00000000 00000000 00000000
ffff95eb3347a240 1742607775 C Co:1:015:0 0 20 >
ffff95eb3347a900 1742609731 C Ii:1:015:2 0:1 20 = 11ff000a 00000000 00000000 00000000 00000000
ffff95eb50e183c0 1742609906 S Ii:1:015:2 -115:1 64 <
ffff95eb50e18780 1742624164 S Co:1:015:0 s 21 09 0211 0001 0014 20 = 11ff000a 00c10000 00000000 00000000 00000000
ffff95eb50e18780 1742624315 C Co:1:015:0 0 20 >
ffff95eb50e183c0 1742626718 C Ii:1:015:2 0:1 20 = 11ff000a 00000000 00000000 00000000 00000000
ffff95eb334abf00 1742626787 S Ii:1:015:2 -115:1 64 <
ffff95eb334ab6c0 1742629697 S Co:1:015:0 s 21 09 0211 0001 0014 20 = 11ff000a 00c20000 00000000 00000000 00000000
ffff95eb334ab6c0 1742629894 C Co:1:015:0 0 20 >
ffff95eb334abf00 1742631745 C Ii:1:015:2 0:1 20 = 11ff000a 05000000 00000000 00000000 00000000
ffff95eb334ab540 1742631881 S Ii:1:015:2 -115:1 64 <
ffff95eb334abb40 1742634455 S Co:1:015:0 s 21 09 0211 0001 0014 20 = 11ff000a 81200000 00000000 00000000 00000000
ffff95eb334abb40 1742634618 C Co:1:015:0 0 20 >
ffff95eb334ab540 1742636746 C Ii:1:015:2 0:1 20 = 11ff000a 00000000 00000000 00000000 00000000
ffff95eb334ab900 1742636863 S Ii:1:015:2 -115:1 64 <
ffff95eb334ab600 1742646555 S Co:1:015:0 s 21 09 0211 0001 0014 20 = 11ff000a 81230000 00000000 00000000 00000000
ffff95eb334ab600 1742646767 C Co:1:015:0 0 20 >
ffff95eb334ab900 1742648749 C Ii:1:015:2 0:1 20 = 11ff000a 00000000 00000000 00000000 00000000
ffff95eb334abe40 1742648858 S Ii:1:015:2 -115:1 64 <
ffff95eb334ab780 1742652044 S Co:1:015:0 s 21 09 0211 0001 0014 20 = 11ff000a 80a30000 00000000 00000000 00000000
ffff95eb334ab780 1742652231 C Co:1:015:0 0 20 >
ffff95eb334abe40 1742654765 C Ii:1:015:2 0:1 20 = 11ff000a 00000000 00000000 00000000 00000000
ffff95eb334abcc0 1742654910 S Ii:1:015:2 -115:1 64 <
ffff95eb334abe40 1742793834 S Co:1:015:0 s 21 09 0211 0001 0014 20 = 11ff000a 80d00000 00000000 00000000 00000000
ffff95eb334abe40 1742794042 C Co:1:015:0 0 20 >
ffff95eb334abcc0 1742796749 C Ii:1:015:2 0:1 20 = 11ff000a 00000000 00000000 00000000 00000000
ffff95eb334ab780 1742796855 S Ii:1:015:2 -115:1 64 <
ffff95eb334ab900 1742797241 S Co:1:015:0 s 21 09 0211 0001 0014 20 = 11ff000a 807a0000 00000000 00000000 00000000
ffff95eb334ab900 1742797435 C Co:1:015:0 0 20 >
ffff95eb334ab780 1742799742 C Ii:1:015:2 0:1 20 = 11ff000a 00000000 00000000 00000000 00000000
ffff95eb334ab600 1742799849 S Ii:1:015:2 -115:1 64 <
ffff95eb334ab540 1742856131 S Co:1:015:0 s 21 09 0211 0001 0014 20 = 11ff110a 00000000 00000000 00000000 00000000
ffff95eb334ab540 1742856361 C Co:1:015:0 0 20 >
ffff95eb334ab600 1742858739 C Ii:1:015:2 0:1 20 = 11ff110a 01040103 03081001 00360100 00000000
ffff95eb334abb40 1742858893 S Ii:1:015:2 -115:1 64 <
ffff95eb334abf00 1742912314 S Co:1:015:0 s 21 09 0211 0001 0014 20 = 11ff115a 00000000 00000000 00000000 00000000
ffff95eb334abf00 1742912512 C Co:1:015:0 0 20 >
ffff95eb334abb40 1742914729 C Ii:1:015:2 0:1 20 = 11ff115a 00010100 00020100 00030100 ffff0000
ffff95eb334ab6c0 1742914857 S Ii:1:015:2 -115:1 64 <
ffff95eb334abd80 1742917064 S Co:1:015:0 s 21 09 0211 0001 0014 20 = 11ff114a 00000000 00000000 00000000 00000000
ffff95eb334abd80 1742917233 C Co:1:015:0 0 20 >
ffff95eb334ab6c0 1742919732 C Ii:1:015:2 0:1 20 = 11ff114a 00030000 00000000 00000000 00000000
ffff95eb334aba80 1742919871 S Ii:1:015:2 -115:1 64 <
ffff95eb334ab180 1742920263 S Co:1:015:0 s 21 09 0211 0001 0014 20 = 11ff115a 01010000 00000000 00000000 00000000
ffff95eb334ab180 1742920452 C Co:1:015:0 0 20 >
ffff95eb334aba80 1742922702 C Ii:1:015:2 0:1 20 = 11ff115a 01000000 00000000 00000000 00000000
ffff95eb334ab840 1742922906 S Ii:1:015:2 -115:1 64 <
ffff95eb334ab0c0 1742927284 S Co:1:015:0 s 21 09 0211 0001 0014 20 = 11ff115a 01010010 00000000 00000000 00000000
ffff95eb334ab0c0 1742927444 C Co:1:015:0 0 20 >
ffff95eb334ab840 1742929734 C Ii:1:015:2 0:1 20 = 11ff115a 0000ffff ffffffff ffffffff 00000000
ffff95eb334ab480 1742929899 S Ii:1:015:2 -115:1 64 <
ffff95eb334ab000 1742930638 S Co:1:015:0 s 21 09 0211 0001 0014 20 = 11ff115a 01010020 00000000 00000000 00000000
ffff95eb334ab000 1742930877 C Co:1:015:0 0 20 >
ffff95eb334ab480 1742932750 C Ii:1:015:2 0:1 20 = 11ff115a 8002003a 8002003b 8002003c 8002003d
ffff95ec318b7540 1742932935 S Ii:1:015:2 -115:1 64 <
ffff95ec318b7000 1742933839 S Co:1:015:0 s 21 09 0211 0001 0014 20 = 11ff115a 01010030 00000000 00000000 00000000
ffff95ec318b7000 1742934032 C Co:1:015:0 0 20 >
ffff95ec318b7540 1742936728 C Ii:1:015:2 0:1 20 = 11ff115a 8002003e 900d0001 900d0002 900d0003
ffff95ec318b7d80 1742936912 S Ii:1:015:2 -115:1 64 <
ffff95ec318b7840 1742946888 S Co:1:015:0 s 21 09 0211 0001 0014 20 = 11ff115a 01010040 00000000 00000000 00000000
ffff95ec318b7840 1742947059 C Co:1:015:0 0 20 >
ffff95ec318b7d80 1742949751 C Ii:1:015:2 0:1 20 = 11ff115a ffffffff ffffffff ffffffff ffffffff
ffff95ec318b7a80 1742949894 S Ii:1:015:2 -115:1 64 <
ffff95ec318b7180 1742950407 S Co:1:015:0 s 21 09 0211 0001 0014 20 = 11ff115a 01010050 00000000 00000000 00000000
ffff95ec318b7180 1742950657 C Co:1:015:0 0 20 >
ffff95ec318b7a80 1742952742 C Ii:1:015:2 0:1 20 = 11ff115a ffffffff ffffffff ffffffff ffffffff
ffff95ec318b7600 1742952918 S Ii:1:015:2 -115:1 64 <
ffff95ec318b7a80 1742953217 S Co:1:015:0 s 21 09 0211 0001 0014 20 = 11ff115a 01010060 00000000 00000000 00000000
ffff95ec318b7a80 1742953420 C Co:1:015:0 0 20 >
ffff95ec318b7600 1742955730 C Ii:1:015:2 0:1 20 = 11ff115a ffffffff ffffffff ffffffff ffffffff
ffff95ec318b7180 1742955874 S Ii:1:015:2 -115:1 64 <
ffff95ec318b7d80 1743060821 S Co:1:015:0 s 21 09 0211 0001 0014 20 = 11ff115a 01010070 00000000 00000000 00000000
ffff95ec318b7d80 1743061030 C Co:1:015:0 0 20 >
ffff95ec318b7180 1743063727 C Ii:1:015:2 0:1 20 = 11ff115a ffffffff ffffffff ffffffff ffffffff
ffff95ec318b7840 1743063894 S Ii:1:015:2 -115:1 64 <
ffff95ec318b7540 1743065597 S Co:1:015:0 s 21 09 0211 0001 0014 20 = 11ff115a 01010080 00000000 00000000 00000000
ffff95ec318b7540 1743065790 C Co:1:015:0 0 20 >
ffff95ec318b7840 1743067726 C Ii:1:015:2 0:1 20 = 11ff115a ffffffff ffffffff ffffffff ffffffff
ffff95ec318b7000 1743067874 S Ii:1:015:2 -115:1 64 <
ffff95ec318b7840 1743068196 S Co:1:015:0 s 21 09 0211 0001 0014 20 = 11ff115a 01010090 00000000 00000000 00000000
ffff95ec318b7840 1743068394 C Co:1:015:0 0 20 >
ffff95ec318b7000 1743070691 C Ii:1:015:2 0:1 20 = 11ff115a ffffffff ffffffff ffffffff ffffffff
ffff95ec318b7540 1743070817 S Ii:1:015:2 -115:1 64 <
ffff95ec318b7180 1743083622 S Co:1:015:0 s 21 09 0211 0001 0014 20 = 11ff115a 010100a0 00000000 00000000 00000000
ffff95ec318b7180 1743083793 C Co:1:015:0 0 20 >
ffff95ec318b7540 1743085692 C Ii:1:015:2 0:1 20 = 11ff115a ffffffff ffffffff ffffffff ffffffff
ffff95ec318b7d80 1743085845 S Ii:1:015:2 -115:1 64 <
ffff95ec318b7600 1743087326 S Co:1:015:0 s 21 09 0211 0001 0014 20 = 11ff115a 010100b0 00000000 00000000 00000000
ffff95ec318b7600 1743087510 C Co:1:015:0 0 20 >
ffff95ec318b7d80 1743089691 C Ii:1:015:2 0:1 20 = 11ff115a ffffffff ffffffff ffffffff ffffffff
ffff95eb3347a600 1743089917 S Ii:1:015:2 -115:1 64 <
ffff95eb3347a540 1743090579 S Co:1:015:0 s 21 09 0211 0001 0014 20 = 11ff115a 010100c0 00000000 00000000 00000000
ffff95eb3347a540 1743090735 C Co:1:015:0 0 20 >
ffff95eb3347a600 1743092692 C Ii:1:015:2 0:1 20 = 11ff115a ffffffff ffffffff ffffffff ffffffff
ffff95eb3347ae40 1743092943 S Ii:1:015:2 -115:1 64 <
ffff95eb3347a9c0 1743096635 S Co:1:015:0 s 21 09 0211 0001 0014 20 = 11ff115a 010100d0 00000000 00000000 00000000
ffff95eb3347a9c0 1743096837 C Co:1:015:0 0 20 >
ffff95eb3347ae40 1743098718 C Ii:1:015:2 0:1 20 = 11ff115a 03000000 00000834 64000004 ff000000
ffff95eb3347a480 1743098883 S Ii:1:015:2 -115:1 64 <
ffff95eb3347a0c0 1743099826 S Co:1:015:0 s 21 09 0211 0001 0014 20 = 11ff115a 010100e0 00000000 00000000 00000000
ffff95eb3347a0c0 1743099970 C Co:1:015:0 0 20 >
ffff95eb3347a480 1743102723 C Ii:1:015:2 0:1 20 = 11ff115a 00ff3401 64080300 00000000 08343200
ffff95ea98e1a600 1743102919 S Ii:1:015:2 -115:1 64 <
ffff95ea98e1a840 1743135612 S Co:1:015:0 s 21 09 0211 0001 0014 20 = 11ff115a 010100f0 00000000 00000000 00000000
ffff95ea98e1a840 1743135765 C Co:1:015:0 0 20 >
ffff95ea98e1a600 1743137741 C Ii:1:015:2 0:1 20 = 11ff115a 0004ff00 000000ff 34013208 ffffff00
ffff95ea98e1a180 1743137909 S Ii:1:015:2 -115:1 64 <
ffff95ea98e1a480 1743141025 S Co:1:015:0 s 21 09 0211 0001 0014 20 = 11ff115a 00010000 00000000 00000000 00000000
ffff95ea98e1a480 1743141194 C Co:1:015:0 0 20 >
ffff95ea98e1a180 1743143714 C Ii:1:015:2 0:1 20 = 11ff115a 01000000 00000000 00000000 00000000
ffff95ea98e1ac00 1743143856 S Ii:1:015:2 -115:1 64 <
ffff95ea98e1a0c0 1743150749 S Co:1:015:0 s 21 09 0211 0001 0014 20 = 11ff115a 00010010 00000000 00000000 00000000
ffff95ea98e1a0c0 1743150889 C Co:1:015:0 0 20 >
ffff95ea98e1ac00 1743153688 C Ii:1:015:2 0:1 20 = 11ff115a 0000ffff ffffffff ffffffff 00000000
ffff95ea98e1a780 1743153846 S Ii:1:015:2 -115:1 64 <
ffff95ea98e1ad80 1743154574 S Co:1:015:0 s 21 09 0211 0001 0014 20 = 11ff115a 00010020 00000000 00000000 00000000
ffff95ea98e1ad80 1743154765 C Co:1:015:0 0 20 >
ffff95ea98e1a780 1743156718 C Ii:1:015:2 0:1 20 = 11ff115a 8002003a 8002003b 8002003c 8002003d
ffff95ea98e1a300 1743156917 S Ii:1:015:2 -115:1 64 <
ffff95ea98e1a000 1743157394 S Co:1:015:0 s 21 09 0211 0001 0014 20 = 11ff115a 00010030 00000000 00000000 00000000
ffff95ea98e1a000 1743157554 C Co:1:015:0 0 20 >
ffff95ea98e1a300 1743159713 C Ii:1:015:2 0:1 20 = 11ff115a 8002003e 900d0001 900d0002 900d0003
ffff95ea98e1acc0 1743159887 S Ii:1:015:2 -115:1 64 <
ffff95ea98e1a240 1743163315 S Co:1:015:0 s 21 09 0211 0001 0014 20 = 11ff115a 00010040 00000000 00000000 00000000
ffff95ea98e1a240 1743163494 C Co:1:015:0 0 20 >
ffff95ea98e1acc0 1743165720 C Ii:1:015:2 0:1 20 = 11ff115a ffffffff ffffffff ffffffff ffffffff
ffff95ea98e1ae40 1743165912 S Ii:1:015:2 -115:1 64 <
ffff95ea98e1ab40 1743166795 S Co:1:015:0 s 21 09 0211 0001 0014 20 = 11ff115a 00010050 00000000 00000000 00000000
ffff95ea98e1ab40 1743166974 C Co:1:015:0 0 20 >
ffff95ea98e1ae40 1743169720 C Ii:1:015:2 0:1 20 = 11ff115a ffffffff ffffffff ffffffff ffffffff
ffff95ea98e1a3c0 1743169853 S Ii:1:015:2 -115:1 64 <
ffff95ea98e1a900 1743170508 S Co:1:015:0 s 21 09 0211 0001 0014 20 = 11ff115a 00010060 00000000 00000000 00000000
ffff95ea98e1a900 1743170707 C Co:1:015:0 0 20 >
ffff95ea98e1a3c0 1743172742 C Ii:1:015:2 0:1 20 = 11ff115a ffffffff ffffffff ffffffff ffffffff
ffff95ea98e1a540 1743172902 S Ii:1:015:2 -115:1 64 <
ffff95ea98e1a3c0 1743173193 S Co:1:015:0 s 21 09 0211 0001 0014 20 = 11ff115a 00010070 00000000 00000000 00000000
ffff95ea98e1a3c0 1743173398 C Co:1:015:0 0 20 >
ffff95ea98e1a540 1743175718 C Ii:1:015:2 0:1 20 = 11ff115a ffffffff ffffffff ffffffff ffffffff
ffff95ea98e1a900 1743175814 S Ii:1:015:2 -115:1 64 <
ffff95ea98e1ae40 1743179496 S Co:1:015:0 s 21 09 0211 0001 0014 20 = 11ff115a 00010080 00000000 00000000 00000000
ffff95ea98e1ae40 1743179660 C Co:1:015:0 0 20 >
ffff95ea98e1a900 1743181714 C Ii:1:015:2 0:1 20 = 11ff115a ffffffff ffffffff ffffffff ffffffff
ffff95ea98e1ab40 1743181883 S Ii:1:015:2 -115:1 64 <
ffff95ea98e1acc0 1743183152 S Co:1:015:0 s 21 09 0211 0001 0014 20 = 11ff115a 00010090 00000000 00000000 00000000
ffff95ea98e1acc0 1743183291 C Co:1:015:0 0 20 >
ffff95ea98e1ab40 1743185720 C Ii:1:015:2 0:1 20 = 11ff115a ffffffff ffffffff ffffffff ffffffff
ffff95ea98e1a240 1743185875 S Ii:1:015:2 -115:1 64 <
ffff95ea98e1a300 1743186669 S Co:1:015:0 s 21 09 0211 0001 0014 20 = 11ff115a 000100a0 00000000 00000000 00000000
ffff95ea98e1a300 1743186846 C Co:1:015:0 0 20 >
ffff95ea98e1a240 1743188719 C Ii:1:015:2 0:1 20 = 11ff115a ffffffff ffffffff ffffffff ffffffff
ffff95ea98e1a000 1743188896 S Ii:1:015:2 -115:1 64 <
ffff95ea98e1a780 1743194250 S Co:1:015:0 s 21 09 0211 0001 0014 20 = 11ff115a 000100b0 00000000 00000000 00000000
ffff95ea98e1a780 1743194385 C Co:1:015:0 0 20 >
ffff95ea98e1a000 1743196719 C Ii:1:015:2 0:1 20 = 11ff115a ffffffff ffffffff ffffffff ffffffff
ffff95ea98e1ad80 1743196866 S Ii:1:015:2 -115:1 64 <
ffff95ea98e1ac00 1743197625 S Co:1:015:0 s 21 09 0211 0001 0014 20 = 11ff115a 000100c0 00000000 00000000 00000000
ffff95ea98e1ac00 1743197878 C Co:1:015:0 0 20 >
ffff95ea98e1ad80 1743199718 C Ii:1:015:2 0:1 20 = 11ff115a ffffffff ffffffff ffffffff ffffffff
ffff95ea98e1a0c0 1743199864 S Ii:1:015:2 -115:1 64 <
ffff95ea98e1a180 1743200295 S Co:1:015:0 s 21 09 0211 0001 0014 20 = 11ff115a 000100d0 00000000 00000000 00000000
ffff95ea98e1a180 1743200496 C Co:1:015:0 0 20 >
ffff95ea98e1a0c0 1743202739 C Ii:1:015:2 0:1 20 = 11ff115a 03000000 00000834 64000004 ff000000
ffff95ea98e1a480 1743202967 S Ii:1:015:2 -115:1 64 <
ffff95ea98e1a600 1743206988 S Co:1:015:0 s 21 09 0211 0001 0014 20 = 11ff115a 000100e0 00000000 00000000 00000000
ffff95ea98e1a600 1743207194 C Co:1:015:0 0 20 >
ffff95ea98e1a480 1743209710 C Ii:1:015:2 0:1 20 = 11ff115a 00ff3401 64080300 00000000 08343200
ffff95ea98e1a840 1743209883 S Ii:1:015:2 -115:1 64 <
ffff95ea98e1af00 1743210110 S Co:1:015:0 s 21 09 0211 0001 0014 20 = 11ff115a 000100f0 00000000 00000000 00000000
ffff95ea98e1af00 1743210307 C Co:1:015:0 0 20 >
ffff95ea98e1a840 1743212714 C Ii:1:015:2 0:1 20 = 11ff115a 0004ff00 000000ff 34013208 ffff3f16
ffff95ea98e1a9c0 1743212872 S Ii:1:015:2 -115:1 64 <
ffff95ea98e1aa80 1743213228 S Co:1:015:0 s 21 09 0211 0001 0014 20 = 11ff115a 01020000 00000000 00000000 00000000
ffff95ea98e1aa80 1743213364 C Co:1:015:0 0 20 >
ffff95ea98e1a9c0 1743215717 C Ii:1:015:2 0:1 20 = 11ff115a 01000000 00000000 00000000 00000000
ffff95eb4cda4cc0 1743215882 S Ii:1:015:2 -115:1 64 <
ffff95eb4cda4840 1743221636 S Co:1:015:0 s 21 09 0211 0001 0014 20 = 11ff115a 01020010 00000000 00000000 00000000
ffff95eb4cda4840 1743221785 C Co:1:015:0 0 20 >
ffff95eb4cda4cc0 1743223732 C Ii:1:015:2 0:1 20 = 11ff115a 0000ffff ffffffff ffffffff 00000000
ffff95ed5b222180 1743223836 S Ii:1:015:2 -115:1 64 <
ffff95ed5b222840 1743225034 S Co:1:015:0 s 21 09 0211 0001 0014 20 = 11ff115a 01020020 00000000 00000000 00000000
ffff95ed5b222840 1743225167 C Co:1:015:0 0 20 >
ffff95ed5b222180 1743227740 C Ii:1:015:2 0:1 20 = 11ff115a 8002001e 8002001f 80020020 80020021
ffff95eb3347a480 1743227920 S Ii:1:015:2 -115:1 64 <
ffff95eb3347a0c0 1743235794 S Co:1:015:0 s 21 09 0211 0001 0014 20 = 11ff115a 01020030 00000000 00000000 00000000
ffff95eb3347a0c0 1743235963 C Co:1:015:0 0 20 >
ffff95eb3347a480 1743238733 C Ii:1:015:2 0:1 20 = 11ff115a 80020022 900d0001 900d0002 900d0003
ffff95eb3347ae40 1743238869 S Ii:1:015:2 -115:1 64 <
ffff95eb3347a9c0 1743239168 S Co:1:015:0 s 21 09 0211 0001 0014 20 = 11ff115a 01020040 00000000 00000000 00000000
ffff95eb3347a9c0 1743239325 C Co:1:015:0 0 20 >
ffff95eb3347ae40 1743241715 C Ii:1:015:2 0:1 20 = 11ff115a ffffffff ffffffff ffffffff ffffffff
ffff95eb3347a600 1743241850 S Ii:1:015:2 -115:1 64 <
ffff95eb3347a540 1743242153 S Co:1:015:0 s 21 09 0211 0001 0014 20 = 11ff115a 01020050 00000000 00000000 00000000
ffff95eb3347a540 1743242403 C Co:1:015:0 0 20 >
ffff95eb3347a600 1743244711 C Ii:1:015:2 0:1 20 = 11ff115a ffffffff ffffffff ffffffff ffffffff
ffff95eb3347a900 1743244889 S Ii:1:015:2 -115:1 64 <
ffff95eb3347a240 1743250019 S Co:1:015:0 s 21 09 0211 0001 0014 20 = 11ff115a 01020060 00000000 00000000 00000000
ffff95eb3347a240 1743250198 C Co:1:015:0 0 20 >
ffff95eb3347a900 1743252755 C Ii:1:015:2 0:1 20 = 11ff115a ffffffff ffffffff ffffffff ffffffff
ffff95eb52e0d900 1743252838 S Ii:1:015:2 -115:1 64 <
ffff95eb52e0d300 1743254629 S Co:1:015:0 s 21 09 0211 0001 0014 20 = 11ff115a 01020070 00000000 00000000 00000000
ffff95eb52e0d300 1743254789 C Co:1:015:0 0 20 >
ffff95eb52e0d900 1743256716 C Ii:1:015:2 0:1 20 = 11ff115a ffffffff ffffffff ffffffff ffffffff
ffff95eb52e0d480 1743256836 S Ii:1:015:2 -115:1 64 <
ffff95eb52e0d600 1743257499 S Co:1:015:0 s 21 09 0211 0001 0014 20 = 11ff115a 01020080 00000000 00000000 00000000
ffff95eb52e0d600 1743257659 C Co:1:015:0 0 20 >
ffff95eb52e0d480 1743259717 C Ii:1:015:2 0:1 20 = 11ff115a ffffffff ffffffff ffffffff ffffffff
ffff95eb52e0db40 1743259835 S Ii:1:015:2 -115:1 64 <
ffff95eb52e0da80 1743267241 S Co:1:015:0 s 21 09 0211 0001 0014 20 = 11ff115a 01020090 00000000 00000000 00000000
ffff95eb52e0da80 1743267378 C Co:1:015:0 0 20 >
ffff95eb52e0db40 1743269725 C Ii:1:015:2 0:1 20 = 11ff115a ffffffff ffffffff ffffffff ffffffff
ffff95eb52e0d3c0 1743269839 S Ii:1:015:2 -115:1 64 <
ffff95eb52e0d180 1743270572 S Co:1:015:0 s 21 09 0211 0001 0014 20 = 11ff115a 010200a0 00000000 00000000 00000000
ffff95eb52e0d180 1743270778 C Co:1:015:0 0 20 >
ffff95eb52e0d3c0 1743272716 C Ii:1:015:2 0:1 20 = 11ff115a ffffffff ffffffff ffffffff ffffffff
ffff95eb52e0d0c0 1743272878 S Ii:1:015:2 -115:1 64 <
ffff95eb52e0d780 1743273261 S Co:1:015:0 s 21 09 0211 0001 0014 20 = 11ff115a 010200b0 00000000 00000000 00000000
ffff95eb52e0d780 1743273397 C Co:1:015:0 0 20 >
ffff95eb52e0d0c0 1743275714 C Ii:1:015:2 0:1 20 = 11ff115a ffffffff ffffffff ffffffff ffffffff
ffff95eb52e0d840 1743275873 S Ii:1:015:2 -115:1 64 <
ffff95eb52e0d9c0 1743279693 S Co:1:015:0 s 21 09 0211 0001 0014 20 = 11ff115a 010200c0 00000000 00000000 00000000
ffff95eb52e0d9c0 1743279877 C Co:1:015:0 0 20 >
ffff95eb52e0d840 1743282714 C Ii:1:015:2 0:1 20 = 11ff115a ffffffff ffffffff ffffffff ffffffff
ffff95ec318b7a80 1743282909 S Ii:1:015:2 -115:1 64 <
ffff95ec318b7d80 1743283494 S Co:1:015:0 s 21 09 0211 0001 0014 20 = 11ff115a 010200d0 00000000 00000000 00000000
ffff95ec318b7d80 1743283696 C Co:1:015:0 0 20 >
ffff95ec318b7a80 1743285731 C Ii:1:015:2 0:1 20 = 11ff115a 0a00dcff 0bb80164 0000000a 00dcff0b
ffff95ec318b7600 1743285896 S Ii:1:015:2 -115:1 64 <
ffff95ec318b7540 1743287316 S Co:1:015:0 s 21 09 0211 0001 0014 20 = 11ff115a 010200e0 00000000 00000000 00000000
ffff95ec318b7540 1743287502 C Co:1:015:0 0 20 >
ffff95ec318b7600 1743289727 C Ii:1:015:2 0:1 20 = 11ff115a b8016400 00000a00 dcff0bb8 01320000
ffff95ec318b7180 1743289933 S Ii:1:015:2 -115:1 64 <
ffff95ec318b7000 1743294581 S Co:1:015:0 s 21 09 0211 0001 0014 20 = 11ff115a 010200f0 00000000 00000000 00000000
ffff95ec318b7000 1743294747 C Co:1:015:0 0 20 >
ffff95ec318b7180 1743296717 C Ii:1:015:2 0:1 20 = 11ff115a 000a00dc ff0bb801 32000000 ffffff00
ffff95ec318b7840 1743296910 S Ii:1:015:2 -115:1 64 <
ffff95ec318b7180 1743297890 S Co:1:015:0 s 21 09 0211 0001 0014 20 = 11ff115a 00020000 00000000 00000000 00000000
ffff95ec318b7180 1743298064 C Co:1:015:0 0 20 >
ffff95ec318b7840 1743300726 C Ii:1:015:2 0:1 20 = 11ff115a 01000000 00000000 00000000 00000000
ffff95ec318b7000 1743300956 S Ii:1:015:2 -115:1 64 <
ffff95ec318b7600 1743312173 S Co:1:015:0 s 21 09 0211 0001 0014 20 = 11ff115a 00020010 00000000 00000000 00000000
ffff95ec318b7600 1743312405 C Co:1:015:0 0 20 >
ffff95ec318b7000 1743314716 C Ii:1:015:2 0:1 20 = 11ff115a 0000ffff ffffffff ffffffff 00000000
ffff95ec318b7540 1743314797 S Ii:1:015:2 -115:1 64 <
ffff95ec318b7a80 1743315947 S Co:1:015:0 s 21 09 0211 0001 0014 20 = 11ff115a 00020020 00000000 00000000 00000000
ffff95ec318b7a80 1743316113 C Co:1:015:0 0 20 >
ffff95ec318b7540 1743318710 C Ii:1:015:2 0:1 20 = 11ff115a 8002001e 8002001f 80020020 80020021
ffff95ec318b7d80 1743318970 S Ii:1:015:2 -115:1 64 <
ffff95ec318b7540 1743323774 S Co:1:015:0 s 21 09 0211 0001 0014 20 = 11ff115a 00020030 00000000 00000000 00000000
ffff95ec318b7540 1743323911 C Co:1:015:0 0 20 >
ffff95ec318b7d80 1743326703 C Ii:1:015:2 0:1 20 = 11ff115a 80020022 900d0001 900d0002 900d0003
ffff95ec318b7a80 1743326891 S Ii:1:015:2 -115:1 64 <
ffff95ec318b7000 1743328817 S Co:1:015:0 s 21 09 0211 0001 0014 20 = 11ff115a 00020040 00000000 00000000 00000000
ffff95ec318b7000 1743328972 C Co:1:015:0 0 20 >
ffff95ec318b7a80 1743331711 C Ii:1:015:2 0:1 20 = 11ff115a ffffffff ffffffff ffffffff ffffffff
ffff95ec318b7600 1743331897 S Ii:1:015:2 -115:1 64 <
ffff95ec318b7840 1743349239 S Co:1:015:0 s 21 09 0211 0001 0014 20 = 11ff115a 00020050 00000000 00000000 00000000
ffff95ec318b7840 1743349406 C Co:1:015:0 0 20 >
ffff95ec318b7600 1743351754 C Ii:1:015:2 0:1 20 = 11ff115a ffffffff ffffffff ffffffff ffffffff
ffff95ec318b7180 1743351901 S Ii:1:015:2 -115:1 64 <
ffff95ec318b7600 1743353197 S Co:1:015:0 s 21 09 0211 0001 0014 20 = 11ff115a 00020060 00000000 00000000 00000000
ffff95ec318b7600 1743353332 C Co:1:015:0 0 20 >
ffff95ec318b7180 1743355704 C Ii:1:015:2 0:1 20 = 11ff115a ffffffff ffffffff ffffffff ffffffff
ffff95ec318b7840 1743355877 S Ii:1:015:2 -115:1 64 <
ffff95ec318b7a80 1743356847 S Co:1:015:0 s 21 09 0211 0001 0014 20 = 11ff115a 00020070 00000000 00000000 00000000
ffff95ec318b7a80 1743356998 C Co:1:015:0 0 20 >
ffff95ec318b7840 1743359709 C Ii:1:015:2 0:1 20 = 11ff115a ffffffff ffffffff ffffffff ffffffff
ffff95ec318b7000 1743359854 S Ii:1:015:2 -115:1 64 <
ffff95ec318b7d80 1743407553 S Co:1:015:0 s 21 09 0211 0001 0014 20 = 11ff115a 00020080 00000000 00000000 00000000
ffff95ec318b7d80 1743407717 C Co:1:015:0 0 20 >
ffff95ec318b7000 1743409719 C Ii:1:015:2 0:1 20 = 11ff115a ffffffff ffffffff ffffffff ffffffff
ffff95ec318b7540 1743409829 S Ii:1:015:2 -115:1 64 <
ffff95ec318b7000 1743412675 S Co:1:015:0 s 21 09 0211 0001 0014 20 = 11ff115a 00020090 00000000 00000000 00000000
ffff95ec318b7000 1743412811 C Co:1:015:0 0 20 >
ffff95ec318b7540 1743415706 C Ii:1:015:2 0:1 20 = 11ff115a ffffffff ffffffff ffffffff ffffffff
ffff95ec318b7d80 1743415848 S Ii:1:015:2 -115:1 64 <
ffff95ec318b7840 1743422016 S Co:1:015:0 s 21 09 0211 0001 0014 20 = 11ff115a 000200a0 00000000 00000000 00000000
ffff95ec318b7840 1743422175 C Co:1:015:0 0 20 >
ffff95ec318b7d80 1743424724 C Ii:1:015:2 0:1 20 = 11ff115a ffffffff ffffffff ffffffff ffffffff
ffff95ec318b7a80 1743424907 S Ii:1:015:2 -115:1 64 <
ffff95ec318b7180 1743425207 S Co:1:015:0 s 21 09 0211 0001 0014 20 = 11ff115a 000200b0 00000000 00000000 00000000
ffff95ec318b7180 1743425411 C Co:1:015:0 0 20 >
ffff95ec318b7a80 1743427721 C Ii:1:015:2 0:1 20 = 11ff115a ffffffff ffffffff ffffffff ffffffff
ffff95ec318b7600 1743427872 S Ii:1:015:2 -115:1 64 <
ffff95ec318b7a80 1743451781 S Co:1:015:0 s 21 09 0211 0001 0014 20 = 11ff115a 000200c0 00000000 00000000 00000000
ffff95ec318b7a80 1743451993 C Co:1:015:0 0 20 >
ffff95ec318b7600 1743454712 C Ii:1:015:2 0:1 20 = 11ff115a ffffffff ffffffff ffffffff ffffffff
ffff95eb4cda4cc0 1743454841 S Ii:1:015:2 -115:1 64 <
ffff95eb3347af00 1743455609 S Co:1:015:0 s 21 09 0211 0001 0014 20 = 11ff115a 000200d0 00000000 00000000 00000000
ffff95eb3347af00 1743455799 C Co:1:015:0 0 20 >
ffff95eb4cda4cc0 1743457710 C Ii:1:015:2 0:1 20 = 11ff115a 0a00dcff 0bb80164 0000000a 00dcff0b
ffff95eb3347af00 1743457845 S Ii:1:015:2 -115:1 64 <
ffff95eb3347a900 1743458620 S Co:1:015:0 s 21 09 0211 0001 0014 20 = 11ff115a 000200e0 00000000 00000000 00000000
ffff95eb3347a900 1743458830 C Co:1:015:0 0 20 >
ffff95eb3347af00 1743460695 C Ii:1:015:2 0:1 20 = 11ff115a b8016400 00000a00 dcff0bb8 01320000
ffff95eb3347a240 1743460847 S Ii:1:015:2 -115:1 64 <
ffff95eb3347a600 1743463045 S Co:1:015:0 s 21 09 0211 0001 0014 20 = 11ff115a 000200f0 00000000 00000000 00000000
ffff95eb3347a600 1743463260 C Co:1:015:0 0 20 >
ffff95eb3347a240 1743465668 C Ii:1:015:2 0:1 20 = 11ff115a 000a00dc ff0bb801 32000000 ffffae9b
ffff95eb3347a540 1743465832 S Ii:1:015:2 -115:1 64 <
ffff95eb3347ae40 1743466602 S Co:1:015:0 s 21 09 0211 0001 0014 20 = 11ff115a 01030000 00000000 00000000 00000000
ffff95eb3347ae40 1743466771 C Co:1:015:0 0 20 >
ffff95eb3347a540 1743468667 C Ii:1:015:2 0:1 20 = 11ff115a 01000000 00000000 00000000 00000000
ffff95eb3347a9c0 1743468826 S Ii:1:015:2 -115:1 64 <
ffff95eb3347a480 1743469726 S Co:1:015:0 s 21 09 0211 0001 0014 20 = 11ff115a 01030010 00000000 00000000 00000000
ffff95eb3347a480 1743469894 C Co:1:015:0 0 20 >
ffff95eb3347a9c0 1743472672 C Ii:1:015:2 0:1 20 = 11ff115a 0000ffff ffffffff ffffffff 00000000
ffff95eb3347a0c0 1743472837 S Ii:1:015:2 -115:1 64 <
ffff95eb3347a9c0 1743504572 S Co:1:015:0 s 21 09 0211 0001 0014 20 = 11ff115a 01030020 00000000 00000000 00000000
ffff95eb3347a9c0 1743504730 C Co:1:015:0 0 20 >
ffff95eb3347a0c0 1743506732 C Ii:1:015:2 0:1 20 = 11ff115a 80020023 80020024 80020025 80020026
ffff95ea98e1a9c0 1743506936 S Ii:1:015:2 -115:1 64 <
ffff95ea98e1aa80 1743508096 S Co:1:015:0 s 21 09 0211 0001 0014 20 = 11ff115a 01030030 00000000 00000000 00000000
ffff95ea98e1aa80 1743508278 C Co:1:015:0 0 20 >
ffff95ea98e1a9c0 1743510732 C Ii:1:015:2 0:1 20 = 11ff115a 80020027 900d0001 900d0002 900d0003
ffff95ea98e1a840 1743510897 S Ii:1:015:2 -115:1 64 <
ffff95ea98e1af00 1743519164 S Co:1:015:0 s 21 09 0211 0001 0014 20 = 11ff115a 01030040 00000000 00000000 00000000
ffff95ea98e1af00 1743519335 C Co:1:015:0 0 20 >
ffff95ea98e1a840 1743521695 C Ii:1:015:2 0:1 20 = 11ff115a ffffffff ffffffff ffffffff ffffffff
ffff95ea98e1a480 1743521893 S Ii:1:015:2 -115:1 64 <
ffff95ea98e1a600 1743523287 S Co:1:015:0 s 21 09 0211 0001 0014 20 = 11ff115a 01030050 00000000 00000000 00000000
ffff95ea98e1a600 1743523454 C Co:1:015:0 0 20 >
ffff95ea98e1a480 1743525715 C Ii:1:015:2 0:1 20 = 11ff115a ffffffff ffffffff ffffffff ffffffff
ffff95ea98e1a0c0 1743525876 S Ii:1:015:2 -115:1 64 <
ffff95ea98e1a180 1743526453 S Co:1:015:0 s 21 09 0211 0001 0014 20 = 11ff115a 01030060 00000000 00000000 00000000
ffff95ea98e1a180 1743526593 C Co:1:015:0 0 20 >
ffff95ea98e1a0c0 1743528666 C Ii:1:015:2 0:1 20 = 11ff115a ffffffff ffffffff ffffffff ffffffff
ffff95ed5b222240 1743528820 S Ii:1:015:2 -115:1 64 <
ffff95ed5b222180 1743533429 S Co:1:015:0 s 21 09 0211 0001 0014 20 = 11ff115a 01030070 00000000 00000000 00000000
ffff95ed5b222180 1743533621 C Co:1:015:0 0 20 >
ffff95ed5b222240 1743535730 C Ii:1:015:2 0:1 20 = 11ff115a ffffffff ffffffff ffffffff ffffffff
ffff95ea98e1ad80 1743535914 S Ii:1:015:2 -115:1 64 <
ffff95ea98e1ac00 1743538931 S Co:1:015:0 s 21 09 0211 0001 0014 20 = 11ff115a 01030080 00000000 00000000 00000000
ffff95ea98e1ac00 1743539090 C Co:1:015:0 0 20 >
ffff95ea98e1ad80 1743541697 C Ii:1:015:2 0:1 20 = 11ff115a ffffffff ffffffff ffffffff ffffffff
ffff95ea98e1a000 1743541817 S Ii:1:015:2 -115:1 64 <
ffff95eb334ab240 1743561712 S Co:1:015:0 s 21 09 0211 0001 0014 20 = 11ff115a 01030090 00000000 00000000 00000000
ffff95eb334ab240 1743561866 C Co:1:015:0 0 20 >
ffff95ea98e1a000 1743564699 C Ii:1:015:2 0:1 20 = 11ff115a ffffffff ffffffff ffffffff ffffffff
ffff95ea98e1a780 1743564895 S Ii:1:015:2 -115:1 64 <
ffff95ea98e1a240 1743565466 S Co:1:015:0 s 21 09 0211 0001 0014 20 = 11ff115a 010300a0 00000000 00000000 00000000
ffff95ea98e1a240 1743565598 C Co:1:015:0 0 20 >
ffff95ea98e1a780 1743567690 C Ii:1:015:2 0:1 20 = 11ff115a ffffffff ffffffff ffffffff ffffffff
ffff95ea98e1a300 1743567823 S Ii:1:015:2 -115:1 64 <
ffff95ea98e1ab40 1743568086 S Co:1:015:0 s 21 09 0211 0001 0014 20 = 11ff115a 010300b0 00000000 00000000 00000000
ffff95ea98e1ab40 1743568233 C Co:1:015:0 0 20 >
ffff95ea98e1a300 1743570712 C Ii:1:015:2 0:1 20 = 11ff115a ffffffff ffffffff ffffffff ffffffff
ffff95ea98e1acc0 1743570856 S Ii:1:015:2 -115:1 64 <
ffff95ea98e1a900 1743578673 S Co:1:015:0 s 21 09 0211 0001 0014 20 = 11ff115a 010300c0 00000000 00000000 00000000
ffff95ea98e1a900 1743578838 C Co:1:015:0 0 20 >
ffff95ea98e1acc0 1743581690 C Ii:1:015:2 0:1 20 = 11ff115a ffffffff ffffffff ffffffff ffffffff
ffff95ea98e1ae40 1743581846 S Ii:1:015:2 -115:1 64 <
ffff95ea98e1a540 1743584103 S Co:1:015:0 s 21 09 0211 0001 0014 20 = 11ff115a 010300d0 00000000 00000000 00000000
ffff95ea98e1a540 1743584252 C Co:1:015:0 0 20 >
ffff95ea98e1ae40 1743586694 C Ii:1:015:2 0:1 20 = 11ff115a 03000000 00001388 64000003 00000000
ffff95eb334ab3c0 1743586825 S Ii:1:015:2 -115:1 64 <
ffff95eb334abc00 1743617122 S Co:1:015:0 s 21 09 0211 0001 0014 20 = 11ff115a 010300e0 00000000 00000000 00000000
ffff95eb334abc00 1743617342 C Co:1:015:0 0 20 >
ffff95eb334ab3c0 1743619660 C Ii:1:015:2 0:1 20 = 11ff115a 00138864 00000300 00000000 13883200
ffff95eb334ab300 1743619819 S Ii:1:015:2 -115:1 64 <
ffff95eb334ab9c0 1743621007 S Co:1:015:0 s 21 09 0211 0001 0014 20 = 11ff115a 010300f0 00000000 00000000 00000000
ffff95eb334ab9c0 1743621158 C Co:1:015:0 0 20 >
ffff95eb334ab300 1743623658 C Ii:1:015:2 0:1 20 = 11ff115a 00030000 00000013 88320000 ffffff00
ffff95eb334ab300 1743623831 S Ii:1:015:2 -115:1 64 <
ffff95eb50e18a80 1743624150 S Co:1:015:0 s 21 09 0211 0001 0014 20 = 11ff115a 00030000 00000000 00000000 00000000
ffff95eb50e18a80 1743624329 C Co:1:015:0 0 20 >
ffff95eb334ab300 1743626692 C Ii:1:015:2 0:1 20 = 11ff115a 01000000 00000000 00000000 00000000
ffff95eb50e18900 1743626790 S Ii:1:015:2 -115:1 64 <
ffff95eb50e18840 1743639653 S Co:1:015:0 s 21 09 0211 0001 0014 20 = 11ff115a 00030010 00000000 00000000 00000000
ffff95eb50e18840 1743639850 C Co:1:015:0 0 20 >
ffff95eb50e18900 1743642686 C Ii:1:015:2 0:1 20 = 11ff115a 0000ffff ffffffff ffffffff 00000000
ffff95eb50e18c00 1743642814 S Ii:1:015:2 -115:1 64 <
ffff95eb50e18b40 1743644958 S Co:1:015:0 s 21 09 0211 0001 0014 20 = 11ff115a 00030020 00000000 00000000 00000000
ffff95eb50e18b40 1743645160 C Co:1:015:0 0 20 >
ffff95eb50e18c00 1743647684 C Ii:1:015:2 0:1 20 = 11ff115a 80020023 80020024 80020025 80020026
ffff95eb50e180c0 1743647798 S Ii:1:015:2 -115:1 64 <
ffff95eb50e18f00 1743667575 S Co:1:015:0 s 21 09 0211 0001 0014 20 = 11ff115a 00030030 00000000 00000000 00000000
ffff95eb50e18f00 1743667801 C Co:1:015:0 0 20 >
ffff95eb50e180c0 1743669708 C Ii:1:015:2 0:1 20 = 11ff115a 80020027 900d0001 900d0002 900d0003
ffff95eb50e180c0 1743669835 S Ii:1:015:2 -115:1 64 <
ffff95eb50e18f00 1743673477 S Co:1:015:0 s 21 09 0211 0001 0014 20 = 11ff115a 00030040 00000000 00000000 00000000
ffff95eb50e18f00 1743673637 C Co:1:015:0 0 20 >
ffff95eb50e180c0 1743675658 C Ii:1:015:2 0:1 20 = 11ff115a ffffffff ffffffff ffffffff ffffffff
ffff95eb50e18c00 1743675752 S Ii:1:015:2 -115:1 64 <
ffff95eb50e18b40 1743677850 S Co:1:015:0 s 21 09 0211 0001 0014 20 = 11ff115a 00030050 00000000 00000000 00000000
ffff95eb50e18b40 1743677988 C Co:1:015:0 0 20 >
ffff95eb50e18c00 1743680657 C Ii:1:015:2 0:1 20 = 11ff115a ffffffff ffffffff ffffffff ffffffff
ffff95eb50e18900 1743680788 S Ii:1:015:2 -115:1 64 <
ffff95eb50e18840 1743732052 S Co:1:015:0 s 21 09 0211 0001 0014 20 = 11ff115a 00030060 00000000 00000000 00000000
ffff95eb50e18840 1743732246 C Co:1:015:0 0 20 >
ffff95eb50e18900 1743734707 C Ii:1:015:2 0:1 20 = 11ff115a ffffffff ffffffff ffffffff ffffffff
ffff95eb50e18a80 1743734890 S Ii:1:015:2 -115:1 64 <
ffff95eb50e183c0 1743735410 S Co:1:015:0 s 21 09 0211 0001 0014 20 = 11ff115a 00030070 00000000 00000000 00000000
ffff95eb50e183c0 1743735603 C Co:1:015:0 0 20 >
ffff95eb50e18a80 1743737655 C Ii:1:015:2 0:1 20 = 11ff115a ffffffff ffffffff ffffffff ffffffff
ffff95ec318b7180 1743740639 S Ii:1:015:2 -115:1 64 <
ffff95eb3d9810c0 1743800664 S Co:1:015:0 s 21 09 0211 0001 0014 20 = 11ff115a 00030080 00000000 00000000 00000000
ffff95eb3d9810c0 1743800788 C Co:1:015:0 0 20 >
ffff95ec318b7180 1743802702 C Ii:1:015:2 0:1 20 = 11ff115a ffffffff ffffffff ffffffff ffffffff
ffff95eb3d981300 1743802800 S Ii:1:015:2 -115:1 64 <
ffff95eb3d981180 1743869248 S Co:1:015:0 s 21 09 0211 0001 0014 20 = 11ff115a 00030090 00000000 00000000 00000000
ffff95eb3d981180 1743869478 C Co:1:015:0 0 20 >
ffff95eb3d981300 1743871695 C Ii:1:015:2 0:1 20 = 11ff115a ffffffff ffffffff ffffffff ffffffff
ffff95eb3d981c00 1743871782 S Ii:1:015:2 -115:1 64 <
ffff95ed5b222840 1743874847 S Co:1:015:0 s 21 09 0211 0001 0014 20 = 11ff115a 000300a0 00000000 00000000 00000000
ffff95ed5b222840 1743874982 C Co:1:015:0 0 20 >
ffff95eb3d981c00 1743877684 C Ii:1:015:2 0:1 20 = 11ff115a ffffffff ffffffff ffffffff ffffffff
ffff95ed5b222cc0 1743877851 S Ii:1:015:2 -115:1 64 <
ffff95ed5b222540 1743890138 S Co:1:015:0 s 21 09 0211 0001 0014 20 = 11ff115a 000300b0 00000000 00000000 00000000
ffff95ed5b222540 1743890296 C Co:1:015:0 0 20 >
ffff95ed5b222cc0 1743892672 C Ii:1:015:2 0:1 20 = 11ff115a ffffffff ffffffff ffffffff ffffffff
ffff95eb3347a480 1743892907 S Ii:1:015:2 -115:1 64 <
ffff95eb3347a540 1743894076 S Co:1:015:0 s 21 09 0211 0001 0014 20 = 11ff115a 000300c0 00000000 00000000 00000000
ffff95eb3347a540 1743894326 C Co:1:015:0 0 20 >
ffff95eb3347a480 1743896713 C Ii:1:015:2 0:1 20 = 11ff115a ffffffff ffffffff ffffffff ffffffff
ffff95eb3347ae40 1743896852 S Ii:1:015:2 -115:1 64 <
ffff95eb3347a240 1743897093 S Co:1:015:0 s 21 09 0211 0001 0014 20 = 11ff115a 000300d0 00000000 00000000 00000000
ffff95eb3347a240 1743897234 C Co:1:015:0 0 20 >
ffff95eb3347ae40 1743899674 C Ii:1:015:2 0:1 20 = 11ff115a 03000000 00001388 64000003 00000000
ffff95eb3347a600 1743899796 S Ii:1:015:2 -115:1 64 <
ffff95eb3347af00 1743906229 S Co:1:015:0 s 21 09 0211 0001 0014 20 = 11ff115a 000300e0 00000000 00000000 00000000
ffff95eb3347af00 1743906370 C Co:1:015:0 0 20 >
ffff95eb3347a600 1743908674 C Ii:1:015:2 0:1 20 = 11ff115a 00138864 00000300 00000000 13883200
ffff95eb3347a900 1743908822 S Ii:1:015:2 -115:1 64 <
ffff95eb3347a600 1743911245 S Co:1:015:0 s 21 09 0211 0001 0014 20 = 11ff115a 000300f0 00000000 00000000 00000000
ffff95eb3347a600 1743911399 C Co:1:015:0 0 20 >
ffff95eb3347a900 1743913674 C Ii:1:015:2 0:1 20 = 11ff115a 00030000 00000013 88320000 ffff7df8
ffff95eb3347af00 1743913869 S Ii:1:015:2 -115:1 64 <
ffff95eb3347ae40 1743914859 S Co:1:015:0 s 21 09 0211 0001 0014 20 = 11ff11ba 00000000 00000000 00000000 00000000
ffff95eb3347ae40 1743915012 C Co:1:015:0 0 20 >
ffff95eb3347af00 1743917674 C Ii:1:015:2 0:1 20 = 11ff11ba ff000000 00000000 00000000 00000000
ffff95eb3347a240 1743917874 S Ii:1:015:2 -115:1 64 <
ffff95eb3347a480 1743930159 S Co:1:015:0 s 21 09 0211 0001 0014 20 = 11ff111a 02000000 00000000 00000000 00000000
ffff95eb3347a480 1743930333 C Co:1:015:0 0 20 >
ffff95eb3347a240 1743932675 C Ii:1:015:2 0:1 20 = 11ff111a 00000000 00000000 00000000 00000000
ffff95ea98e1a3c0 1743932735 S Ii:1:015:2 -115:1 64 <
ffff95ea98e1a3c0 1743933668 C Ii:1:015:2 0:1 9 = 02000000 00000000 00
ffff95ea98e1a3c0 1743933736 S Ii:1:015:2 -115:1 64 <
ffff95ea98e1a3c0 1743934668 C Ii:1:015:2 0:1 9 = 01000000 00000000 00
ffff95ea98e1ae40 1743934819 S Ii:1:015:2 -115:1 64 <
ffff95ea98e1ae40 1743935670 C Ii:1:015:2 0:1 5 = 03000000 00
ffff95ea98e1a540 1743935840 S Ii:1:015:2 -115:1 64 <
ffff95ea98e1acc0 1743951399 S Co:1:015:0 s 21 09 0211 0001 0014 20 = 11ff111a 02000000 00000000 00000000 00000000
ffff95ea98e1acc0 1743951546 C Co:1:015:0 0 20 >
ffff95ea98e1a540 1743953656 C Ii:1:015:2 0:1 20 = 11ff111a 00000000 00000000 00000000 00000000
ffff95ea98e1a900 1743953868 S Ii:1:015:2 -115:1 64 <
ffff95ea98e1a300 1743954924 S Co:1:015:0 s 21 09 0211 0001 0014 20 = 11ff0a2a 01000000 00000000 00000000 00000000
ffff95ea98e1a300 1743955127 C Co:1:015:0 0 20 >
ffff95eb4cda4240 1743957666 C Ii:1:015:1 0:1 8 = 00000000 00000000
ffff95ea98e1a900 1743957671 C Ii:1:015:2 0:1 21 = 01000000 00000000 00000000 00000000 00000000 00
ffff95ea98e1ab40 1743957879 S Ii:1:015:1 -115:1 8 <
ffff95ea98e1a780 1743957890 S Ii:1:015:2 -115:1 64 <
ffff95ea98e1a780 1743958655 C Ii:1:015:2 0:1 2 = 0300
ffff95ea98e1a240 1743958818 S Ii:1:015:2 -115:1 64 <
ffff95ea98e1a240 1743959683 C Ii:1:015:2 0:1 20 = 11ff0a00 00000000 00000000 00000000 00000000
ffff95ea98e1a000 1743959831 S Ii:1:015:2 -115:1 64 <
ffff95ea98e1a000 1743960676 C Ii:1:015:2 0:1 20 = 11ff0a2a 01000000 00000000 00000000 00000000
ffff95ea98e1ad80 1743960780 S Ii:1:015:2 -115:1 64 <
ffff95ea98e1ad80 1743961674 C Ii:1:015:2 0:1 20 = 11ff0b00 00000000 00000000 00000000 00000000
ffff95ea98e1ac00 1743961777 S Ii:1:015:2 -115:1 64 <
ffff95ea98e1ac00 1743962677 C Ii:1:015:2 0:1 20 = 11ff0c00 00000000 00000000 00000000 00000000
ffff95eb334ab9c0 1743962870 S Ii:1:015:2 -115:1 64 <
ffff95eb334ab3c0 1743965637 S Co:1:015:0 s 21 09 0211 0001 0014 20 = 11ff0b1a 01000000 00000000 00000000 00000000
ffff95eb334ab3c0 1743965807 C Co:1:015:0 0 20 >
ffff95eb334ab9c0 1743968681 C Ii:1:015:2 0:1 20 = 11ff0b1a 01000000 00000000 00000000 00000000
ffff95eb334abc00 1743968832 S Ii:1:015:2 -115:1 64 <
ffff95eb334ab240 1743969618 S Co:1:015:0 s 21 09 0211 0001 0014 20 = 11ff0c0a 00000000 00000000 00000000 00000000
ffff95eb334ab240 1743969803 C Co:1:015:0 0 20 >
ffff95eb334abc00 1743971673 C Ii:1:015:2 0:1 20 = 11ff0c0a 00000000 00000000 00000000 00000000
ffff95eb334ab480 1743971771 S Ii:1:015:2 -115:1 64 <
ffff95eb334ab000 1743973682 S Co:1:015:0 s 21 09 0211 0001 0014 20 = 11ff0f5a 00000000 00000000 00000000 00000000
ffff95eb334ab000 1743973867 C Co:1:015:0 0 20 >
ffff95eb334ab480 1743976674 C Ii:1:015:2 0:1 20 = 11ff0f5a 00000000 00000000 00000000 00000000
ffff95ea98e1a0c0 1743976847 S Ii:1:015:2 -115:1 64 <
ffff95ea98e1a180 1744056734 S Co:1:015:0 s 21 09 0211 0001 0014 20 = 11ff0f5a 01030700 00000000 00000000 00000000
ffff95ea98e1a180 1744056886 C Co:1:015:0 0 20 >
ffff95ea98e1a0c0 1744059686 C Ii:1:015:2 0:1 20 = 11ff0f5a 01030700 00000000 00000000 00000000
ffff95ea98e1a480 1744059819 S Ii:1:015:2 -115:1 64 <
ffff95ea98e1a480 1744061684 C Ii:1:015:2 0:1 20 = 11ff0f10 00000000 00000000 00000000 00000000
ffff95ea98e1a600 1744061877 S Ii:1:015:2 -115:1 64 <
ffff95ea98e1a840 1744070442 S Co:1:015:0 s 21 09 0211 0001 0014 20 = 11ff0f7a 01000000 00000000 00000000 00000000
ffff95ea98e1a840 1744070604 C Co:1:015:0 0 20 >
ffff95ea98e1a600 1744072664 C Ii:1:015:2 0:1 20 = 11ff0f7a 01000000 00000000 00000000 00000000
ffff95ea98e1af00 1744072790 S Ii:1:015:2 -115:1 64 <
ffff95ea98e1a9c0 1744073097 S Co:1:015:0 s 21 09 0211 0001 0014 20 = 11ff0f8a 01010000 00000000 00000000 00000000
ffff95ea98e1a9c0 1744073271 C Co:1:015:0 0 20 >
ffff95ea98e1af00 1744073661 C Ii:1:015:2 0:1 20 = 11ff0f10 01000000 00000000 00000000 00000000
ffff95ea98e1aa80 1744073856 S Ii:1:015:2 -115:1 64 <
ffff95ea98e1aa80 1744075680 C Ii:1:015:2 0:1 20 = 11ff0f8a 01000000 00000000 00000000 00000000
ffff95ea98e1aa80 1744075775 S Ii:1:015:2 -115:1 64 <
ffff95ea98e1af00 1744078219 S Co:1:015:0 s 21 09 0211 0001 0014 20 = 11ff0f5a 01030300 00000000 00000000 00000000
ffff95ea98e1af00 1744078388 C Co:1:015:0 0 20 >
ffff95ea98e1aa80 1744080664 C Ii:1:015:2 0:1 20 = 11ff0f5a 01030300 00000000 00000000 00000000
ffff95ea98e1a9c0 1744080857 S Ii:1:015:2 -115:1 64 <
ffff95ea98e1a600 1744081044 S Co:1:015:0 s 21 09 0211 0001 0014 20 = 11ff000a 00050000 00000000 00000000 00000000
ffff95ea98e1a600 1744081209 C Co:1:015:0 0 20 >
ffff95ea98e1a9c0 1744083661 C Ii:1:015:2 0:1 20 = 11ff000a 03000000 00000000 00000000 00000000
ffff95ea98e1a840 1744083822 S Ii:1:015:2 -115:1 64 <
ffff95ea98e1a840 1744105630 C Ii:1:015:2 0:1 20 = 11ff0f10 01000000 00000000 00000000 00000000
ffff95ea98e1a480 1744105780 S Ii:1:015:2 -115:1 64 <
ffff95ea98e1a0c0 1744162713 S Co:1:015:0 s 21 09 0211 0001 0014 20 = 11ff0f5a 01030500 00000000 00000000 00000000
ffff95ea98e1a0c0 1744162897 C Co:1:015:0 0 20 >
ffff95ea98e1a480 1744165654 C Ii:1:015:2 0:1 20 = 11ff0f5a 01030500 00000000 00000000 00000000
ffff95ea98e1a180 1744165827 S Ii:1:015:2 -115:1 64 <
ffff95ea98e1ac00 1744166022 S Co:1:015:0 s 21 09 0211 0001 0014 20 = 11ff032a 00000000 00000000 00000000 00000000
ffff95ea98e1ac00 1744166201 C Co:1:015:0 0 20 >
ffff95ea98e1a180 1744168677 C Ii:1:015:2 0:1 20 = 11ff032a 00000000 00000000 00000000 00000000
ffff95ea98e1ad80 1744168828 S Ii:1:015:2 -115:1 64 <
ffff95ea98e1a000 1744169096 S Co:1:015:0 s 21 09 0211 0001 0014 20 = 11ff0f5a 01030500 00000000 00000000 00000000
ffff95ea98e1a000 1744169282 C Co:1:015:0 0 20 >
ffff95ea98e1ad80 1744171653 C Ii:1:015:2 0:1 20 = 11ff0f5a 01030500 00000000 00000000 00000000
ffff95ea98e1a240 1744171838 S Ii:1:015:2 -115:1 64 <
ffff95ea98e1a780 1744173668 S Co:1:015:0 s 21 09 0211 0001 0014 20 = 11ff000a 83100000 00000000 00000000 00000000
ffff95ea98e1a780 1744173869 C Co:1:015:0 0 20 >
ffff95ea98e1a240 1744176663 C Ii:1:015:2 0:1 20 = 11ff000a 00000000 00000000 00000000 00000000
ffff95ea98e1a900 1744176832 S Ii:1:015:2 -115:1 64 <
ffff95ea98e1a300 1744177836 S Co:1:015:0 s 21 09 0211 0001 0014 20 = 11ff000a 83600000 00000000 00000000 00000000
ffff95ea98e1a300 1744177985 C Co:1:015:0 0 20 >
ffff95ea98e1a900 1744180658 C Ii:1:015:2 0:1 20 = 11ff000a 00000000 00000000 00000000 00000000
ffff95ea98e1a540 1744180849 S Ii:1:015:2 -115:1 64 <
ffff95ea98e1acc0 1744201165 S Co:1:015:0 s 21 09 0211 0001 0014 20 = 11ff112a 00000000 00000000 00000000 00000000
ffff95ea98e1acc0 1744201306 C Co:1:015:0 0 20 >
ffff95ea98e1a540 1744203623 C Ii:1:015:2 0:1 20 = 11ff112a 02000000 00000000 00000000 00000000
ffff95ea98e1ae40 1744203823 S Ii:1:015:2 -115:1 64 <
ffff95ea98e1a3c0 1744204242 S Co:1:015:0 s 21 09 0211 0001 0014 20 = 11ff0f3a 00000100 00000000 00000000 00000000
ffff95ea98e1a3c0 1744204468 C Co:1:015:0 0 20 >
ffff95ea98e1ae40 1744206655 C Ii:1:015:2 0:1 20 = 11ffff0f 3a020000 00000000 00000000 00000000
ffff95ea98e1ae40 1744206828 S Ii:1:015:2 -115:1 64 <
ffff95ea98e1a3c0 1744207681 S Co:1:015:0 s 21 09 0211 0001 0014 20 = 11ff112a 00000000 00000000 00000000 00000000
ffff95ea98e1a3c0 1744207817 C Co:1:015:0 0 20 >
ffff95ea98e1ae40 1744210644 C Ii:1:015:2 0:1 20 = 11ff112a 02000000 00000000 00000000 00000000
ffff95ea98e1a540 1744210826 S Ii:1:015:2 -115:1 64 <
ffff95ea98e1acc0 1744210986 S Co:1:015:0 s 21 09 0211 0001 0014 20 = 11ff0f0a ff000100 00000000 00000000 00000000
ffff95ea98e1acc0 1744211123 C Co:1:015:0 0 20 >
ffff95ea98e1a540 1744213642 C Ii:1:015:2 0:1 20 = 11ff0f0a ff000100 0000ffff ffff0000 00000000
ffff95ea98e1a900 1744213779 S Ii:1:015:2 -115:1 64 <
ffff95eb50e18780 1744216442 S Co:1:015:0 s 21 09 0211 0001 0014 20 = 11ff112a 00000000 00000000 00000000 00000000
ffff95eb50e18780 1744216596 C Co:1:015:0 0 20 >
ffff95ea98e1a900 1744218642 C Ii:1:015:2 0:1 20 = 11ff112a 02000000 00000000 00000000 00000000
ffff95eb50e18780 1744218807 S Ii:1:015:2 -115:1 64 <
ffff95eb50e18a80 1744219960 S Co:1:015:0 s 21 09 0211 0001 0014 20 = 11ff0f0a ff000100 01000000 00000000 00000000
ffff95eb50e18a80 1744220113 C Co:1:015:0 0 20 >
ffff95eb50e18780 1744222643 C Ii:1:015:2 0:1 20 = 11ff0f0a ff000100 00ffffff ffffffff 00000000
ffff95eb3347a540 1744222843 S Ii:1:015:2 -115:1 64 <
ffff95eb3347a0c0 1744223222 S Co:1:015:0 s 21 09 0211 0001 0014 20 = 11ff083a 00000000 00000000 00000000 00000000
ffff95eb3347a0c0 1744223444 C Co:1:015:0 0 20 >
ffff95eb3347a540 1744225649 C Ii:1:015:2 0:1 20 = 11ff083a 00000000 00000000 00000000 00000000
ffff95eb3347a9c0 1744225837 S Ii:1:015:2 -115:1 64 <
ffff95eb3347a540 1744226049 S Co:1:015:0 s 21 09 0211 0001 0014 20 = 11ff0f0a ff000100 02000000 00000000 00000000
ffff95eb3347a540 1744226228 C Co:1:015:0 0 20 >
ffff95eb3347a9c0 1744228641 C Ii:1:015:2 0:1 20 = 11ff0f0a ff000100 00ffffff ffffffff ffffffff
ffff95eb3347a0c0 1744228776 S Ii:1:015:2 -115:1 64 <
ffff95eb3347a240 1744228991 S Co:1:015:0 s 21 09 0211 0001 0014 20 = 11ff081a 00000000 00000000 00000000 00000000
ffff95eb3347a240 1744229151 C Co:1:015:0 0 20 >
ffff95eb3347a0c0 1744231620 C Ii:1:015:2 0:1 20 = 11ff081a 00000000 00000000 00000000 00000000
ffff95eb3347a480 1744231703 S Ii:1:015:2 -115:1 64 <
ffff95eb3347af00 1744262649 S Co:1:015:0 s 21 09 0211 0001 0014 20 = 11ff0f0a ff000100 03000000 00000000 00000000
ffff95eb3347af00 1744262855 C Co:1:015:0 0 20 >
ffff95eb3347a480 1744265657 C Ii:1:015:2 0:1 20 = 11ff0f0a ff000100 00ffffff ffff0000 00000000
ffff95eb3347ae40 1744265849 S Ii:1:015:2 -115:1 64 <
ffff95eb3347a900 1744370871 S Co:1:015:0 s 21 09 0211 0001 0014 20 = 11ff0f0a ff000100 04000000 00000000 00000000
ffff95eb3347a900 1744371079 C Co:1:015:0 0 20 >
ffff95eb3347ae40 1744373642 C Ii:1:015:2 0:1 20 = 11ff0f0a ff000100 00ffffff ffffffff ffffffff
ffff95ea98e1a300 1744373825 S Ii:1:015:2 -115:1 64 <
ffff95ea98e1a240 1744374972 S Co:1:015:0 s 21 09 0211 0001 0014 20 = 11ff0f0a ff000100 05000000 00000000 00000000
ffff95ea98e1a240 1744375140 C Co:1:015:0 0 20 >
ffff95ea98e1a300 1744377666 C Ii:1:015:2 0:1 20 = 11ff0f0a ff000100 00ffffff ffffffff ffffffff
ffff95ea98e1a780 1744377862 S Ii:1:015:2 -115:1 64 <
ffff95ea98e1ad80 1744378151 S Co:1:015:0 s 21 09 0211 0001 0014 20 = 11ff0f0a ff000100 06000000 00000000 00000000
ffff95ea98e1ad80 1744378354 C Co:1:015:0 0 20 >
ffff95ea98e1a780 1744380663 C Ii:1:015:2 0:1 20 = 11ff0f0a ff000100 00ffffff ffffffff ffffff00
ffff95ea98e1a000 1744380852 S Ii:1:015:2 -115:1 64 <
ffff95ea98e1a180 1744381087 S Co:1:015:0 s 21 09 0211 0001 0014 20 = 11ff0f0a ff000101 00000000 00000000 00000000
ffff95ea98e1a180 1744381321 C Co:1:015:0 0 20 >
ffff95ea98e1a000 1744383662 C Ii:1:015:2 0:1 20 = 11ff0f0a ff000100 0000ffff ffff0000 00000000
ffff95ea98e1ac00 1744383820 S Ii:1:015:2 -115:1 64 <
ffff95ea98e1a480 1744385764 S Co:1:015:0 s 21 09 0211 0001 0014 20 = 11ff0f0a ff000101 01000000 00000000 00000000
ffff95ea98e1a480 1744385944 C Co:1:015:0 0 20 >
ffff95ea98e1ac00 1744388668 C Ii:1:015:2 0:1 20 = 11ff0f0a ff000100 00ffffff ffffffff 00000000
ffff95ea98e1a0c0 1744388815 S Ii:1:015:2 -115:1 64 <
ffff95ea98e1a840 1744388988 S Co:1:015:0 s 21 09 0211 0001 0014 20 = 11ff0f0a ff000101 02000000 00000000 00000000
ffff95ea98e1a840 1744389221 C Co:1:015:0 0 20 >
ffff95ea98e1a0c0 1744391667 C Ii:1:015:2 0:1 20 = 11ff0f0a ff000100 00ffffff ffffffff ffffffff
ffff95ea98e1a9c0 1744391825 S Ii:1:015:2 -115:1 64 <
ffff95ea98e1a600 1744404425 S Co:1:015:0 s 21 09 0211 0001 0014 20 = 11ff0f0a ff000101 03000000 00000000 00000000
ffff95ea98e1a600 1744404599 C Co:1:015:0 0 20 >
ffff95ea98e1a9c0 1744406645 C Ii:1:015:2 0:1 20 = 11ff0f0a ff000100 00ffffff ffff0000 00000000
ffff95ea98e1aa80 1744406800 S Ii:1:015:2 -115:1 64 <
ffff95ea98e1af00 1744407091 S Co:1:015:0 s 21 09 0211 0001 0014 20 = 11ff0f0a ff000101 04000000 00000000 00000000
ffff95ea98e1af00 1744407317 C Co:1:015:0 0 20 >
ffff95ea98e1aa80 1744409611 C Ii:1:015:2 0:1 20 = 11ff0f0a ff000100 00ffffff ffffffff ffffffff
ffff95ea98e1aa80 1744409722 S Ii:1:015:2 -115:1 64 <
ffff95ea98e1af00 1744409934 S Co:1:015:0 s 21 09 0211 0001 0014 20 = 11ff0f0a ff000101 05000000 00000000 00000000
ffff95ea98e1af00 1744410136 C Co:1:015:0 0 20 >
ffff95ea98e1aa80 1744412646 C Ii:1:015:2 0:1 20 = 11ff0f0a ff000100 00ffffff ffffffff ffffffff
ffff95eb3347a600 1744412785 S Ii:1:015:2 -115:1 64 <
ffff95eb3347ae40 1744413130 S Co:1:015:0 s 21 09 0211 0001 0014 20 = 11ff0f0a ff000101 06000000 00000000 00000000
ffff95eb3347ae40 1744413312 C Co:1:015:0 0 20 >
ffff95eb3347a600 1744415644 C Ii:1:015:2 0:1 20 = 11ff0f0a ff000100 00ffffff ffffffff ffffff00
ffff95eb3347a900 1744415929 S Ii:1:015:2 -115:1 64 <
ffff95eb3347a480 1744419335 S Co:1:015:0 s 21 09 0211 0001 0014 20 = 11ff0f1a 01000000 00000000 00000000 01000000
ffff95eb3347a480 1744419502 C Co:1:015:0 0 20 >
ffff95eb3347a900 1744421644 C Ii:1:015:2 0:1 20 = 11ff0f1a 00000000 00000000 00000000 00000000
ffff95eb334ab840 1744421793 S Ii:1:015:2 -115:1 64 <
ffff95eb334ab0c0 1744422038 S Co:1:015:0 s 21 09 0211 0001 0014 20 = 11ff0f1a 00000000 00000000 00000000 01000000
ffff95eb334ab0c0 1744422189 C Co:1:015:0 0 20 >
ffff95eb334ab840 1744424639 C Ii:1:015:2 0:1 20 = 11ff0f1a 00000000 00000000 00000000 00000000
ffff95eb334aba80 1744424834 S Ii:1:015:2 -115:1 64 <
ffff95eb334ab180 1744425080 S Co:1:015:0 s 21 09 0211 0001 0014 20 = 11ff106a 0000002f 61636465 66670000 00000000
ffff95eb334ab180 1744425308 C Co:1:015:0 0 20 >
ffff95eb334aba80 1744427642 C Ii:1:015:2 0:1 20 = 11ff106a 0000002f 00000000 00000000 00000000
ffff95eb334ab6c0 1744427790 S Ii:1:015:2 -115:1 64 <
ffff95eb334abd80 1744428067 S Co:1:015:0 s 21 09 0211 0001 0014 20 = 11ff106a ff003e01 02030405 06070809 0a0b0c0d
ffff95eb334abd80 1744428266 C Co:1:015:0 0 20 >
ffff95eb334ab6c0 1744430643 C Ii:1:015:2 0:1 20 = 11ff106a ff003e01 00000000 00000000 00000000
ffff95eb334abb40 1744430802 S Ii:1:015:2 -115:1 64 <
ffff95eb334abf00 1744430977 S Co:1:015:0 s 21 09 0211 0001 0014 20 = 11ff106a ff003e0e 0f101112 13141516 1718191a
ffff95eb334abf00 1744431168 C Co:1:015:0 0 20 >
ffff95eb334abb40 1744433646 C Ii:1:015:2 0:1 20 = 11ff106a ff003e0e 00000000 00000000 00000000
ffff95eb334ab600 1744433826 S Ii:1:015:2 -115:1 64 <
ffff95eb334ab540 1744436692 S Co:1:015:0 s 21 09 0211 0001 0014 20 = 11ff106a ff003e1b 1c1d1e1f 20212223 24252627
ffff95eb334ab540 1744436891 C Co:1:015:0 0 20 >
ffff95eb334ab600 1744439657 C Ii:1:015:2 0:1 20 = 11ff106a ff003e1b 00000000 00000000 00000000
ffff95eb334ab780 1744439816 S Ii:1:015:2 -115:1 64 <
ffff95eb334ab900 1744440106 S Co:1:015:0 s 21 09 0211 0001 0014 20 = 11ff106a ff003e28 292a2b2c 2d2e3031 32333435
ffff95eb334ab900 1744440303 C Co:1:015:0 0 20 >
ffff95eb334ab780 1744442658 C Ii:1:015:2 0:1 20 = 11ff106a ff003e28 00000000 00000000 00000000
ffff95eb334abcc0 1744442804 S Ii:1:015:2 -115:1 64 <
ffff95eb334abe40 1744444080 S Co:1:015:0 s 21 09 0211 0001 0014 20 = 11ff106a ff003e36 3738393a 3b3c3d3e 3f404142
ffff95eb334abe40 1744444283 C Co:1:015:0 0 20 >
ffff95eb334abcc0 1744446642 C Ii:1:015:2 0:1 20 = 11ff106a ff003e36 00000000 00000000 00000000
ffff95eb334abcc0 1744446817 S Ii:1:015:2 -115:1 64 <
ffff95eb334abe40 1744447091 S Co:1:015:0 s 21 09 0211 0001 0014 20 = 11ff106a ff003e43 44454647 48494a4b 4c4d4e4f
ffff95eb334abe40 1744447268 C Co:1:015:0 0 20 >
ffff95eb334abcc0 1744449660 C Ii:1:015:2 0:1 20 = 11ff106a ff003e43 00000000 00000000 00000000
ffff95eb334ab780 1744449749 S Ii:1:015:2 -115:1 64 <
ffff95eb334ab900 1744450055 S Co:1:015:0 s 21 09 0211 0001 0014 20 = 11ff106a ff003e50 51525354 55565758 595a5b5c
ffff95eb334ab900 1744450243 C Co:1:015:0 0 20 >
ffff95eb334ab780 1744452659 C Ii:1:015:2 0:1 20 = 11ff106a ff003e50 00000000 00000000 00000000
ffff95eb334ab600 1744452772 S Ii:1:015:2 -115:1 64 <
ffff95eb334ab540 1744457220 S Co:1:015:0 s 21 09 0211 0001 0014 20 = 11ff106a ff003e5d 5e5f6062 68696a6b 6c6d6e6f
ffff95eb334ab540 1744457378 C Co:1:015:0 0 20 >
ffff95eb334ab600 1744459652 C Ii:1:015:2 0:1 20 = 11ff106a ff003e5d 00000000 00000000 00000000
ffff95eb334abb40 1744459720 S Ii:1:015:2 -115:1 64 <
ffff95eb334abf00 1744460049 S Co:1:015:0 s 21 09 0211 0001 0014 20 = 11ff106a ff003e9d 9e9b9cb4 b5b6b7b8 99000000
ffff95eb334abf00 1744460287 C Co:1:015:0 0 20 >
ffff95eb334abb40 1744462638 C Ii:1:015:2 0:1 20 = 11ff106a ff003e9d 00000000 00000000 00000000
ffff95eb334ab6c0 1744462759 S Ii:1:015:2 -115:1 64 <
ffff95eb334abd80 1744463814 S Co:1:015:0 s 21 09 0211 0001 0014 20 = 11ff101a d2aabbcc ff000000 00000000 00000000
ffff95eb334abd80 1744464007 C Co:1:015:0 0 20 >
ffff95eb334ab6c0 1744466636 C Ii:1:015:2 0:1 20 = 11ff101a d2ffffff 00000000 00000000 00000000
ffff95ece457f600 1744466812 S Ii:1:015:2 -115:1 64 <
ffff95ece457f000 1744467074 S Co:1:015:0 s 21 09 0211 0001 0014 20 = 11ff107a 00000000 00000000 00000000 00000000
ffff95ece457f000 1744467228 C Co:1:015:0 0 20 >
ffff95ece457f600 1744469640 C Ii:1:015:2 0:1 20 = 11ff107a 00000000 00000000 00000000 00000000
ffff95ece457fa80 1744469805 S Ii:1:015:2 -115:1 64 <
ffff95ece457fa80 1745097638 C Ii:1:015:2 0:1 20 = 11ff0f10 00000000 00000000 00000000 00000000
ffff95ece457f240 1745097813 S Ii:1:015:2 -115:1 64 <
ffff95ece457fb40 1745107959 S Co:1:015:0 s 21 09 0211 0001 0014 20 = 11ff0f5a 01030300 00000000 00000000 00000000
ffff95ece457fb40 1745108134 C Co:1:015:0 0 20 >
ffff95ece457f240 1745110619 C Ii:1:015:2 0:1 20 = 11ff0f5a 01030300 00000000 00000000 00000000
ffff95ece457f840 1745110752 S Ii:1:015:2 -115:1 64 <
