ffff88040723cb40 812143996 C Ii:1:003:2 0:4 5 = 03000010 00
ffff88040723cb40 812144005 S Ii:1:003:2 -115:4 8 <
ffff88040723cb40 812360010 C Ii:1:003:2 0:4 5 = 03000000 00
ffff88040723cb40 812360018 S Ii:1:003:2 -115:4 8 <
ffff88040723cb40 813312005 C Ii:1:003:2 0:4 5 = 03000020 00
ffff88040723cb40 813312017 S Ii:1:003:2 -115:4 8 <
ffff88040723cb40 813580011 C Ii:1:003:2 0:4 5 = 03000000 00
ffff88040723cb40 813580019 S Ii:1:003:2 -115:4 8 <
ffff88040723cb40 814240016 C Ii:1:003:2 0:4 5 = 03000040 00
ffff88040723cb40 814240023 S Ii:1:003:2 -115:4 8 <
ffff88040723cb40 814488008 C Ii:1:003:2 0:4 5 = 03000000 00
ffff88040723cb40 814488016 S Ii:1:003:2 -115:4 8 <
ffff88040723cb40 815408020 C Ii:1:003:2 0:4 5 = 03000080 00
ffff88040723cb40 815408028 S Ii:1:003:2 -115:4 8 <
ffff88040723cb40 815624012 C Ii:1:003:2 0:4 5 = 03000000 00
ffff88040723cb40 815624019 S Ii:1:003:2 -115:4 8 <
