ffff8800d8315840 4030243702 C Ii:1:003:1 0:4 8 = 00003f00 00000000
ffff8800d8315840 4030243723 S Ii:1:003:1 -115:4 8 <
ffff88040723cb40 4030243726 C Ii:1:003:2 0:4 5 = 03200000 00
ffff88040723cb40 4030243728 S Ii:1:003:2 -115:4 8 <
ffff88040723cb40 4030247701 C Ii:1:003:2 0:4 8 = 01003f00 00000000
ffff88040723cb40 4030247710 S Ii:1:003:2 -115:4 8 <
ffff8800d8315840 4030459696 C Ii:1:003:1 0:4 8 = 00000000 00000000
ffff8800d8315840 4030459719 S Ii:1:003:1 -115:4 8 <
ffff88040723cb40 4030459723 C Ii:1:003:2 0:4 5 = 03000000 00
ffff88040723cb40 4030459726 S Ii:1:003:2 -115:4 8 <
ffff88040723cb40 4030463703 C Ii:1:003:2 0:4 8 = 01000000 00000000
ffff88040723cb40 4030463711 S Ii:1:003:2 -115:4 8 <
