ffff8800d8315840 4039667749 C Ii:1:003:1 0:4 8 = 00001e00 00000000
ffff8800d8315840 4039667771 S Ii:1:003:1 -115:4 8 <
ffff88040723cb40 4039667775 C Ii:1:003:2 0:4 5 = 03001000 00
ffff88040723cb40 4039667777 S Ii:1:003:2 -115:4 8 <
ffff88040723cb40 4039671756 C Ii:1:003:2 0:4 8 = 01001e00 00000000
ffff88040723cb40 4039671762 S Ii:1:003:2 -115:4 8 <
ffff8800d8315840 4039883749 C Ii:1:003:1 0:4 8 = 00000000 00000000
ffff8800d8315840 4039883768 S Ii:1:003:1 -115:4 8 <
ffff88040723cb40 4039883771 C Ii:1:003:2 0:4 5 = 03000000 00
ffff88040723cb40 4039883773 S Ii:1:003:2 -115:4 8 <
ffff88040723cb40 4039887757 C Ii:1:003:2 0:4 8 = 01000000 00000000
ffff88040723cb40 4039887763 S Ii:1:003:2 -115:4 8 <
