ffff8800d8315840 4033127707 C Ii:1:003:1 0:4 8 = 00004100 00000000
ffff8800d8315840 4033127727 S Ii:1:003:1 -115:4 8 <
ffff88040723cb40 4033127731 C Ii:1:003:2 0:4 5 = 03800000 00
ffff88040723cb40 4033127733 S Ii:1:003:2 -115:4 8 <
ffff88040723cb40 4033131714 C Ii:1:003:2 0:4 8 = 01004100 00000000
ffff88040723cb40 4033131723 S Ii:1:003:2 -115:4 8 <
ffff8800d8315840 4033363709 C Ii:1:003:1 0:4 8 = 00000000 00000000
ffff8800d8315840 4033363730 S Ii:1:003:1 -115:4 8 <
ffff88040723cb40 4033363734 C Ii:1:003:2 0:4 5 = 03000000 00
ffff88040723cb40 4033363736 S Ii:1:003:2 -115:4 8 <
ffff88040723cb40 4033367726 C Ii:1:003:2 0:4 8 = 01000000 00000000
ffff88040723cb40 4033367733 S Ii:1:003:2 -115:4 8 <
