ffff8800d8315840 4024023663 C Ii:1:003:1 0:4 8 = 00003a00 00000000
ffff8800d8315840 4024023684 S Ii:1:003:1 -115:4 8 <
ffff88040723cb40 4024023688 C Ii:1:003:2 0:4 5 = 03010000 00
ffff88040723cb40 4024023691 S Ii:1:003:2 -115:4 8 <
ffff88040723cb40 4024027671 C Ii:1:003:2 0:4 8 = 01003a00 00000000
ffff88040723cb40 4024027678 S Ii:1:003:2 -115:4 8 <
ffff8800d8315840 4024243665 C Ii:1:003:1 0:4 8 = 00000000 00000000
ffff8800d8315840 4024243684 S Ii:1:003:1 -115:4 8 <
ffff88040723cb40 4024243689 C Ii:1:003:2 0:4 5 = 03000000 00
ffff88040723cb40 4024243692 S Ii:1:003:2 -115:4 8 <
ffff88040723cb40 4024247671 C Ii:1:003:2 0:4 8 = 01000000 00000000
ffff88040723cb40 4024247678 S Ii:1:003:2 -115:4 8 <
