ffff8800d8315840 4042291763 C Ii:1:003:1 0:4 8 = 00002100 00000000
ffff8800d8315840 4042291783 S Ii:1:003:1 -115:4 8 <
ffff88040723cb40 4042291786 C Ii:1:003:2 0:4 5 = 03008000 00
ffff88040723cb40 4042291789 S Ii:1:003:2 -115:4 8 <
ffff88040723cb40 4042295761 C Ii:1:003:2 0:4 8 = 01002100 00000000
ffff88040723cb40 4042295768 S Ii:1:003:2 -115:4 8 <
ffff8800d8315840 4042479756 C Ii:1:003:1 0:4 8 = 00000000 00000000
ffff8800d8315840 4042479778 S Ii:1:003:1 -115:4 8 <
ffff88040723cb40 4042479781 C Ii:1:003:2 0:4 5 = 03000000 00
ffff88040723cb40 4042479783 S Ii:1:003:2 -115:4 8 <
ffff88040723cb40 4042483761 C Ii:1:003:2 0:4 8 = 01000000 00000000
ffff88040723cb40 4042483769 S Ii:1:003:2 -115:4 8 <
