ffff8800d8315840 4031983703 C Ii:1:003:1 0:4 8 = 00004000 00000000
ffff8800d8315840 4031983721 S Ii:1:003:1 -115:4 8 <
ffff88040723cb40 4031983724 C Ii:1:003:2 0:4 5 = 03400000 00
ffff88040723cb40 4031983727 S Ii:1:003:2 -115:4 8 <
ffff88040723cb40 4031987708 C Ii:1:003:2 0:4 8 = 01004000 00000000
ffff88040723cb40 4031987714 S Ii:1:003:2 -115:4 8 <
ffff8800d8315840 4032203704 C Ii:1:003:1 0:4 8 = 00000000 00000000
ffff8800d8315840 4032203726 S Ii:1:003:1 -115:4 8 <
ffff88040723cb40 4032203729 C Ii:1:003:2 0:4 5 = 03000000 00
ffff88040723cb40 4032203732 S Ii:1:003:2 -115:4 8 <
ffff88040723cb40 4032207709 C Ii:1:003:2 0:4 8 = 01000000 00000000
ffff88040723cb40 4032207714 S Ii:1:003:2 -115:4 8 <
