ffff8800d8315840 4025139677 C Ii:1:003:1 0:4 8 = 00003b00 00000000
ffff8800d8315840 4025139697 S Ii:1:003:1 -115:4 8 <
ffff88040723cb40 4025139700 C Ii:1:003:2 0:4 5 = 03020000 00
ffff88040723cb40 4025139702 S Ii:1:003:2 -115:4 8 <
ffff88040723cb40 4025143674 C Ii:1:003:2 0:4 8 = 01003b00 00000000
ffff88040723cb40 4025143682 S Ii:1:003:2 -115:4 8 <
ffff8800d8315840 4025367669 C Ii:1:003:1 0:4 8 = 00000000 00000000
ffff8800d8315840 4025367688 S Ii:1:003:1 -115:4 8 <
ffff88040723cb40 4025367692 C Ii:1:003:2 0:4 5 = 03000000 00
ffff88040723cb40 4025367695 S Ii:1:003:2 -115:4 8 <
ffff88040723cb40 4025371673 C Ii:1:003:2 0:4 8 = 01000000 00000000
ffff88040723cb40 4025371677 S Ii:1:003:2 -115:4 8 <
