ffff8800d8315840 4040639744 C Ii:1:003:1 0:4 8 = 00001f00 00000000
ffff8800d8315840 4040639765 S Ii:1:003:1 -115:4 8 <
ffff88040723cb40 4040639768 C Ii:1:003:2 0:4 5 = 03002000 00
ffff88040723cb40 4040639771 S Ii:1:003:2 -115:4 8 <
ffff88040723cb40 4040643748 C Ii:1:003:2 0:4 8 = 01001f00 00000000
ffff88040723cb40 4040643751 S Ii:1:003:2 -115:4 8 <
ffff8800d8315840 4040815746 C Ii:1:003:1 0:4 8 = 00000000 00000000
ffff8800d8315840 4040815769 S Ii:1:003:1 -115:4 8 <
ffff88040723cb40 4040815772 C Ii:1:003:2 0:4 5 = 03000000 00
ffff88040723cb40 4040815775 S Ii:1:003:2 -115:4 8 <
ffff88040723cb40 4040819752 C Ii:1:003:2 0:4 8 = 01000000 00000000
ffff88040723cb40 4040819760 S Ii:1:003:2 -115:4 8 <
