ffff8800d8315840 4043687759 C Ii:1:003:1 0:4 8 = 00002300 00000000
ffff8800d8315840 4043687777 S Ii:1:003:1 -115:4 8 <
ffff88040723cb40 4043687780 C Ii:1:003:2 0:4 5 = 03000002 00
ffff88040723cb40 4043687783 S Ii:1:003:2 -115:4 8 <
ffff88040723cb40 4043691765 C Ii:1:003:2 0:4 8 = 01002300 00000000
ffff88040723cb40 4043691771 S Ii:1:003:2 -115:4 8 <
ffff8800d8315840 4043895760 C Ii:1:003:1 0:4 8 = 00000000 00000000
ffff8800d8315840 4043895780 S Ii:1:003:1 -115:4 8 <
ffff88040723cb40 4043895784 C Ii:1:003:2 0:4 5 = 03000000 00
ffff88040723cb40 4043895786 S Ii:1:003:2 -115:4 8 <
ffff88040723cb40 4043899775 C Ii:1:003:2 0:4 8 = 01000000 00000000
ffff88040723cb40 4043899781 S Ii:1:003:2 -115:4 8 <
