ffff8800d8315840 4026539686 C Ii:1:003:1 0:4 8 = 00003c00 00000000
ffff8800d8315840 4026539705 S Ii:1:003:1 -115:4 8 <
ffff88040723cb40 4026539708 C Ii:1:003:2 0:4 5 = 03040000 00
ffff88040723cb40 4026539710 S Ii:1:003:2 -115:4 8 <
ffff88040723cb40 4026543683 C Ii:1:003:2 0:4 8 = 01003c00 00000000
ffff88040723cb40 4026543692 S Ii:1:003:2 -115:4 8 <
ffff8800d8315840 4026803685 C Ii:1:003:1 0:4 8 = 00000000 00000000
ffff8800d8315840 4026803705 S Ii:1:003:1 -115:4 8 <
ffff88040723cb40 4026803708 C Ii:1:003:2 0:4 5 = 03000000 00
ffff88040723cb40 4026803710 S Ii:1:003:2 -115:4 8 <
ffff88040723cb40 4026807692 C Ii:1:003:2 0:4 8 = 01000000 00000000
ffff88040723cb40 4026807698 S Ii:1:003:2 -115:4 8 <
