ffff8800d8315840 4034295712 C Ii:1:003:1 0:4 8 = 00004200 00000000
ffff8800d8315840 4034295734 S Ii:1:003:1 -115:4 8 <
ffff88040723cb40 4034295737 C Ii:1:003:2 0:4 5 = 03000100 00
ffff88040723cb40 4034295740 S Ii:1:003:2 -115:4 8 <
ffff88040723cb40 4034299722 C Ii:1:003:2 0:4 8 = 01004200 00000000
ffff88040723cb40 4034299730 S Ii:1:003:2 -115:4 8 <
ffff8800d8315840 4034539725 C Ii:1:003:1 0:4 8 = 00000000 00000000
ffff8800d8315840 4034539744 S Ii:1:003:1 -115:4 8 <
ffff88040723cb40 4034539747 C Ii:1:003:2 0:4 5 = 03000000 00
ffff88040723cb40 4034539749 S Ii:1:003:2 -115:4 8 <
ffff88040723cb40 4034543730 C Ii:1:003:2 0:4 8 = 01000000 00000000
ffff88040723cb40 4034543736 S Ii:1:003:2 -115:4 8 <
