ffff8800d8315840 4036675736 C Ii:1:003:1 0:4 8 = 00004400 00000000
ffff8800d8315840 4036675755 S Ii:1:003:1 -115:4 8 <
ffff88040723cb40 4036675758 C Ii:1:003:2 0:4 5 = 03000400 00
ffff88040723cb40 4036675761 S Ii:1:003:2 -115:4 8 <
ffff88040723cb40 4036679731 C Ii:1:003:2 0:4 8 = 01004400 00000000
ffff88040723cb40 4036679739 S Ii:1:003:2 -115:4 8 <
ffff8800d8315840 4036927737 C Ii:1:003:1 0:4 8 = 00000000 00000000
ffff8800d8315840 4036927753 S Ii:1:003:1 -115:4 8 <
ffff88040723cb40 4036927756 C Ii:1:003:2 0:4 5 = 03000000 00
ffff88040723cb40 4036927758 S Ii:1:003:2 -115:4 8 <
ffff88040723cb40 4036931743 C Ii:1:003:2 0:4 8 = 01000000 00000000
ffff88040723cb40 4036931750 S Ii:1:003:2 -115:4 8 <
