ffff8800d8315840 4029011698 C Ii:1:003:1 0:4 8 = 00003e00 00000000
ffff8800d8315840 4029011717 S Ii:1:003:1 -115:4 8 <
ffff88040723cb40 4029011719 C Ii:1:003:2 0:4 5 = 03100000 00
ffff88040723cb40 4029011722 S Ii:1:003:2 -115:4 8 <
ffff88040723cb40 4029015695 C Ii:1:003:2 0:4 8 = 01003e00 00000000
ffff88040723cb40 4029015703 S Ii:1:003:2 -115:4 8 <
ffff8800d8315840 4029263688 C Ii:1:003:1 0:4 8 = 00000000 00000000
ffff8800d8315840 4029263705 S Ii:1:003:1 -115:4 8 <
ffff88040723cb40 4029263709 C Ii:1:003:2 0:4 5 = 03000000 00
ffff88040723cb40 4029263711 S Ii:1:003:2 -115:4 8 <
ffff88040723cb40 4029267696 C Ii:1:003:2 0:4 8 = 01000000 00000000
ffff88040723cb40 4029267703 S Ii:1:003:2 -115:4 8 <
