ffff8800d8315840 4042971765 C Ii:1:003:1 0:4 8 = 00002200 00000000
ffff8800d8315840 4042971787 S Ii:1:003:1 -115:4 8 <
ffff88040723cb40 4042971791 C Ii:1:003:2 0:4 5 = 03000001 00
ffff88040723cb40 4042971793 S Ii:1:003:2 -115:4 8 <
ffff88040723cb40 4042975763 C Ii:1:003:2 0:4 8 = 01002200 00000000
ffff88040723cb40 4042975768 S Ii:1:003:2 -115:4 8 <
ffff8800d8315840 4043143766 C Ii:1:003:1 0:4 8 = 00000000 00000000
ffff8800d8315840 4043143787 S Ii:1:003:1 -115:4 8 <
ffff88040723cb40 4043143791 C Ii:1:003:2 0:4 5 = 03000000 00
ffff88040723cb40 4043143793 S Ii:1:003:2 -115:4 8 <
ffff88040723cb40 4043147766 C Ii:1:003:2 0:4 8 = 01000000 00000000
ffff88040723cb40 4043147772 S Ii:1:003:2 -115:4 8 <
