ffff8800d8315840 4038199733 C Ii:1:003:1 0:4 8 = 00004500 00000000
ffff8800d8315840 4038199754 S Ii:1:003:1 -115:4 8 <
ffff88040723cb40 4038199757 C Ii:1:003:2 0:4 5 = 03000800 00
ffff88040723cb40 4038199761 S Ii:1:003:2 -115:4 8 <
ffff88040723cb40 4038203748 C Ii:1:003:2 0:4 8 = 01004500 00000000
ffff88040723cb40 4038203754 S Ii:1:003:2 -115:4 8 <
ffff8800d8315840 4038359743 C Ii:1:003:1 0:4 8 = 00000000 00000000
ffff8800d8315840 4038359763 S Ii:1:003:1 -115:4 8 <
ffff88040723cb40 4038359765 C Ii:1:003:2 0:4 5 = 03000000 00
ffff88040723cb40 4038359767 S Ii:1:003:2 -115:4 8 <
ffff88040723cb40 4038363748 C Ii:1:003:2 0:4 8 = 01000000 00000000
ffff88040723cb40 4038363754 S Ii:1:003:2 -115:4 8 <
