ffff8800d8315840 4027803693 C Ii:1:003:1 0:4 8 = 00003d00 00000000
ffff8800d8315840 4027803714 S Ii:1:003:1 -115:4 8 <
ffff88040723cb40 4027803717 C Ii:1:003:2 0:4 5 = 03080000 00
ffff88040723cb40 4027803719 S Ii:1:003:2 -115:4 8 <
ffff88040723cb40 4027807698 C Ii:1:003:2 0:4 8 = 01003d00 00000000
ffff88040723cb40 4027807705 S Ii:1:003:2 -115:4 8 <
ffff8800d8315840 4028043683 C Ii:1:003:1 0:4 8 = 00000000 00000000
ffff8800d8315840 4028043702 S Ii:1:003:1 -115:4 8 <
ffff88040723cb40 4028043705 C Ii:1:003:2 0:4 5 = 03000000 00
ffff88040723cb40 4028043707 S Ii:1:003:2 -115:4 8 <
ffff88040723cb40 4028047701 C Ii:1:003:2 0:4 8 = 01000000 00000000
ffff88040723cb40 4028047709 S Ii:1:003:2 -115:4 8 <
