ffff8800d8315840 4035587722 C Ii:1:003:1 0:4 8 = 00004300 00000000
ffff8800d8315840 4035587746 S Ii:1:003:1 -115:4 8 <
ffff88040723cb40 4035587750 C Ii:1:003:2 0:4 5 = 03000200 00
ffff88040723cb40 4035587753 S Ii:1:003:2 -115:4 8 <
ffff88040723cb40 4035591728 C Ii:1:003:2 0:4 8 = 01004300 00000000
ffff88040723cb40 4035591734 S Ii:1:003:2 -115:4 8 <
ffff8800d8315840 4035835722 C Ii:1:003:1 0:4 8 = 00000000 00000000
ffff8800d8315840 4035835744 S Ii:1:003:1 -115:4 8 <
ffff88040723cb40 4035835747 C Ii:1:003:2 0:4 5 = 03000000 00
ffff88040723cb40 4035835750 S Ii:1:003:2 -115:4 8 <
ffff88040723cb40 4035839729 C Ii:1:003:2 0:4 8 = 01000000 00000000
ffff88040723cb40 4035839735 S Ii:1:003:2 -115:4 8 <
