ffff8800d8315840 4041379747 C Ii:1:003:1 0:4 8 = 00002000 00000000
ffff8800d8315840 4041379770 S Ii:1:003:1 -115:4 8 <
ffff88040723cb40 4041379773 C Ii:1:003:2 0:4 5 = 03004000 00
ffff88040723cb40 4041379776 S Ii:1:003:2 -115:4 8 <
ffff88040723cb40 4041383754 C Ii:1:003:2 0:4 8 = 01002000 00000000
ffff88040723cb40 4041383761 S Ii:1:003:2 -115:4 8 <
ffff8800d8315840 4041575760 C Ii:1:003:1 0:4 8 = 00000000 00000000
ffff8800d8315840 4041575779 S Ii:1:003:1 -115:4 8 <
ffff88040723cb40 4041575782 C Ii:1:003:2 0:4 5 = 03000000 00
ffff88040723cb40 4041575784 S Ii:1:003:2 -115:4 8 <
ffff88040723cb40 4041579754 C Ii:1:003:2 0:4 8 = 01000000 00000000
ffff88040723cb40 4041579761 S Ii:1:003:2 -115:4 8 <
