ffff8800d8315840 4024023663 C Ii:1:003:1 0:4 8 = 00003a00 00000000
ffff8800d8315840 4024023684 S Ii:1:003:1 -115:4 8 <
ffff88040723cb40 4024023688 C Ii:1:003:2 0:4 5 = 03010000 00
ffff88040723cb40 4024023691 S Ii:1:003:2 -115:4 8 <
ffff88040723cb40 4024027671 C Ii:1:003:2 0:4 8 = 01003a00 00000000
ffff88040723cb40 4024027678 S Ii:1:003:2 -115:4 8 <
ffff8800d8315840 4024243665 C Ii:1:003:1 0:4 8 = 00000000 00000000
ffff8800d8315840 4024243684 S Ii:1:003:1 -115:4 8 <
ffff88040723cb40 4024243689 C Ii:1:003:2 0:4 5 = 03000000 00
ffff88040723cb40 4024243692 S Ii:1:003:2 -115:4 8 <
ffff88040723cb40 4024247671 C Ii:1:003:2 0:4 8 = 01000000 00000000
ffff88040723cb40 4024247678 S Ii:1:003:2 -115:4 8 <
ffff8800d8315840 4025139677 C Ii:1:003:1 0:4 8 = 00003b00 00000000
ffff8800d8315840 4025139697 S Ii:1:003:1 -115:4 8 <
ffff88040723cb40 4025139700 C Ii:1:003:2 0:4 5 = 03020000 00
ffff88040723cb40 4025139702 S Ii:1:003:2 -115:4 8 <
ffff88040723cb40 4025143674 C Ii:1:003:2 0:4 8 = 01003b00 00000000
ffff88040723cb40 4025143682 S Ii:1:003:2 -115:4 8 <
ffff8800d8315840 4025367669 C Ii:1:003:1 0:4 8 = 00000000 00000000
ffff8800d8315840 4025367688 S Ii:1:003:1 -115:4 8 <
ffff88040723cb40 4025367692 C Ii:1:003:2 0:4 5 = 03000000 00
ffff88040723cb40 4025367695 S Ii:1:003:2 -115:4 8 <
ffff88040723cb40 4025371673 C Ii:1:003:2 0:4 8 = 01000000 00000000
ffff88040723cb40 4025371677 S Ii:1:003:2 -115:4 8 <
ffff8800d8315840 4026539686 C Ii:1:003:1 0:4 8 = 00003c00 00000000
ffff8800d8315840 4026539705 S Ii:1:003:1 -115:4 8 <
ffff88040723cb40 4026539708 C Ii:1:003:2 0:4 5 = 03040000 00
ffff88040723cb40 4026539710 S Ii:1:003:2 -115:4 8 <
ffff88040723cb40 4026543683 C Ii:1:003:2 0:4 8 = 01003c00 00000000
ffff88040723cb40 4026543692 S Ii:1:003:2 -115:4 8 <
ffff8800d8315840 4026803685 C Ii:1:003:1 0:4 8 = 00000000 00000000
ffff8800d8315840 4026803705 S Ii:1:003:1 -115:4 8 <
ffff88040723cb40 4026803708 C Ii:1:003:2 0:4 5 = 03000000 00
ffff88040723cb40 4026803710 S Ii:1:003:2 -115:4 8 <
ffff88040723cb40 4026807692 C Ii:1:003:2 0:4 8 = 01000000 00000000
ffff88040723cb40 4026807698 S Ii:1:003:2 -115:4 8 <
ffff8800d8315840 4027803693 C Ii:1:003:1 0:4 8 = 00003d00 00000000
ffff8800d8315840 4027803714 S Ii:1:003:1 -115:4 8 <
ffff88040723cb40 4027803717 C Ii:1:003:2 0:4 5 = 03080000 00
ffff88040723cb40 4027803719 S Ii:1:003:2 -115:4 8 <
ffff88040723cb40 4027807698 C Ii:1:003:2 0:4 8 = 01003d00 00000000
ffff88040723cb40 4027807705 S Ii:1:003:2 -115:4 8 <
ffff8800d8315840 4028043683 C Ii:1:003:1 0:4 8 = 00000000 00000000
ffff8800d8315840 4028043702 S Ii:1:003:1 -115:4 8 <
ffff88040723cb40 4028043705 C Ii:1:003:2 0:4 5 = 03000000 00
ffff88040723cb40 4028043707 S Ii:1:003:2 -115:4 8 <
ffff88040723cb40 4028047701 C Ii:1:003:2 0:4 8 = 01000000 00000000
ffff88040723cb40 4028047709 S Ii:1:003:2 -115:4 8 <
ffff8800d8315840 4029011698 C Ii:1:003:1 0:4 8 = 00003e00 00000000
ffff8800d8315840 4029011717 S Ii:1:003:1 -115:4 8 <
ffff88040723cb40 4029011719 C Ii:1:003:2 0:4 5 = 03100000 00
ffff88040723cb40 4029011722 S Ii:1:003:2 -115:4 8 <
ffff88040723cb40 4029015695 C Ii:1:003:2 0:4 8 = 01003e00 00000000
ffff88040723cb40 4029015703 S Ii:1:003:2 -115:4 8 <
ffff8800d8315840 4029263688 C Ii:1:003:1 0:4 8 = 00000000 00000000
ffff8800d8315840 4029263705 S Ii:1:003:1 -115:4 8 <
ffff88040723cb40 4029263709 C Ii:1:003:2 0:4 5 = 03000000 00
ffff88040723cb40 4029263711 S Ii:1:003:2 -115:4 8 <
ffff88040723cb40 4029267696 C Ii:1:003:2 0:4 8 = 01000000 00000000
ffff88040723cb40 4029267703 S Ii:1:003:2 -115:4 8 <
ffff8800d8315840 4030243702 C Ii:1:003:1 0:4 8 = 00003f00 00000000
ffff8800d8315840 4030243723 S Ii:1:003:1 -115:4 8 <
ffff88040723cb40 4030243726 C Ii:1:003:2 0:4 5 = 03200000 00
ffff88040723cb40 4030243728 S Ii:1:003:2 -115:4 8 <
ffff88040723cb40 4030247701 C Ii:1:003:2 0:4 8 = 01003f00 00000000
ffff88040723cb40 4030247710 S Ii:1:003:2 -115:4 8 <
ffff8800d8315840 4030459696 C Ii:1:003:1 0:4 8 = 00000000 00000000
ffff8800d8315840 4030459719 S Ii:1:003:1 -115:4 8 <
ffff88040723cb40 4030459723 C Ii:1:003:2 0:4 5 = 03000000 00
ffff88040723cb40 4030459726 S Ii:1:003:2 -115:4 8 <
ffff88040723cb40 4030463703 C Ii:1:003:2 0:4 8 = 01000000 00000000
ffff88040723cb40 4030463711 S Ii:1:003:2 -115:4 8 <
ffff8800d8315840 4031983703 C Ii:1:003:1 0:4 8 = 00004000 00000000
ffff8800d8315840 4031983721 S Ii:1:003:1 -115:4 8 <
ffff88040723cb40 4031983724 C Ii:1:003:2 0:4 5 = 03400000 00
ffff88040723cb40 4031983727 S Ii:1:003:2 -115:4 8 <
ffff88040723cb40 4031987708 C Ii:1:003:2 0:4 8 = 01004000 00000000
ffff88040723cb40 4031987714 S Ii:1:003:2 -115:4 8 <
ffff8800d8315840 4032203704 C Ii:1:003:1 0:4 8 = 00000000 00000000
ffff8800d8315840 4032203726 S Ii:1:003:1 -115:4 8 <
ffff88040723cb40 4032203729 C Ii:1:003:2 0:4 5 = 03000000 00
ffff88040723cb40 4032203732 S Ii:1:003:2 -115:4 8 <
ffff88040723cb40 4032207709 C Ii:1:003:2 0:4 8 = 01000000 00000000
ffff88040723cb40 4032207714 S Ii:1:003:2 -115:4 8 <
ffff8800d8315840 4033127707 C Ii:1:003:1 0:4 8 = 00004100 00000000
ffff8800d8315840 4033127727 S Ii:1:003:1 -115:4 8 <
ffff88040723cb40 4033127731 C Ii:1:003:2 0:4 5 = 03800000 00
ffff88040723cb40 4033127733 S Ii:1:003:2 -115:4 8 <
ffff88040723cb40 4033131714 C Ii:1:003:2 0:4 8 = 01004100 00000000
ffff88040723cb40 4033131723 S Ii:1:003:2 -115:4 8 <
ffff8800d8315840 4033363709 C Ii:1:003:1 0:4 8 = 00000000 00000000
ffff8800d8315840 4033363730 S Ii:1:003:1 -115:4 8 <
ffff88040723cb40 4033363734 C Ii:1:003:2 0:4 5 = 03000000 00
ffff88040723cb40 4033363736 S Ii:1:003:2 -115:4 8 <
ffff88040723cb40 4033367726 C Ii:1:003:2 0:4 8 = 01000000 00000000
ffff88040723cb40 4033367733 S Ii:1:003:2 -115:4 8 <
ffff8800d8315840 4034295712 C Ii:1:003:1 0:4 8 = 00004200 00000000
ffff8800d8315840 4034295734 S Ii:1:003:1 -115:4 8 <
ffff88040723cb40 4034295737 C Ii:1:003:2 0:4 5 = 03000100 00
ffff88040723cb40 4034295740 S Ii:1:003:2 -115:4 8 <
ffff88040723cb40 4034299722 C Ii:1:003:2 0:4 8 = 01004200 00000000
ffff88040723cb40 4034299730 S Ii:1:003:2 -115:4 8 <
ffff8800d8315840 4034539725 C Ii:1:003:1 0:4 8 = 00000000 00000000
ffff8800d8315840 4034539744 S Ii:1:003:1 -115:4 8 <
ffff88040723cb40 4034539747 C Ii:1:003:2 0:4 5 = 03000000 00
ffff88040723cb40 4034539749 S Ii:1:003:2 -115:4 8 <
ffff88040723cb40 4034543730 C Ii:1:003:2 0:4 8 = 01000000 00000000
ffff88040723cb40 4034543736 S Ii:1:003:2 -115:4 8 <
ffff8800d8315840 4035587722 C Ii:1:003:1 0:4 8 = 00004300 00000000
ffff8800d8315840 4035587746 S Ii:1:003:1 -115:4 8 <
ffff88040723cb40 4035587750 C Ii:1:003:2 0:4 5 = 03000200 00
ffff88040723cb40 4035587753 S Ii:1:003:2 -115:4 8 <
ffff88040723cb40 4035591728 C Ii:1:003:2 0:4 8 = 01004300 00000000
ffff88040723cb40 4035591734 S Ii:1:003:2 -115:4 8 <
ffff8800d8315840 4035835722 C Ii:1:003:1 0:4 8 = 00000000 00000000
ffff8800d8315840 4035835744 S Ii:1:003:1 -115:4 8 <
ffff88040723cb40 4035835747 C Ii:1:003:2 0:4 5 = 03000000 00
ffff88040723cb40 4035835750 S Ii:1:003:2 -115:4 8 <
ffff88040723cb40 4035839729 C Ii:1:003:2 0:4 8 = 01000000 00000000
ffff88040723cb40 4035839735 S Ii:1:003:2 -115:4 8 <
ffff8800d8315840 4036675736 C Ii:1:003:1 0:4 8 = 00004400 00000000
ffff8800d8315840 4036675755 S Ii:1:003:1 -115:4 8 <
ffff88040723cb40 4036675758 C Ii:1:003:2 0:4 5 = 03000400 00
ffff88040723cb40 4036675761 S Ii:1:003:2 -115:4 8 <
ffff88040723cb40 4036679731 C Ii:1:003:2 0:4 8 = 01004400 00000000
ffff88040723cb40 4036679739 S Ii:1:003:2 -115:4 8 <
ffff8800d8315840 4036927737 C Ii:1:003:1 0:4 8 = 00000000 00000000
ffff8800d8315840 4036927753 S Ii:1:003:1 -115:4 8 <
ffff88040723cb40 4036927756 C Ii:1:003:2 0:4 5 = 03000000 00
ffff88040723cb40 4036927758 S Ii:1:003:2 -115:4 8 <
ffff88040723cb40 4036931743 C Ii:1:003:2 0:4 8 = 01000000 00000000
ffff88040723cb40 4036931750 S Ii:1:003:2 -115:4 8 <
ffff8800d8315840 4038199733 C Ii:1:003:1 0:4 8 = 00004500 00000000
ffff8800d8315840 4038199754 S Ii:1:003:1 -115:4 8 <
ffff88040723cb40 4038199757 C Ii:1:003:2 0:4 5 = 03000800 00
ffff88040723cb40 4038199761 S Ii:1:003:2 -115:4 8 <
ffff88040723cb40 4038203748 C Ii:1:003:2 0:4 8 = 01004500 00000000
ffff88040723cb40 4038203754 S Ii:1:003:2 -115:4 8 <
ffff8800d8315840 4038359743 C Ii:1:003:1 0:4 8 = 00000000 00000000
ffff8800d8315840 4038359763 S Ii:1:003:1 -115:4 8 <
ffff88040723cb40 4038359765 C Ii:1:003:2 0:4 5 = 03000000 00
ffff88040723cb40 4038359767 S Ii:1:003:2 -115:4 8 <
ffff88040723cb40 4038363748 C Ii:1:003:2 0:4 8 = 01000000 00000000
ffff88040723cb40 4038363754 S Ii:1:003:2 -115:4 8 <
ffff8800d8315840 4039667749 C Ii:1:003:1 0:4 8 = 00001e00 00000000
ffff8800d8315840 4039667771 S Ii:1:003:1 -115:4 8 <
ffff88040723cb40 4039667775 C Ii:1:003:2 0:4 5 = 03001000 00
ffff88040723cb40 4039667777 S Ii:1:003:2 -115:4 8 <
ffff88040723cb40 4039671756 C Ii:1:003:2 0:4 8 = 01001e00 00000000
ffff88040723cb40 4039671762 S Ii:1:003:2 -115:4 8 <
ffff8800d8315840 4039883749 C Ii:1:003:1 0:4 8 = 00000000 00000000
ffff8800d8315840 4039883768 S Ii:1:003:1 -115:4 8 <
ffff88040723cb40 4039883771 C Ii:1:003:2 0:4 5 = 03000000 00
ffff88040723cb40 4039883773 S Ii:1:003:2 -115:4 8 <
ffff88040723cb40 4039887757 C Ii:1:003:2 0:4 8 = 01000000 00000000
ffff88040723cb40 4039887763 S Ii:1:003:2 -115:4 8 <
ffff8800d8315840 4040639744 C Ii:1:003:1 0:4 8 = 00001f00 00000000
ffff8800d8315840 4040639765 S Ii:1:003:1 -115:4 8 <
ffff88040723cb40 4040639768 C Ii:1:003:2 0:4 5 = 03002000 00
ffff88040723cb40 4040639771 S Ii:1:003:2 -115:4 8 <
ffff88040723cb40 4040643748 C Ii:1:003:2 0:4 8 = 01001f00 00000000
ffff88040723cb40 4040643751 S Ii:1:003:2 -115:4 8 <
ffff8800d8315840 4040815746 C Ii:1:003:1 0:4 8 = 00000000 00000000
ffff8800d8315840 4040815769 S Ii:1:003:1 -115:4 8 <
ffff88040723cb40 4040815772 C Ii:1:003:2 0:4 5 = 03000000 00
ffff88040723cb40 4040815775 S Ii:1:003:2 -115:4 8 <
ffff88040723cb40 4040819752 C Ii:1:003:2 0:4 8 = 01000000 00000000
ffff88040723cb40 4040819760 S Ii:1:003:2 -115:4 8 <
ffff8800d8315840 4041379747 C Ii:1:003:1 0:4 8 = 00002000 00000000
ffff8800d8315840 4041379770 S Ii:1:003:1 -115:4 8 <
ffff88040723cb40 4041379773 C Ii:1:003:2 0:4 5 = 03004000 00
ffff88040723cb40 4041379776 S Ii:1:003:2 -115:4 8 <
ffff88040723cb40 4041383754 C Ii:1:003:2 0:4 8 = 01002000 00000000
ffff88040723cb40 4041383761 S Ii:1:003:2 -115:4 8 <
ffff8800d8315840 4041575760 C Ii:1:003:1 0:4 8 = 00000000 00000000
ffff8800d8315840 4041575779 S Ii:1:003:1 -115:4 8 <
ffff88040723cb40 4041575782 C Ii:1:003:2 0:4 5 = 03000000 00
ffff88040723cb40 4041575784 S Ii:1:003:2 -115:4 8 <
ffff88040723cb40 4041579754 C Ii:1:003:2 0:4 8 = 01000000 00000000
ffff88040723cb40 4041579761 S Ii:1:003:2 -115:4 8 <
ffff8800d8315840 4042291763 C Ii:1:003:1 0:4 8 = 00002100 00000000
ffff8800d8315840 4042291783 S Ii:1:003:1 -115:4 8 <
ffff88040723cb40 4042291786 C Ii:1:003:2 0:4 5 = 03008000 00
ffff88040723cb40 4042291789 S Ii:1:003:2 -115:4 8 <
ffff88040723cb40 4042295761 C Ii:1:003:2 0:4 8 = 01002100 00000000
ffff88040723cb40 4042295768 S Ii:1:003:2 -115:4 8 <
ffff8800d8315840 4042479756 C Ii:1:003:1 0:4 8 = 00000000 00000000
ffff8800d8315840 4042479778 S Ii:1:003:1 -115:4 8 <
ffff88040723cb40 4042479781 C Ii:1:003:2 0:4 5 = 03000000 00
ffff88040723cb40 4042479783 S Ii:1:003:2 -115:4 8 <
ffff88040723cb40 4042483761 C Ii:1:003:2 0:4 8 = 01000000 00000000
ffff88040723cb40 4042483769 S Ii:1:003:2 -115:4 8 <
ffff8800d8315840 4042971765 C Ii:1:003:1 0:4 8 = 00002200 00000000
ffff8800d8315840 4042971787 S Ii:1:003:1 -115:4 8 <
ffff88040723cb40 4042971791 C Ii:1:003:2 0:4 5 = 03000001 00
ffff88040723cb40 4042971793 S Ii:1:003:2 -115:4 8 <
ffff88040723cb40 4042975763 C Ii:1:003:2 0:4 8 = 01002200 00000000
ffff88040723cb40 4042975768 S Ii:1:003:2 -115:4 8 <
ffff8800d8315840 4043143766 C Ii:1:003:1 0:4 8 = 00000000 00000000
ffff8800d8315840 4043143787 S Ii:1:003:1 -115:4 8 <
ffff88040723cb40 4043143791 C Ii:1:003:2 0:4 5 = 03000000 00
ffff88040723cb40 4043143793 S Ii:1:003:2 -115:4 8 <
ffff88040723cb40 4043147766 C Ii:1:003:2 0:4 8 = 01000000 00000000
ffff88040723cb40 4043147772 S Ii:1:003:2 -115:4 8 <
ffff8800d8315840 4043687759 C Ii:1:003:1 0:4 8 = 00002300 00000000
ffff8800d8315840 4043687777 S Ii:1:003:1 -115:4 8 <
ffff88040723cb40 4043687780 C Ii:1:003:2 0:4 5 = 03000002 00
ffff88040723cb40 4043687783 S Ii:1:003:2 -115:4 8 <
ffff88040723cb40 4043691765 C Ii:1:003:2 0:4 8 = 01002300 00000000
ffff88040723cb40 4043691771 S Ii:1:003:2 -115:4 8 <
ffff8800d8315840 4043895760 C Ii:1:003:1 0:4 8 = 00000000 00000000
ffff8800d8315840 4043895780 S Ii:1:003:1 -115:4 8 <
ffff88040723cb40 4043895784 C Ii:1:003:2 0:4 5 = 03000000 00
ffff88040723cb40 4043895786 S Ii:1:003:2 -115:4 8 <
ffff88040723cb40 4043899775 C Ii:1:003:2 0:4 8 = 01000000 00000000
ffff88040723cb40 4043899781 S Ii:1:003:2 -115:4 8 <
